02:09:37.042981 IP lamp-ubuntu-s-1vcpu-1gb-tor1-01.ssh > 162.243.190.66.33873: Flags [P.], seq 14524576:14524832, ack 3713, win 501, options [nop,nop,TS val 1501361023 ecr 2205937184], length 256
02:09:37.043039 IP lamp-ubuntu-s-1vcpu-1gb-tor1-01.ssh > 162.243.190.66.33873: Flags [P.], seq 14524832:14525088, ack 3713, win 501, options [nop,nop,TS val 1501361023 ecr 2205937184], length 256
02:09:37.043097 IP lamp-ubuntu-s-1vcpu-1gb-tor1-01.ssh > 162.243.190.66.33873: Flags [P.], seq 14525088:14525344, ack 3713, win 501, options [nop,nop,TS val 1501361023 ecr 2205937184], length 256
02:09:37.043157 IP lamp-ubuntu-s-1vcpu-1gb-tor1-01.ssh > 162.243.190.66.33873: Flags [P.], seq 14525344:14525600, ack 3713, win 501, options [nop,nop,TS val 1501361023 ecr 2205937184], length 256
02:09:37.043212 IP 162.243.190.66.33873 > lamp-ubuntu-s-1vcpu-1gb-tor1-01.ssh: Flags [.], ack 14524320, win 2075, options [nop,nop,TS val 2205937184 ecr 1501361023], length 0
02:09:37.043261 IP lamp-ubuntu-s-1vcpu-1gb-tor1-01.ssh > 162.243.190.66.33873: Flags [P.], seq 14525600:14525856, ack 3713, win 501, options [nop,nop,TS val 1501361024 ecr 2205937184], length 256
02:09:37.043315 IP lamp-ubuntu-s-1vcpu-1gb-tor1-01.ssh > 162.243.190.66.33873: Flags [P.], seq 14525856:14526096, ack 3713, win 501, options [nop,nop,TS val 1501361024 ecr 2205937184], length 240
02:09:37.043368 IP lamp-ubuntu-s-1vcpu-1gb-tor1-01.ssh > 162.243.190.66.33873: Flags [P.], seq 14526096:14526352, ack 3713, win 501, options [nop,nop,TS val 1501361024 ecr 2205937184], length 256
02:09:37.043422 IP lamp-ubuntu-s-1vcpu-1gb-tor1-01.ssh > 162.243.190.66.33873: Flags [P.], seq 14526352:14526608, ack 3713, win 501, options [nop,nop,TS val 1501361024 ecr 2205937184], length 256
02:09:37.043475 IP lamp-ubuntu-s-1vcpu-1gb-tor1-01.ssh > 162.243.190.66.33873: Flags [P.], seq 14526608:14526864, ack 3713, win 501, options [nop,nop,TS val 1501361024 ecr 2205937184], length 256
02:09:37.043527 IP lamp-ubuntu-s-1vcpu-1gb-tor1-01.ssh > 162.243.190.66.33873: Flags [P.], seq 14526864:14527120, ack 3713, win 501, options [nop,nop,TS val 1501361024 ecr 2205937184], length 256
02:09:37.043578 IP lamp-ubuntu-s-1vcpu-1gb-tor1-01.ssh > 162.243.190.66.33873: Flags [P.], seq 14527120:14527376, ack 3713, win 501, options [nop,nop,TS val 1501361024 ecr 2205937184], length 256
02:09:37.043633 IP lamp-ubuntu-s-1vcpu-1gb-tor1-01.ssh > 162.243.190.66.33873: Flags [P.], seq 14527376:14527632, ack 3713, win 501, options [nop,nop,TS val 1501361024 ecr 2205937184], length 256
02:09:37.043686 IP lamp-ubuntu-s-1vcpu-1gb-tor1-01.ssh > 162.243.190.66.33873: Flags [P.], seq 14527632:14527888, ack 3713, win 501, options [nop,nop,TS val 1501361024 ecr 2205937184], length 256
02:09:37.043741 IP lamp-ubuntu-s-1vcpu-1gb-tor1-01.ssh > 162.243.190.66.33873: Flags [P.], seq 14527888:14528144, ack 3713, win 501, options [nop,nop,TS val 1501361024 ecr 2205937184], length 256
02:09:37.043795 IP lamp-ubuntu-s-1vcpu-1gb-tor1-01.ssh > 162.243.190.66.33873: Flags [P.], seq 14528144:14528400, ack 3713, win 501, options [nop,nop,TS val 1501361024 ecr 2205937184], length 256
02:09:37.043859 IP lamp-ubuntu-s-1vcpu-1gb-tor1-01.ssh > 162.243.190.66.33873: Flags [P.], seq 14528400:14528656, ack 3713, win 501, options [nop,nop,TS val 1501361024 ecr 2205937184], length 256
02:09:37.043912 IP lamp-ubuntu-s-1vcpu-1gb-tor1-01.ssh > 162.243.190.66.33873: Flags [P.], seq 14528656:14528912, ack 3713, win 501, options [nop,nop,TS val 1501361024 ecr 2205937184], length 256
02:09:37.043965 IP lamp-ubuntu-s-1vcpu-1gb-tor1-01.ssh > 162.243.190.66.33873: Flags [P.], seq 14528912:14529168, ack 3713, win 501, options [nop,nop,TS val 1501361024 ecr 2205937184], length 256
02:09:37.044018 IP lamp-ubuntu-s-1vcpu-1gb-tor1-01.ssh > 162.243.190.66.33873: Flags [P.], seq 14529168:14529424, ack 3713, win 501, options [nop,nop,TS val 1501361024 ecr 2205937184], length 256
02:09:37.044067 IP 162.243.190.66.33873 > lamp-ubuntu-s-1vcpu-1gb-tor1-01.ssh: Flags [.], ack 14525856, win 2075, options [nop,nop,TS val 2205937185 ecr 1501361023], length 0
02:09:37.044115 IP lamp-ubuntu-s-1vcpu-1gb-tor1-01.ssh > 162.243.190.66.33873: Flags [P.], seq 14529424:14529680, ack 3713, win 501, options [nop,nop,TS val 1501361024 ecr 2205937185], length 256
02:09:37.044168 IP 162.243.190.66.33873 > lamp-ubuntu-s-1vcpu-1gb-tor1-01.ssh: Flags [.], ack 14527376, win 2075, options [nop,nop,TS val 2205937185 ecr 1501361024], length 0
02:09:37.044213 IP lamp-ubuntu-s-1vcpu-1gb-tor1-01.ssh > 162.243.190.66.33873: Flags [P.], seq 14529680:14530112, ack 3713, win 501, options [nop,nop,TS val 1501361024 ecr 2205937185], length 432
02:09:37.044270 IP lamp-ubuntu-s-1vcpu-1gb-tor1-01.ssh > 162.243.190.66.33873: Flags [P.], seq 14530112:14530544, ack 3713, win 501, options [nop,nop,TS val 1501361025 ecr 2205937185], length 432
02:09:37.044328 IP lamp-ubuntu-s-1vcpu-1gb-tor1-01.ssh > 162.243.190.66.33873: Flags [P.], seq 14530544:14531056, ack 3713, win 501, options [nop,nop,TS val 1501361025 ecr 2205937185], length 512
02:09:37.044351 IP 162.243.190.66.33873 > lamp-ubuntu-s-1vcpu-1gb-tor1-01.ssh: Flags [.], ack 14528912, win 2075, options [nop,nop,TS val 2205937186 ecr 1501361024], length 0
02:09:37.044425 IP lamp-ubuntu-s-1vcpu-1gb-tor1-01.ssh > 162.243.190.66.33873: Flags [P.], seq 14531056:14531488, ack 3713, win 501, options [nop,nop,TS val 1501361025 ecr 2205937186], length 432
02:09:37.044482 IP lamp-ubuntu-s-1vcpu-1gb-tor1-01.ssh > 162.243.190.66.33873: Flags [P.], seq 14531488:14531744, ack 3713, win 501, options [nop,nop,TS val 1501361025 ecr 2205937186], length 256
02:09:37.044536 IP lamp-ubuntu-s-1vcpu-1gb-tor1-01.ssh > 162.243.190.66.33873: Flags [P.], seq 14531744:14532000, ack 3713, win 501, options [nop,nop,TS val 1501361025 ecr 2205937186], length 256
02:09:37.044593 IP lamp-ubuntu-s-1vcpu-1gb-tor1-01.ssh > 162.243.190.66.33873: Flags [P.], seq 14532000:14532256, ack 3713, win 501, options [nop,nop,TS val 1501361025 ecr 2205937186], length 256
02:09:37.044652 IP lamp-ubuntu-s-1vcpu-1gb-tor1-01.ssh > 162.243.190.66.33873: Flags [P.], seq 14532256:14532512, ack 3713, win 501, options [nop,nop,TS val 1501361025 ecr 2205937186], length 256
02:09:37.044723 IP lamp-ubuntu-s-1vcpu-1gb-tor1-01.ssh > 162.243.190.66.33873: Flags [P.], seq 14532512:14532768, ack 3713, win 501, options [nop,nop,TS val 1501361025 ecr 2205937186], length 256
02:09:37.044774 IP 162.243.190.66.33873 > lamp-ubuntu-s-1vcpu-1gb-tor1-01.ssh: Flags [.], ack 14530544, win 2075, options [nop,nop,TS val 2205937186 ecr 1501361024], length 0
02:09:37.044825 IP lamp-ubuntu-s-1vcpu-1gb-tor1-01.ssh > 162.243.190.66.33873: Flags [P.], seq 14532768:14533200, ack 3713, win 501, options [nop,nop,TS val 1501361025 ecr 2205937186], length 432
02:09:37.044887 IP lamp-ubuntu-s-1vcpu-1gb-tor1-01.ssh > 162.243.190.66.33873: Flags [P.], seq 14533200:14533456, ack 3713, win 501, options [nop,nop,TS val 1501361025 ecr 2205937186], length 256
02:09:37.044945 IP lamp-ubuntu-s-1vcpu-1gb-tor1-01.ssh > 162.243.190.66.33873: Flags [P.], seq 14533456:14533712, ack 3713, win 501, options [nop,nop,TS val 1501361025 ecr 2205937186], length 256
02:09:37.044987 IP 162.243.190.66.33873 > lamp-ubuntu-s-1vcpu-1gb-tor1-01.ssh: Flags [.], ack 14532000, win 2075, options [nop,nop,TS val 2205937186 ecr 1501361025], length 0
02:09:37.045037 IP lamp-ubuntu-s-1vcpu-1gb-tor1-01.ssh > 162.243.190.66.33873: Flags [P.], seq 14533712:14534144, ack 3713, win 501, options [nop,nop,TS val 1501361025 ecr 2205937186], length 432
02:09:37.045100 IP lamp-ubuntu-s-1vcpu-1gb-tor1-01.ssh > 162.243.190.66.33873: Flags [P.], seq 14534144:14534400, ack 3713, win 501, options [nop,nop,TS val 1501361025 ecr 2205937186], length 256
02:09:37.045157 IP lamp-ubuntu-s-1vcpu-1gb-tor1-01.ssh > 162.243.190.66.33873: Flags [P.], seq 14534400:14534656, ack 3713, win 501, options [nop,nop,TS val 1501361025 ecr 2205937186], length 256
02:09:37.045216 IP lamp-ubuntu-s-1vcpu-1gb-tor1-01.ssh > 162.243.190.66.33873: Flags [P.], seq 14534656:14534912, ack 3713, win 501, options [nop,nop,TS val 1501361025 ecr 2205937186], length 256
02:09:37.045276 IP lamp-ubuntu-s-1vcpu-1gb-tor1-01.ssh > 162.243.190.66.33873: Flags [P.], seq 14534912:14535168, ack 3713, win 501, options [nop,nop,TS val 1501361026 ecr 2205937186], length 256
02:09:37.045349 IP lamp-ubuntu-s-1vcpu-1gb-tor1-01.ssh > 162.243.190.66.33873: Flags [P.], seq 14535168:14535424, ack 3713, win 501, options [nop,nop,TS val 1501361026 ecr 2205937186], length 256
02:09:37.045413 IP 162.243.190.66.33873 > lamp-ubuntu-s-1vcpu-1gb-tor1-01.ssh: Flags [.], ack 14533456, win 2075, options [nop,nop,TS val 2205937187 ecr 1501361025], length 0
02:09:37.045468 IP lamp-ubuntu-s-1vcpu-1gb-tor1-01.ssh > 162.243.190.66.33873: Flags [P.], seq 14535424:14535680, ack 3713, win 501, options [nop,nop,TS val 1501361026 ecr 2205937187], length 256
02:09:37.045530 IP lamp-ubuntu-s-1vcpu-1gb-tor1-01.ssh > 162.243.190.66.33873: Flags [P.], seq 14535680:14535920, ack 3713, win 501, options [nop,nop,TS val 1501361026 ecr 2205937187], length 240
02:09:37.045579 IP lamp-ubuntu-s-1vcpu-1gb-tor1-01.ssh > 162.243.190.66.33873: Flags [P.], seq 14535920:14536176, ack 3713, win 501, options [nop,nop,TS val 1501361026 ecr 2205937187], length 256
02:09:37.045628 IP 162.243.190.66.33873 > lamp-ubuntu-s-1vcpu-1gb-tor1-01.ssh: Flags [.], ack 14534912, win 2075, options [nop,nop,TS val 2205937187 ecr 1501361025], length 0
02:09:37.045667 IP lamp-ubuntu-s-1vcpu-1gb-tor1-01.ssh > 162.243.190.66.33873: Flags [P.], seq 14536176:14536432, ack 3713, win 501, options [nop,nop,TS val 1501361026 ecr 2205937187], length 256
02:09:37.045724 IP lamp-ubuntu-s-1vcpu-1gb-tor1-01.ssh > 162.243.190.66.33873: Flags [P.], seq 14536432:14536864, ack 3713, win 501, options [nop,nop,TS val 1501361026 ecr 2205937187], length 432
02:09:37.045775 IP lamp-ubuntu-s-1vcpu-1gb-tor1-01.ssh > 162.243.190.66.33873: Flags [P.], seq 14536864:14537120, ack 3713, win 501, options [nop,nop,TS val 1501361026 ecr 2205937187], length 256
02:09:37.045827 IP lamp-ubuntu-s-1vcpu-1gb-tor1-01.ssh > 162.243.190.66.33873: Flags [P.], seq 14537120:14537376, ack 3713, win 501, options [nop,nop,TS val 1501361026 ecr 2205937187], length 256
02:09:37.045878 IP lamp-ubuntu-s-1vcpu-1gb-tor1-01.ssh > 162.243.190.66.33873: Flags [P.], seq 14537376:14537632, ack 3713, win 501, options [nop,nop,TS val 1501361026 ecr 2205937187], length 256
02:09:37.045932 IP lamp-ubuntu-s-1vcpu-1gb-tor1-01.ssh > 162.243.190.66.33873: Flags [P.], seq 14537632:14537888, ack 3713, win 501, options [nop,nop,TS val 1501361026 ecr 2205937187], length 256
02:09:37.045990 IP lamp-ubuntu-s-1vcpu-1gb-tor1-01.ssh > 162.243.190.66.33873: Flags [P.], seq 14537888:14538144, ack 3713, win 501, options [nop,nop,TS val 1501361026 ecr 2205937187], length 256
02:09:37.046045 IP lamp-ubuntu-s-1vcpu-1gb-tor1-01.ssh > 162.243.190.66.33873: Flags [P.], seq 14538144:14538400, ack 3713, win 501, options [nop,nop,TS val 1501361026 ecr 2205937187], length 256
02:09:37.046100 IP lamp-ubuntu-s-1vcpu-1gb-tor1-01.ssh > 162.243.190.66.33873: Flags [P.], seq 14538400:14538656, ack 3713, win 501, options [nop,nop,TS val 1501361026 ecr 2205937187], length 256
02:09:37.046159 IP lamp-ubuntu-s-1vcpu-1gb-tor1-01.ssh > 162.243.190.66.33873: Flags [P.], seq 14538656:14539168, ack 3713, win 501, options [nop,nop,TS val 1501361026 ecr 2205937187], length 512
02:09:37.046225 IP lamp-ubuntu-s-1vcpu-1gb-tor1-01.ssh > 162.243.190.66.33873: Flags [P.], seq 14539168:14539424, ack 3713, win 501, options [nop,nop,TS val 1501361026 ecr 2205937187], length 256
02:09:37.046284 IP lamp-ubuntu-s-1vcpu-1gb-tor1-01.ssh > 162.243.190.66.33873: Flags [P.], seq 14539424:14539680, ack 3713, win 501, options [nop,nop,TS val 1501361027 ecr 2205937187], length 256
02:09:37.046341 IP lamp-ubuntu-s-1vcpu-1gb-tor1-01.ssh > 162.243.190.66.33873: Flags [P.], seq 14539680:14539936, ack 3713, win 501, options [nop,nop,TS val 1501361027 ecr 2205937187], length 256
02:09:37.046391 IP 162.243.190.66.33873 > lamp-ubuntu-s-1vcpu-1gb-tor1-01.ssh: Flags [.], ack 14536432, win 2075, options [nop,nop,TS val 2205937188 ecr 1501361026], length 0
02:09:37.046391 IP 162.243.190.66.33873 > lamp-ubuntu-s-1vcpu-1gb-tor1-01.ssh: Flags [.], ack 14537888, win 2075, options [nop,nop,TS val 2205937188 ecr 1501361026], length 0
02:09:37.046458 IP lamp-ubuntu-s-1vcpu-1gb-tor1-01.ssh > 162.243.190.66.33873: Flags [P.], seq 14539936:14540544, ack 3713, win 501, options [nop,nop,TS val 1501361027 ecr 2205937188], length 608
02:09:37.046516 IP lamp-ubuntu-s-1vcpu-1gb-tor1-01.ssh > 162.243.190.66.33873: Flags [P.], seq 14540544:14540800, ack 3713, win 501, options [nop,nop,TS val 1501361027 ecr 2205937188], length 256
02:09:37.046572 IP lamp-ubuntu-s-1vcpu-1gb-tor1-01.ssh > 162.243.190.66.33873: Flags [P.], seq 14540800:14541056, ack 3713, win 501, options [nop,nop,TS val 1501361027 ecr 2205937188], length 256
02:09:37.046631 IP lamp-ubuntu-s-1vcpu-1gb-tor1-01.ssh > 162.243.190.66.33873: Flags [P.], seq 14541056:14541312, ack 3713, win 501, options [nop,nop,TS val 1501361027 ecr 2205937188], length 256
02:09:37.046689 IP lamp-ubuntu-s-1vcpu-1gb-tor1-01.ssh > 162.243.190.66.33873: Flags [P.], seq 14541312:14541568, ack 3713, win 501, options [nop,nop,TS val 1501361027 ecr 2205937188], length 256
02:09:37.046747 IP lamp-ubuntu-s-1vcpu-1gb-tor1-01.ssh > 162.243.190.66.33873: Flags [P.], seq 14541568:14541824, ack 3713, win 501, options [nop,nop,TS val 1501361027 ecr 2205937188], length 256
02:09:37.046762 IP 162.243.190.66.33873 > lamp-ubuntu-s-1vcpu-1gb-tor1-01.ssh: Flags [.], ack 14539424, win 2075, options [nop,nop,TS val 2205937188 ecr 1501361026], length 0
02:09:37.046852 IP lamp-ubuntu-s-1vcpu-1gb-tor1-01.ssh > 162.243.190.66.33873: Flags [P.], seq 14541824:14542256, ack 3713, win 501, options [nop,nop,TS val 1501361027 ecr 2205937188], length 432
02:09:37.046913 IP lamp-ubuntu-s-1vcpu-1gb-tor1-01.ssh > 162.243.190.66.33873: Flags [P.], seq 14542256:14542512, ack 3713, win 501, options [nop,nop,TS val 1501361027 ecr 2205937188], length 256
02:09:37.046989 IP 162.243.190.66.33873 > lamp-ubuntu-s-1vcpu-1gb-tor1-01.ssh: Flags [.], ack 14541056, win 2075, options [nop,nop,TS val 2205937188 ecr 1501361027], length 0
02:09:37.047036 IP lamp-ubuntu-s-1vcpu-1gb-tor1-01.ssh > 162.243.190.66.33873: Flags [P.], seq 14542512:14542768, ack 3713, win 501, options [nop,nop,TS val 1501361027 ecr 2205937188], length 256
02:09:37.047096 IP lamp-ubuntu-s-1vcpu-1gb-tor1-01.ssh > 162.243.190.66.33873: Flags [P.], seq 14542768:14543008, ack 3713, win 501, options [nop,nop,TS val 1501361027 ecr 2205937188], length 240
02:09:37.047145 IP lamp-ubuntu-s-1vcpu-1gb-tor1-01.ssh > 162.243.190.66.33873: Flags [P.], seq 14543008:14543264, ack 3713, win 501, options [nop,nop,TS val 1501361027 ecr 2205937188], length 256
02:09:37.047193 IP lamp-ubuntu-s-1vcpu-1gb-tor1-01.ssh > 162.243.190.66.33873: Flags [P.], seq 14543264:14543520, ack 3713, win 501, options [nop,nop,TS val 1501361027 ecr 2205937188], length 256
02:09:37.047241 IP lamp-ubuntu-s-1vcpu-1gb-tor1-01.ssh > 162.243.190.66.33873: Flags [P.], seq 14543520:14543776, ack 3713, win 501, options [nop,nop,TS val 1501361027 ecr 2205937188], length 256
02:09:37.047283 IP 162.243.190.66.33873 > lamp-ubuntu-s-1vcpu-1gb-tor1-01.ssh: Flags [.], ack 14542512, win 2075, options [nop,nop,TS val 2205937188 ecr 1501361027], length 0
02:09:37.047322 IP lamp-ubuntu-s-1vcpu-1gb-tor1-01.ssh > 162.243.190.66.33873: Flags [P.], seq 14543776:14544032, ack 3713, win 501, options [nop,nop,TS val 1501361028 ecr 2205937188], length 256
02:09:37.047378 IP lamp-ubuntu-s-1vcpu-1gb-tor1-01.ssh > 162.243.190.66.33873: Flags [P.], seq 14544032:14544464, ack 3713, win 501, options [nop,nop,TS val 1501361028 ecr 2205937188], length 432
02:09:37.047433 IP lamp-ubuntu-s-1vcpu-1gb-tor1-01.ssh > 162.243.190.66.33873: Flags [P.], seq 14544464:14544720, ack 3713, win 501, options [nop,nop,TS val 1501361028 ecr 2205937188], length 256
02:09:37.047488 IP lamp-ubuntu-s-1vcpu-1gb-tor1-01.ssh > 162.243.190.66.33873: Flags [P.], seq 14544720:14544976, ack 3713, win 501, options [nop,nop,TS val 1501361028 ecr 2205937188], length 256
02:09:37.047536 IP lamp-ubuntu-s-1vcpu-1gb-tor1-01.ssh > 162.243.190.66.33873: Flags [P.], seq 14544976:14545232, ack 3713, win 501, options [nop,nop,TS val 1501361028 ecr 2205937188], length 256
02:09:37.047583 IP lamp-ubuntu-s-1vcpu-1gb-tor1-01.ssh > 162.243.190.66.33873: Flags [P.], seq 14545232:14545488, ack 3713, win 501, options [nop,nop,TS val 1501361028 ecr 2205937188], length 256
02:09:37.047629 IP lamp-ubuntu-s-1vcpu-1gb-tor1-01.ssh > 162.243.190.66.33873: Flags [P.], seq 14545488:14545744, ack 3713, win 501, options [nop,nop,TS val 1501361028 ecr 2205937188], length 256
02:09:37.047676 IP 162.243.190.66.33873 > lamp-ubuntu-s-1vcpu-1gb-tor1-01.ssh: Flags [.], ack 14544032, win 2075, options [nop,nop,TS val 2205937189 ecr 1501361027], length 0
02:09:37.047716 IP lamp-ubuntu-s-1vcpu-1gb-tor1-01.ssh > 162.243.190.66.33873: Flags [P.], seq 14545744:14546000, ack 3713, win 501, options [nop,nop,TS val 1501361028 ecr 2205937189], length 256
02:09:37.047770 IP lamp-ubuntu-s-1vcpu-1gb-tor1-01.ssh > 162.243.190.66.33873: Flags [P.], seq 14546000:14546432, ack 3713, win 501, options [nop,nop,TS val 1501361028 ecr 2205937189], length 432
02:09:37.047817 IP lamp-ubuntu-s-1vcpu-1gb-tor1-01.ssh > 162.243.190.66.33873: Flags [P.], seq 14546432:14546688, ack 3713, win 501, options [nop,nop,TS val 1501361028 ecr 2205937189], length 256
02:09:37.047863 IP lamp-ubuntu-s-1vcpu-1gb-tor1-01.ssh > 162.243.190.66.33873: Flags [P.], seq 14546688:14546944, ack 3713, win 501, options [nop,nop,TS val 1501361028 ecr 2205937189], length 256
02:09:37.047912 IP lamp-ubuntu-s-1vcpu-1gb-tor1-01.ssh > 162.243.190.66.33873: Flags [P.], seq 14546944:14547200, ack 3713, win 501, options [nop,nop,TS val 1501361028 ecr 2205937189], length 256
02:09:37.047958 IP lamp-ubuntu-s-1vcpu-1gb-tor1-01.ssh > 162.243.190.66.33873: Flags [P.], seq 14547200:14547456, ack 3713, win 501, options [nop,nop,TS val 1501361028 ecr 2205937189], length 256
02:09:37.048005 IP lamp-ubuntu-s-1vcpu-1gb-tor1-01.ssh > 162.243.190.66.33873: Flags [P.], seq 14547456:14547712, ack 3713, win 501, options [nop,nop,TS val 1501361028 ecr 2205937189], length 256
02:09:37.048054 IP lamp-ubuntu-s-1vcpu-1gb-tor1-01.ssh > 162.243.190.66.33873: Flags [P.], seq 14547712:14547968, ack 3713, win 501, options [nop,nop,TS val 1501361028 ecr 2205937189], length 256
02:09:37.048071 IP 162.243.190.66.33873 > lamp-ubuntu-s-1vcpu-1gb-tor1-01.ssh: Flags [.], ack 14545488, win 2075, options [nop,nop,TS val 2205937189 ecr 1501361028], length 0
02:09:37.048134 IP lamp-ubuntu-s-1vcpu-1gb-tor1-01.ssh > 162.243.190.66.33873: Flags [P.], seq 14547968:14548656, ack 3713, win 501, options [nop,nop,TS val 1501361028 ecr 2205937189], length 688
02:09:37.048284 IP lamp-ubuntu-s-1vcpu-1gb-tor1-01.ssh > 162.243.190.66.33873: Flags [P.], seq 14548656:14548912, ack 3713, win 501, options [nop,nop,TS val 1501361029 ecr 2205937189], length 256
02:09:37.048341 IP lamp-ubuntu-s-1vcpu-1gb-tor1-01.ssh > 162.243.190.66.33873: Flags [P.], seq 14548912:14549168, ack 3713, win 501, options [nop,nop,TS val 1501361029 ecr 2205937189], length 256
02:09:37.048397 IP lamp-ubuntu-s-1vcpu-1gb-tor1-01.ssh > 162.243.190.66.33873: Flags [P.], seq 14549168:14549424, ack 3713, win 501, options [nop,nop,TS val 1501361029 ecr 2205937189], length 256
02:09:37.048447 IP 162.243.190.66.33873 > lamp-ubuntu-s-1vcpu-1gb-tor1-01.ssh: Flags [.], ack 14546944, win 2075, options [nop,nop,TS val 2205937190 ecr 1501361028], length 0
02:09:37.048487 IP lamp-ubuntu-s-1vcpu-1gb-tor1-01.ssh > 162.243.190.66.33873: Flags [P.], seq 14549424:14549680, ack 3713, win 501, options [nop,nop,TS val 1501361029 ecr 2205937190], length 256
02:09:37.048538 IP lamp-ubuntu-s-1vcpu-1gb-tor1-01.ssh > 162.243.190.66.33873: Flags [P.], seq 14549680:14550176, ack 3713, win 501, options [nop,nop,TS val 1501361029 ecr 2205937190], length 496
02:09:37.048642 IP 162.243.190.66.33873 > lamp-ubuntu-s-1vcpu-1gb-tor1-01.ssh: Flags [.], ack 14548656, win 2075, options [nop,nop,TS val 2205937190 ecr 1501361028], length 0
02:09:37.048656 IP lamp-ubuntu-s-1vcpu-1gb-tor1-01.ssh > 162.243.190.66.33873: Flags [P.], seq 14550176:14550432, ack 3713, win 501, options [nop,nop,TS val 1501361029 ecr 2205937190], length 256
02:09:37.048739 IP lamp-ubuntu-s-1vcpu-1gb-tor1-01.ssh > 162.243.190.66.33873: Flags [P.], seq 14550432:14550864, ack 3713, win 501, options [nop,nop,TS val 1501361029 ecr 2205937190], length 432
02:09:37.048941 IP lamp-ubuntu-s-1vcpu-1gb-tor1-01.ssh > 162.243.190.66.33873: Flags [P.], seq 14550864:14551120, ack 3713, win 501, options [nop,nop,TS val 1501361029 ecr 2205937190], length 256
02:09:37.049017 IP lamp-ubuntu-s-1vcpu-1gb-tor1-01.ssh > 162.243.190.66.33873: Flags [P.], seq 14551120:14551376, ack 3713, win 501, options [nop,nop,TS val 1501361029 ecr 2205937190], length 256
02:09:37.049086 IP lamp-ubuntu-s-1vcpu-1gb-tor1-01.ssh > 162.243.190.66.33873: Flags [P.], seq 14551376:14551632, ack 3713, win 501, options [nop,nop,TS val 1501361029 ecr 2205937190], length 256
02:09:37.049108 IP 162.243.190.66.33873 > lamp-ubuntu-s-1vcpu-1gb-tor1-01.ssh: Flags [.], ack 14550176, win 2075, options [nop,nop,TS val 2205937190 ecr 1501361029], length 0
02:09:37.049182 IP lamp-ubuntu-s-1vcpu-1gb-tor1-01.ssh > 162.243.190.66.33873: Flags [P.], seq 14551632:14552064, ack 3713, win 501, options [nop,nop,TS val 1501361029 ecr 2205937190], length 432
02:09:37.049237 IP lamp-ubuntu-s-1vcpu-1gb-tor1-01.ssh > 162.243.190.66.33873: Flags [P.], seq 14552064:14552320, ack 3713, win 501, options [nop,nop,TS val 1501361029 ecr 2205937190], length 256
02:09:37.049292 IP lamp-ubuntu-s-1vcpu-1gb-tor1-01.ssh > 162.243.190.66.33873: Flags [P.], seq 14552320:14552576, ack 3713, win 501, options [nop,nop,TS val 1501361030 ecr 2205937190], length 256
02:09:37.049360 IP lamp-ubuntu-s-1vcpu-1gb-tor1-01.ssh > 162.243.190.66.33873: Flags [P.], seq 14552576:14552832, ack 3713, win 501, options [nop,nop,TS val 1501361030 ecr 2205937190], length 256
02:09:37.049434 IP lamp-ubuntu-s-1vcpu-1gb-tor1-01.ssh > 162.243.190.66.33873: Flags [P.], seq 14552832:14553088, ack 3713, win 501, options [nop,nop,TS val 1501361030 ecr 2205937190], length 256
02:09:37.049501 IP lamp-ubuntu-s-1vcpu-1gb-tor1-01.ssh > 162.243.190.66.33873: Flags [P.], seq 14553088:14553344, ack 3713, win 501, options [nop,nop,TS val 1501361030 ecr 2205937190], length 256
02:09:37.049512 IP 162.243.190.66.33873 > lamp-ubuntu-s-1vcpu-1gb-tor1-01.ssh: Flags [.], ack 14551632, win 2075, options [nop,nop,TS val 2205937191 ecr 1501361029], length 0
02:09:37.049586 IP lamp-ubuntu-s-1vcpu-1gb-tor1-01.ssh > 162.243.190.66.33873: Flags [P.], seq 14553344:14553776, ack 3713, win 501, options [nop,nop,TS val 1501361030 ecr 2205937191], length 432
02:09:37.049666 IP lamp-ubuntu-s-1vcpu-1gb-tor1-01.ssh > 162.243.190.66.33873: Flags [P.], seq 14553776:14554032, ack 3713, win 501, options [nop,nop,TS val 1501361030 ecr 2205937191], length 256
02:09:37.049721 IP lamp-ubuntu-s-1vcpu-1gb-tor1-01.ssh > 162.243.190.66.33873: Flags [P.], seq 14554032:14554288, ack 3713, win 501, options [nop,nop,TS val 1501361030 ecr 2205937191], length 256
02:09:37.049783 IP 162.243.190.66.33873 > lamp-ubuntu-s-1vcpu-1gb-tor1-01.ssh: Flags [.], ack 14553088, win 2075, options [nop,nop,TS val 2205937191 ecr 1501361029], length 0
02:09:37.049793 IP lamp-ubuntu-s-1vcpu-1gb-tor1-01.ssh > 162.243.190.66.33873: Flags [P.], seq 14554288:14554544, ack 3713, win 501, options [nop,nop,TS val 1501361030 ecr 2205937191], length 256
02:09:37.049855 IP lamp-ubuntu-s-1vcpu-1gb-tor1-01.ssh > 162.243.190.66.33873: Flags [P.], seq 14554544:14554976, ack 3713, win 501, options [nop,nop,TS val 1501361030 ecr 2205937191], length 432
02:09:37.049907 IP lamp-ubuntu-s-1vcpu-1gb-tor1-01.ssh > 162.243.190.66.33873: Flags [P.], seq 14554976:14555232, ack 3713, win 501, options [nop,nop,TS val 1501361030 ecr 2205937191], length 256
02:09:37.049958 IP lamp-ubuntu-s-1vcpu-1gb-tor1-01.ssh > 162.243.190.66.33873: Flags [P.], seq 14555232:14555488, ack 3713, win 501, options [nop,nop,TS val 1501361030 ecr 2205937191], length 256
02:09:37.050029 IP lamp-ubuntu-s-1vcpu-1gb-tor1-01.ssh > 162.243.190.66.33873: Flags [P.], seq 14555488:14555744, ack 3713, win 501, options [nop,nop,TS val 1501361030 ecr 2205937191], length 256
02:09:37.050082 IP lamp-ubuntu-s-1vcpu-1gb-tor1-01.ssh > 162.243.190.66.33873: Flags [P.], seq 14555744:14556000, ack 3713, win 501, options [nop,nop,TS val 1501361030 ecr 2205937191], length 256
02:09:37.050180 IP 162.243.190.66.33873 > lamp-ubuntu-s-1vcpu-1gb-tor1-01.ssh: Flags [.], ack 14554544, win 2075, options [nop,nop,TS val 2205937191 ecr 1501361030], length 0
02:09:37.050194 IP lamp-ubuntu-s-1vcpu-1gb-tor1-01.ssh > 162.243.190.66.33873: Flags [P.], seq 14556000:14556256, ack 3713, win 501, options [nop,nop,TS val 1501361030 ecr 2205937191], length 256
02:09:37.050266 IP lamp-ubuntu-s-1vcpu-1gb-tor1-01.ssh > 162.243.190.66.33873: Flags [P.], seq 14556256:14556688, ack 3713, win 501, options [nop,nop,TS val 1501361031 ecr 2205937191], length 432
02:09:37.050311 IP lamp-ubuntu-s-1vcpu-1gb-tor1-01.ssh > 162.243.190.66.33873: Flags [P.], seq 14556688:14556944, ack 3713, win 501, options [nop,nop,TS val 1501361031 ecr 2205937191], length 256
02:09:37.050358 IP lamp-ubuntu-s-1vcpu-1gb-tor1-01.ssh > 162.243.190.66.33873: Flags [P.], seq 14556944:14557200, ack 3713, win 501, options [nop,nop,TS val 1501361031 ecr 2205937191], length 256
02:09:37.050419 IP 162.243.190.66.33873 > lamp-ubuntu-s-1vcpu-1gb-tor1-01.ssh: Flags [.], ack 14556000, win 2075, options [nop,nop,TS val 2205937192 ecr 1501361030], length 0
02:09:37.050462 IP lamp-ubuntu-s-1vcpu-1gb-tor1-01.ssh > 162.243.190.66.33873: Flags [P.], seq 14557200:14557632, ack 3713, win 501, options [nop,nop,TS val 1501361031 ecr 2205937192], length 432
02:09:37.050541 IP lamp-ubuntu-s-1vcpu-1gb-tor1-01.ssh > 162.243.190.66.33873: Flags [P.], seq 14557632:14557888, ack 3713, win 501, options [nop,nop,TS val 1501361031 ecr 2205937192], length 256
02:09:37.050602 IP lamp-ubuntu-s-1vcpu-1gb-tor1-01.ssh > 162.243.190.66.33873: Flags [P.], seq 14557888:14558144, ack 3713, win 501, options [nop,nop,TS val 1501361031 ecr 2205937192], length 256
02:09:37.050651 IP lamp-ubuntu-s-1vcpu-1gb-tor1-01.ssh > 162.243.190.66.33873: Flags [P.], seq 14558144:14558400, ack 3713, win 501, options [nop,nop,TS val 1501361031 ecr 2205937192], length 256
02:09:37.050692 IP lamp-ubuntu-s-1vcpu-1gb-tor1-01.ssh > 162.243.190.66.33873: Flags [P.], seq 14558400:14558656, ack 3713, win 501, options [nop,nop,TS val 1501361031 ecr 2205937192], length 256
02:09:37.050732 IP lamp-ubuntu-s-1vcpu-1gb-tor1-01.ssh > 162.243.190.66.33873: Flags [P.], seq 14558656:14558912, ack 3713, win 501, options [nop,nop,TS val 1501361031 ecr 2205937192], length 256
02:09:37.050769 IP lamp-ubuntu-s-1vcpu-1gb-tor1-01.ssh > 162.243.190.66.33873: Flags [P.], seq 14558912:14559168, ack 3713, win 501, options [nop,nop,TS val 1501361031 ecr 2205937192], length 256
02:09:37.050822 IP lamp-ubuntu-s-1vcpu-1gb-tor1-01.ssh > 162.243.190.66.33873: Flags [P.], seq 14559168:14559424, ack 3713, win 501, options [nop,nop,TS val 1501361031 ecr 2205937192], length 256
02:09:37.050868 IP 162.243.190.66.33873 > lamp-ubuntu-s-1vcpu-1gb-tor1-01.ssh: Flags [.], ack 14557632, win 2075, options [nop,nop,TS val 2205937192 ecr 1501361030], length 0
02:09:37.050898 IP lamp-ubuntu-s-1vcpu-1gb-tor1-01.ssh > 162.243.190.66.33873: Flags [P.], seq 14559424:14559680, ack 3713, win 501, options [nop,nop,TS val 1501361031 ecr 2205937192], length 256
02:09:37.050951 IP lamp-ubuntu-s-1vcpu-1gb-tor1-01.ssh > 162.243.190.66.33873: Flags [P.], seq 14559680:14559920, ack 3713, win 501, options [nop,nop,TS val 1501361031 ecr 2205937192], length 240
02:09:37.050983 IP lamp-ubuntu-s-1vcpu-1gb-tor1-01.ssh > 162.243.190.66.33873: Flags [P.], seq 14559920:14560176, ack 3713, win 501, options [nop,nop,TS val 1501361031 ecr 2205937192], length 256
02:09:37.051027 IP lamp-ubuntu-s-1vcpu-1gb-tor1-01.ssh > 162.243.190.66.33873: Flags [P.], seq 14560176:14560432, ack 3713, win 501, options [nop,nop,TS val 1501361031 ecr 2205937192], length 256
02:09:37.051068 IP lamp-ubuntu-s-1vcpu-1gb-tor1-01.ssh > 162.243.190.66.33873: Flags [P.], seq 14560432:14560944, ack 3713, win 501, options [nop,nop,TS val 1501361031 ecr 2205937192], length 512
02:09:37.051124 IP 162.243.190.66.33873 > lamp-ubuntu-s-1vcpu-1gb-tor1-01.ssh: Flags [.], ack 14559168, win 2075, options [nop,nop,TS val 2205937192 ecr 1501361031], length 0
02:09:37.051131 IP lamp-ubuntu-s-1vcpu-1gb-tor1-01.ssh > 162.243.190.66.33873: Flags [P.], seq 14560944:14561200, ack 3713, win 501, options [nop,nop,TS val 1501361031 ecr 2205937192], length 256
02:09:37.051193 IP lamp-ubuntu-s-1vcpu-1gb-tor1-01.ssh > 162.243.190.66.33873: Flags [P.], seq 14561200:14561632, ack 3713, win 501, options [nop,nop,TS val 1501361031 ecr 2205937192], length 432
02:09:37.051237 IP lamp-ubuntu-s-1vcpu-1gb-tor1-01.ssh > 162.243.190.66.33873: Flags [P.], seq 14561632:14561888, ack 3713, win 501, options [nop,nop,TS val 1501361031 ecr 2205937192], length 256
02:09:37.051278 IP lamp-ubuntu-s-1vcpu-1gb-tor1-01.ssh > 162.243.190.66.33873: Flags [P.], seq 14561888:14562144, ack 3713, win 501, options [nop,nop,TS val 1501361032 ecr 2205937192], length 256
02:09:37.051342 IP lamp-ubuntu-s-1vcpu-1gb-tor1-01.ssh > 162.243.190.66.33873: Flags [P.], seq 14562144:14562400, ack 3713, win 501, options [nop,nop,TS val 1501361032 ecr 2205937192], length 256
02:09:37.051384 IP lamp-ubuntu-s-1vcpu-1gb-tor1-01.ssh > 162.243.190.66.33873: Flags [P.], seq 14562400:14562656, ack 3713, win 501, options [nop,nop,TS val 1501361032 ecr 2205937192], length 256
02:09:37.051422 IP lamp-ubuntu-s-1vcpu-1gb-tor1-01.ssh > 162.243.190.66.33873: Flags [P.], seq 14562656:14562912, ack 3713, win 501, options [nop,nop,TS val 1501361032 ecr 2205937192], length 256
02:09:37.051467 IP 162.243.190.66.33873 > lamp-ubuntu-s-1vcpu-1gb-tor1-01.ssh: Flags [.], ack 14560944, win 2075, options [nop,nop,TS val 2205937193 ecr 1501361031], length 0
02:09:37.051474 IP lamp-ubuntu-s-1vcpu-1gb-tor1-01.ssh > 162.243.190.66.33873: Flags [P.], seq 14562912:14563168, ack 3713, win 501, options [nop,nop,TS val 1501361032 ecr 2205937193], length 256
02:09:37.051524 IP lamp-ubuntu-s-1vcpu-1gb-tor1-01.ssh > 162.243.190.66.33873: Flags [P.], seq 14563168:14563600, ack 3713, win 501, options [nop,nop,TS val 1501361032 ecr 2205937193], length 432
02:09:37.051562 IP lamp-ubuntu-s-1vcpu-1gb-tor1-01.ssh > 162.243.190.66.33873: Flags [P.], seq 14563600:14563856, ack 3713, win 501, options [nop,nop,TS val 1501361032 ecr 2205937193], length 256
02:09:37.051599 IP lamp-ubuntu-s-1vcpu-1gb-tor1-01.ssh > 162.243.190.66.33873: Flags [P.], seq 14563856:14564112, ack 3713, win 501, options [nop,nop,TS val 1501361032 ecr 2205937193], length 256
02:09:37.051639 IP lamp-ubuntu-s-1vcpu-1gb-tor1-01.ssh > 162.243.190.66.33873: Flags [P.], seq 14564112:14564368, ack 3713, win 501, options [nop,nop,TS val 1501361032 ecr 2205937193], length 256
02:09:37.051679 IP lamp-ubuntu-s-1vcpu-1gb-tor1-01.ssh > 162.243.190.66.33873: Flags [P.], seq 14564368:14564624, ack 3713, win 501, options [nop,nop,TS val 1501361032 ecr 2205937193], length 256
02:09:37.051721 IP 162.243.190.66.33873 > lamp-ubuntu-s-1vcpu-1gb-tor1-01.ssh: Flags [.], ack 14562400, win 2075, options [nop,nop,TS val 2205937193 ecr 1501361031], length 0
02:09:37.051741 IP lamp-ubuntu-s-1vcpu-1gb-tor1-01.ssh > 162.243.190.66.33873: Flags [P.], seq 14564624:14564880, ack 3713, win 501, options [nop,nop,TS val 1501361032 ecr 2205937193], length 256
02:09:37.051784 IP lamp-ubuntu-s-1vcpu-1gb-tor1-01.ssh > 162.243.190.66.33873: Flags [P.], seq 14564880:14565312, ack 3713, win 501, options [nop,nop,TS val 1501361032 ecr 2205937193], length 432
02:09:37.051834 IP lamp-ubuntu-s-1vcpu-1gb-tor1-01.ssh > 162.243.190.66.33873: Flags [P.], seq 14565312:14565568, ack 3713, win 501, options [nop,nop,TS val 1501361032 ecr 2205937193], length 256
02:09:37.051891 IP lamp-ubuntu-s-1vcpu-1gb-tor1-01.ssh > 162.243.190.66.33873: Flags [P.], seq 14565568:14565824, ack 3713, win 501, options [nop,nop,TS val 1501361032 ecr 2205937193], length 256
02:09:37.051946 IP lamp-ubuntu-s-1vcpu-1gb-tor1-01.ssh > 162.243.190.66.33873: Flags [P.], seq 14565824:14566080, ack 3713, win 501, options [nop,nop,TS val 1501361032 ecr 2205937193], length 256
02:09:37.051999 IP 162.243.190.66.33873 > lamp-ubuntu-s-1vcpu-1gb-tor1-01.ssh: Flags [.], ack 14563856, win 2075, options [nop,nop,TS val 2205937193 ecr 1501361032], length 0
02:09:37.052036 IP lamp-ubuntu-s-1vcpu-1gb-tor1-01.ssh > 162.243.190.66.33873: Flags [P.], seq 14566080:14566336, ack 3713, win 501, options [nop,nop,TS val 1501361032 ecr 2205937193], length 256
02:09:37.052089 IP lamp-ubuntu-s-1vcpu-1gb-tor1-01.ssh > 162.243.190.66.33873: Flags [P.], seq 14566336:14566576, ack 3713, win 501, options [nop,nop,TS val 1501361032 ecr 2205937193], length 240
02:09:37.052135 IP 162.243.190.66.33873 > lamp-ubuntu-s-1vcpu-1gb-tor1-01.ssh: Flags [.], ack 14565312, win 2075, options [nop,nop,TS val 2205937193 ecr 1501361032], length 0
02:09:37.052140 IP lamp-ubuntu-s-1vcpu-1gb-tor1-01.ssh > 162.243.190.66.33873: Flags [P.], seq 14566576:14566832, ack 3713, win 501, options [nop,nop,TS val 1501361032 ecr 2205937193], length 256
02:09:37.052210 IP lamp-ubuntu-s-1vcpu-1gb-tor1-01.ssh > 162.243.190.66.33873: Flags [P.], seq 14566832:14567088, ack 3713, win 501, options [nop,nop,TS val 1501361032 ecr 2205937193], length 256
02:09:37.052260 IP lamp-ubuntu-s-1vcpu-1gb-tor1-01.ssh > 162.243.190.66.33873: Flags [P.], seq 14567088:14567520, ack 3713, win 501, options [nop,nop,TS val 1501361033 ecr 2205937193], length 432
02:09:37.052310 IP lamp-ubuntu-s-1vcpu-1gb-tor1-01.ssh > 162.243.190.66.33873: Flags [P.], seq 14567520:14567776, ack 3713, win 501, options [nop,nop,TS val 1501361033 ecr 2205937193], length 256
02:09:37.052358 IP lamp-ubuntu-s-1vcpu-1gb-tor1-01.ssh > 162.243.190.66.33873: Flags [P.], seq 14567776:14568032, ack 3713, win 501, options [nop,nop,TS val 1501361033 ecr 2205937193], length 256
02:09:37.052396 IP lamp-ubuntu-s-1vcpu-1gb-tor1-01.ssh > 162.243.190.66.33873: Flags [P.], seq 14568032:14568288, ack 3713, win 501, options [nop,nop,TS val 1501361033 ecr 2205937193], length 256
02:09:37.052433 IP lamp-ubuntu-s-1vcpu-1gb-tor1-01.ssh > 162.243.190.66.33873: Flags [P.], seq 14568288:14568544, ack 3713, win 501, options [nop,nop,TS val 1501361033 ecr 2205937193], length 256
02:09:37.052471 IP lamp-ubuntu-s-1vcpu-1gb-tor1-01.ssh > 162.243.190.66.33873: Flags [P.], seq 14568544:14568800, ack 3713, win 501, options [nop,nop,TS val 1501361033 ecr 2205937193], length 256
02:09:37.052510 IP lamp-ubuntu-s-1vcpu-1gb-tor1-01.ssh > 162.243.190.66.33873: Flags [P.], seq 14568800:14569056, ack 3713, win 501, options [nop,nop,TS val 1501361033 ecr 2205937193], length 256
02:09:37.052553 IP 162.243.190.66.33873 > lamp-ubuntu-s-1vcpu-1gb-tor1-01.ssh: Flags [.], ack 14566832, win 2075, options [nop,nop,TS val 2205937194 ecr 1501361032], length 0
02:09:37.052562 IP lamp-ubuntu-s-1vcpu-1gb-tor1-01.ssh > 162.243.190.66.33873: Flags [P.], seq 14569056:14569312, ack 3713, win 501, options [nop,nop,TS val 1501361033 ecr 2205937194], length 256
02:09:37.052625 IP lamp-ubuntu-s-1vcpu-1gb-tor1-01.ssh > 162.243.190.66.33873: Flags [P.], seq 14569312:14569568, ack 3713, win 501, options [nop,nop,TS val 1501361033 ecr 2205937194], length 256
02:09:37.052663 IP lamp-ubuntu-s-1vcpu-1gb-tor1-01.ssh > 162.243.190.66.33873: Flags [P.], seq 14569568:14570000, ack 3713, win 501, options [nop,nop,TS val 1501361033 ecr 2205937194], length 432
02:09:37.052842 IP 162.243.190.66.33873 > lamp-ubuntu-s-1vcpu-1gb-tor1-01.ssh: Flags [.], ack 14568288, win 2075, options [nop,nop,TS val 2205937194 ecr 1501361032], length 0
02:09:37.052850 IP lamp-ubuntu-s-1vcpu-1gb-tor1-01.ssh > 162.243.190.66.33873: Flags [P.], seq 14570000:14570512, ack 3713, win 501, options [nop,nop,TS val 1501361033 ecr 2205937194], length 512
02:09:37.052912 IP lamp-ubuntu-s-1vcpu-1gb-tor1-01.ssh > 162.243.190.66.33873: Flags [P.], seq 14570512:14570944, ack 3713, win 501, options [nop,nop,TS val 1501361033 ecr 2205937194], length 432
02:09:37.052952 IP lamp-ubuntu-s-1vcpu-1gb-tor1-01.ssh > 162.243.190.66.33873: Flags [P.], seq 14570944:14571200, ack 3713, win 501, options [nop,nop,TS val 1501361033 ecr 2205937194], length 256
02:09:37.053000 IP lamp-ubuntu-s-1vcpu-1gb-tor1-01.ssh > 162.243.190.66.33873: Flags [P.], seq 14571200:14571456, ack 3713, win 501, options [nop,nop,TS val 1501361033 ecr 2205937194], length 256
02:09:37.053060 IP lamp-ubuntu-s-1vcpu-1gb-tor1-01.ssh > 162.243.190.66.33873: Flags [P.], seq 14571456:14571712, ack 3713, win 501, options [nop,nop,TS val 1501361033 ecr 2205937194], length 256
02:09:37.053116 IP lamp-ubuntu-s-1vcpu-1gb-tor1-01.ssh > 162.243.190.66.33873: Flags [P.], seq 14571712:14571968, ack 3713, win 501, options [nop,nop,TS val 1501361033 ecr 2205937194], length 256
02:09:37.053175 IP 162.243.190.66.33873 > lamp-ubuntu-s-1vcpu-1gb-tor1-01.ssh: Flags [.], ack 14570000, win 2075, options [nop,nop,TS val 2205937194 ecr 1501361033], length 0
02:09:37.053183 IP lamp-ubuntu-s-1vcpu-1gb-tor1-01.ssh > 162.243.190.66.33873: Flags [P.], seq 14571968:14572224, ack 3713, win 501, options [nop,nop,TS val 1501361033 ecr 2205937194], length 256
02:09:37.053258 IP lamp-ubuntu-s-1vcpu-1gb-tor1-01.ssh > 162.243.190.66.33873: Flags [P.], seq 14572224:14572656, ack 3713, win 501, options [nop,nop,TS val 1501361034 ecr 2205937194], length 432
02:09:37.053315 IP 162.243.190.66.33873 > lamp-ubuntu-s-1vcpu-1gb-tor1-01.ssh: Flags [.], ack 14571456, win 2075, options [nop,nop,TS val 2205937195 ecr 1501361033], length 0
02:09:37.053353 IP lamp-ubuntu-s-1vcpu-1gb-tor1-01.ssh > 162.243.190.66.33873: Flags [P.], seq 14572656:14572912, ack 3713, win 501, options [nop,nop,TS val 1501361034 ecr 2205937195], length 256
02:09:37.053406 IP lamp-ubuntu-s-1vcpu-1gb-tor1-01.ssh > 162.243.190.66.33873: Flags [P.], seq 14572912:14573408, ack 3713, win 501, options [nop,nop,TS val 1501361034 ecr 2205937195], length 496
02:09:37.053465 IP lamp-ubuntu-s-1vcpu-1gb-tor1-01.ssh > 162.243.190.66.33873: Flags [P.], seq 14573408:14573664, ack 3713, win 501, options [nop,nop,TS val 1501361034 ecr 2205937195], length 256
02:09:37.053507 IP lamp-ubuntu-s-1vcpu-1gb-tor1-01.ssh > 162.243.190.66.33873: Flags [P.], seq 14573664:14573920, ack 3713, win 501, options [nop,nop,TS val 1501361034 ecr 2205937195], length 256
02:09:37.053564 IP lamp-ubuntu-s-1vcpu-1gb-tor1-01.ssh > 162.243.190.66.33873: Flags [P.], seq 14573920:14574176, ack 3713, win 501, options [nop,nop,TS val 1501361034 ecr 2205937195], length 256
02:09:37.053608 IP lamp-ubuntu-s-1vcpu-1gb-tor1-01.ssh > 162.243.190.66.33873: Flags [P.], seq 14574176:14574432, ack 3713, win 501, options [nop,nop,TS val 1501361034 ecr 2205937195], length 256
02:09:37.053646 IP lamp-ubuntu-s-1vcpu-1gb-tor1-01.ssh > 162.243.190.66.33873: Flags [P.], seq 14574432:14574688, ack 3713, win 501, options [nop,nop,TS val 1501361034 ecr 2205937195], length 256
02:09:37.053709 IP lamp-ubuntu-s-1vcpu-1gb-tor1-01.ssh > 162.243.190.66.33873: Flags [P.], seq 14574688:14574944, ack 3713, win 501, options [nop,nop,TS val 1501361034 ecr 2205937195], length 256
02:09:37.053720 IP 162.243.190.66.33873 > lamp-ubuntu-s-1vcpu-1gb-tor1-01.ssh: Flags [.], ack 14572912, win 2075, options [nop,nop,TS val 2205937195 ecr 1501361033], length 0
02:09:37.053771 IP lamp-ubuntu-s-1vcpu-1gb-tor1-01.ssh > 162.243.190.66.33873: Flags [P.], seq 14574944:14575376, ack 3713, win 501, options [nop,nop,TS val 1501361034 ecr 2205937195], length 432
02:09:37.053833 IP lamp-ubuntu-s-1vcpu-1gb-tor1-01.ssh > 162.243.190.66.33873: Flags [P.], seq 14575376:14575632, ack 3713, win 501, options [nop,nop,TS val 1501361034 ecr 2205937195], length 256
02:09:37.053890 IP lamp-ubuntu-s-1vcpu-1gb-tor1-01.ssh > 162.243.190.66.33873: Flags [P.], seq 14575632:14575888, ack 3713, win 501, options [nop,nop,TS val 1501361034 ecr 2205937195], length 256
02:09:37.053932 IP 162.243.190.66.33873 > lamp-ubuntu-s-1vcpu-1gb-tor1-01.ssh: Flags [.], ack 14574432, win 2075, options [nop,nop,TS val 2205937195 ecr 1501361034], length 0
02:09:37.053969 IP lamp-ubuntu-s-1vcpu-1gb-tor1-01.ssh > 162.243.190.66.33873: Flags [P.], seq 14575888:14576320, ack 3713, win 501, options [nop,nop,TS val 1501361034 ecr 2205937195], length 432
02:09:37.054013 IP lamp-ubuntu-s-1vcpu-1gb-tor1-01.ssh > 162.243.190.66.33873: Flags [P.], seq 14576320:14576576, ack 3713, win 501, options [nop,nop,TS val 1501361034 ecr 2205937195], length 256
02:09:37.054053 IP lamp-ubuntu-s-1vcpu-1gb-tor1-01.ssh > 162.243.190.66.33873: Flags [P.], seq 14576576:14576832, ack 3713, win 501, options [nop,nop,TS val 1501361034 ecr 2205937195], length 256
02:09:37.054091 IP lamp-ubuntu-s-1vcpu-1gb-tor1-01.ssh > 162.243.190.66.33873: Flags [P.], seq 14576832:14577088, ack 3713, win 501, options [nop,nop,TS val 1501361034 ecr 2205937195], length 256
02:09:37.054131 IP lamp-ubuntu-s-1vcpu-1gb-tor1-01.ssh > 162.243.190.66.33873: Flags [P.], seq 14577088:14577344, ack 3713, win 501, options [nop,nop,TS val 1501361034 ecr 2205937195], length 256
02:09:37.054168 IP lamp-ubuntu-s-1vcpu-1gb-tor1-01.ssh > 162.243.190.66.33873: Flags [P.], seq 14577344:14577600, ack 3713, win 501, options [nop,nop,TS val 1501361034 ecr 2205937195], length 256
02:09:37.054219 IP 162.243.190.66.33873 > lamp-ubuntu-s-1vcpu-1gb-tor1-01.ssh: Flags [.], ack 14575888, win 2075, options [nop,nop,TS val 2205937195 ecr 1501361034], length 0
02:09:37.054226 IP lamp-ubuntu-s-1vcpu-1gb-tor1-01.ssh > 162.243.190.66.33873: Flags [P.], seq 14577600:14577856, ack 3713, win 501, options [nop,nop,TS val 1501361034 ecr 2205937195], length 256
02:09:37.054280 IP lamp-ubuntu-s-1vcpu-1gb-tor1-01.ssh > 162.243.190.66.33873: Flags [P.], seq 14577856:14578288, ack 3713, win 501, options [nop,nop,TS val 1501361035 ecr 2205937195], length 432
02:09:37.054343 IP lamp-ubuntu-s-1vcpu-1gb-tor1-01.ssh > 162.243.190.66.33873: Flags [P.], seq 14578288:14578544, ack 3713, win 501, options [nop,nop,TS val 1501361035 ecr 2205937195], length 256
02:09:37.054396 IP lamp-ubuntu-s-1vcpu-1gb-tor1-01.ssh > 162.243.190.66.33873: Flags [P.], seq 14578544:14578800, ack 3713, win 501, options [nop,nop,TS val 1501361035 ecr 2205937195], length 256
02:09:37.054526 IP lamp-ubuntu-s-1vcpu-1gb-tor1-01.ssh > 162.243.190.66.33873: Flags [P.], seq 14578800:14579056, ack 3713, win 501, options [nop,nop,TS val 1501361035 ecr 2205937195], length 256
02:09:37.054542 IP 162.243.190.66.33873 > lamp-ubuntu-s-1vcpu-1gb-tor1-01.ssh: Flags [.], ack 14577344, win 2075, options [nop,nop,TS val 2205937196 ecr 1501361034], length 0
02:09:37.054618 IP lamp-ubuntu-s-1vcpu-1gb-tor1-01.ssh > 162.243.190.66.33873: Flags [P.], seq 14579056:14579488, ack 3713, win 501, options [nop,nop,TS val 1501361035 ecr 2205937196], length 432
02:09:37.054678 IP lamp-ubuntu-s-1vcpu-1gb-tor1-01.ssh > 162.243.190.66.33873: Flags [P.], seq 14579488:14579744, ack 3713, win 501, options [nop,nop,TS val 1501361035 ecr 2205937196], length 256
02:09:37.054846 IP 162.243.190.66.33873 > lamp-ubuntu-s-1vcpu-1gb-tor1-01.ssh: Flags [.], ack 14578800, win 2075, options [nop,nop,TS val 2205937196 ecr 1501361034], length 0
02:09:37.054858 IP lamp-ubuntu-s-1vcpu-1gb-tor1-01.ssh > 162.243.190.66.33873: Flags [P.], seq 14579744:14580000, ack 3713, win 501, options [nop,nop,TS val 1501361035 ecr 2205937196], length 256
02:09:37.054954 IP lamp-ubuntu-s-1vcpu-1gb-tor1-01.ssh > 162.243.190.66.33873: Flags [P.], seq 14580000:14580432, ack 3713, win 501, options [nop,nop,TS val 1501361035 ecr 2205937196], length 432
02:09:37.055021 IP lamp-ubuntu-s-1vcpu-1gb-tor1-01.ssh > 162.243.190.66.33873: Flags [P.], seq 14580432:14580688, ack 3713, win 501, options [nop,nop,TS val 1501361035 ecr 2205937196], length 256
02:09:37.055079 IP lamp-ubuntu-s-1vcpu-1gb-tor1-01.ssh > 162.243.190.66.33873: Flags [P.], seq 14580688:14580944, ack 3713, win 501, options [nop,nop,TS val 1501361035 ecr 2205937196], length 256
02:09:37.055134 IP lamp-ubuntu-s-1vcpu-1gb-tor1-01.ssh > 162.243.190.66.33873: Flags [P.], seq 14580944:14581200, ack 3713, win 501, options [nop,nop,TS val 1501361035 ecr 2205937196], length 256
02:09:37.055284 IP 162.243.190.66.33873 > lamp-ubuntu-s-1vcpu-1gb-tor1-01.ssh: Flags [.], ack 14580432, win 2075, options [nop,nop,TS val 2205937197 ecr 1501361035], length 0
02:09:37.055299 IP lamp-ubuntu-s-1vcpu-1gb-tor1-01.ssh > 162.243.190.66.33873: Flags [P.], seq 14581200:14581456, ack 3713, win 501, options [nop,nop,TS val 1501361036 ecr 2205937197], length 256
02:09:37.055393 IP lamp-ubuntu-s-1vcpu-1gb-tor1-01.ssh > 162.243.190.66.33873: Flags [P.], seq 14581456:14581888, ack 3713, win 501, options [nop,nop,TS val 1501361036 ecr 2205937197], length 432
02:09:37.055451 IP lamp-ubuntu-s-1vcpu-1gb-tor1-01.ssh > 162.243.190.66.33873: Flags [P.], seq 14581888:14582144, ack 3713, win 501, options [nop,nop,TS val 1501361036 ecr 2205937197], length 256
02:09:37.055495 IP lamp-ubuntu-s-1vcpu-1gb-tor1-01.ssh > 162.243.190.66.33873: Flags [P.], seq 14582144:14582400, ack 3713, win 501, options [nop,nop,TS val 1501361036 ecr 2205937197], length 256
02:09:37.055555 IP lamp-ubuntu-s-1vcpu-1gb-tor1-01.ssh > 162.243.190.66.33873: Flags [P.], seq 14582400:14582656, ack 3713, win 501, options [nop,nop,TS val 1501361036 ecr 2205937197], length 256
02:09:37.055824 IP 162.243.190.66.33873 > lamp-ubuntu-s-1vcpu-1gb-tor1-01.ssh: Flags [.], ack 14581888, win 2075, options [nop,nop,TS val 2205937197 ecr 1501361035], length 0
02:09:37.055840 IP lamp-ubuntu-s-1vcpu-1gb-tor1-01.ssh > 162.243.190.66.33873: Flags [P.], seq 14582656:14582912, ack 3713, win 501, options [nop,nop,TS val 1501361036 ecr 2205937197], length 256
02:09:37.055934 IP lamp-ubuntu-s-1vcpu-1gb-tor1-01.ssh > 162.243.190.66.33873: Flags [P.], seq 14582912:14583344, ack 3713, win 501, options [nop,nop,TS val 1501361036 ecr 2205937197], length 432
02:09:37.055980 IP lamp-ubuntu-s-1vcpu-1gb-tor1-01.ssh > 162.243.190.66.33873: Flags [P.], seq 14583344:14583600, ack 3713, win 501, options [nop,nop,TS val 1501361036 ecr 2205937197], length 256
02:09:37.056019 IP lamp-ubuntu-s-1vcpu-1gb-tor1-01.ssh > 162.243.190.66.33873: Flags [P.], seq 14583600:14583856, ack 3713, win 501, options [nop,nop,TS val 1501361036 ecr 2205937197], length 256
02:09:37.056058 IP lamp-ubuntu-s-1vcpu-1gb-tor1-01.ssh > 162.243.190.66.33873: Flags [P.], seq 14583856:14584112, ack 3713, win 501, options [nop,nop,TS val 1501361036 ecr 2205937197], length 256
02:09:37.056101 IP lamp-ubuntu-s-1vcpu-1gb-tor1-01.ssh > 162.243.190.66.33873: Flags [P.], seq 14584112:14584368, ack 3713, win 501, options [nop,nop,TS val 1501361036 ecr 2205937197], length 256
02:09:37.056139 IP lamp-ubuntu-s-1vcpu-1gb-tor1-01.ssh > 162.243.190.66.33873: Flags [P.], seq 14584368:14584624, ack 3713, win 501, options [nop,nop,TS val 1501361036 ecr 2205937197], length 256
02:09:37.056265 IP lamp-ubuntu-s-1vcpu-1gb-tor1-01.ssh > 162.243.190.66.33873: Flags [P.], seq 14584624:14584880, ack 3713, win 501, options [nop,nop,TS val 1501361037 ecr 2205937197], length 256
02:09:37.056326 IP 162.243.190.66.33873 > lamp-ubuntu-s-1vcpu-1gb-tor1-01.ssh: Flags [.], ack 14583344, win 2075, options [nop,nop,TS val 2205937198 ecr 1501361036], length 0
02:09:37.056353 IP lamp-ubuntu-s-1vcpu-1gb-tor1-01.ssh > 162.243.190.66.33873: Flags [P.], seq 14584880:14585136, ack 3713, win 501, options [nop,nop,TS val 1501361037 ecr 2205937198], length 256
02:09:37.056389 IP lamp-ubuntu-s-1vcpu-1gb-tor1-01.ssh > 162.243.190.66.33873: Flags [P.], seq 14585136:14585568, ack 3713, win 501, options [nop,nop,TS val 1501361037 ecr 2205937198], length 432
02:09:37.056436 IP lamp-ubuntu-s-1vcpu-1gb-tor1-01.ssh > 162.243.190.66.33873: Flags [P.], seq 14585568:14585824, ack 3713, win 501, options [nop,nop,TS val 1501361037 ecr 2205937198], length 256
02:09:37.056664 IP 162.243.190.66.33873 > lamp-ubuntu-s-1vcpu-1gb-tor1-01.ssh: Flags [.], ack 14584880, win 2075, options [nop,nop,TS val 2205937198 ecr 1501361036], length 0
02:09:37.056680 IP lamp-ubuntu-s-1vcpu-1gb-tor1-01.ssh > 162.243.190.66.33873: Flags [P.], seq 14585824:14586080, ack 3713, win 501, options [nop,nop,TS val 1501361037 ecr 2205937198], length 256
02:09:37.056759 IP lamp-ubuntu-s-1vcpu-1gb-tor1-01.ssh > 162.243.190.66.33873: Flags [P.], seq 14586080:14586512, ack 3713, win 501, options [nop,nop,TS val 1501361037 ecr 2205937198], length 432
02:09:37.056807 IP lamp-ubuntu-s-1vcpu-1gb-tor1-01.ssh > 162.243.190.66.33873: Flags [P.], seq 14586512:14586768, ack 3713, win 501, options [nop,nop,TS val 1501361037 ecr 2205937198], length 256
02:09:37.056861 IP lamp-ubuntu-s-1vcpu-1gb-tor1-01.ssh > 162.243.190.66.33873: Flags [P.], seq 14586768:14587024, ack 3713, win 501, options [nop,nop,TS val 1501361037 ecr 2205937198], length 256
02:09:37.056921 IP lamp-ubuntu-s-1vcpu-1gb-tor1-01.ssh > 162.243.190.66.33873: Flags [P.], seq 14587024:14587280, ack 3713, win 501, options [nop,nop,TS val 1501361037 ecr 2205937198], length 256
02:09:37.056973 IP lamp-ubuntu-s-1vcpu-1gb-tor1-01.ssh > 162.243.190.66.33873: Flags [P.], seq 14587280:14587536, ack 3713, win 501, options [nop,nop,TS val 1501361037 ecr 2205937198], length 256
02:09:37.057019 IP lamp-ubuntu-s-1vcpu-1gb-tor1-01.ssh > 162.243.190.66.33873: Flags [P.], seq 14587536:14587792, ack 3713, win 501, options [nop,nop,TS val 1501361037 ecr 2205937198], length 256
02:09:37.057078 IP lamp-ubuntu-s-1vcpu-1gb-tor1-01.ssh > 162.243.190.66.33873: Flags [P.], seq 14587792:14588048, ack 3713, win 501, options [nop,nop,TS val 1501361037 ecr 2205937198], length 256
02:09:37.057089 IP 162.243.190.66.33873 > lamp-ubuntu-s-1vcpu-1gb-tor1-01.ssh: Flags [.], ack 14586512, win 2075, options [nop,nop,TS val 2205937198 ecr 1501361037], length 0
02:09:37.057169 IP lamp-ubuntu-s-1vcpu-1gb-tor1-01.ssh > 162.243.190.66.33873: Flags [P.], seq 14588048:14588480, ack 3713, win 501, options [nop,nop,TS val 1501361037 ecr 2205937198], length 432
02:09:37.057239 IP lamp-ubuntu-s-1vcpu-1gb-tor1-01.ssh > 162.243.190.66.33873: Flags [P.], seq 14588480:14588736, ack 3713, win 501, options [nop,nop,TS val 1501361037 ecr 2205937198], length 256
02:09:37.057294 IP lamp-ubuntu-s-1vcpu-1gb-tor1-01.ssh > 162.243.190.66.33873: Flags [P.], seq 14588736:14588992, ack 3713, win 501, options [nop,nop,TS val 1501361038 ecr 2205937198], length 256
02:09:37.057351 IP lamp-ubuntu-s-1vcpu-1gb-tor1-01.ssh > 162.243.190.66.33873: Flags [P.], seq 14588992:14589248, ack 3713, win 501, options [nop,nop,TS val 1501361038 ecr 2205937198], length 256
02:09:37.057401 IP 162.243.190.66.33873 > lamp-ubuntu-s-1vcpu-1gb-tor1-01.ssh: Flags [.], ack 14588048, win 2075, options [nop,nop,TS val 2205937199 ecr 1501361037], length 0
02:09:37.057454 IP lamp-ubuntu-s-1vcpu-1gb-tor1-01.ssh > 162.243.190.66.33873: Flags [P.], seq 14589248:14589680, ack 3713, win 501, options [nop,nop,TS val 1501361038 ecr 2205937199], length 432
02:09:37.057584 IP lamp-ubuntu-s-1vcpu-1gb-tor1-01.ssh > 162.243.190.66.33873: Flags [P.], seq 14589680:14589936, ack 3713, win 501, options [nop,nop,TS val 1501361038 ecr 2205937199], length 256
02:09:37.057644 IP lamp-ubuntu-s-1vcpu-1gb-tor1-01.ssh > 162.243.190.66.33873: Flags [P.], seq 14589936:14590192, ack 3713, win 501, options [nop,nop,TS val 1501361038 ecr 2205937199], length 256
02:09:37.057699 IP lamp-ubuntu-s-1vcpu-1gb-tor1-01.ssh > 162.243.190.66.33873: Flags [P.], seq 14590192:14590448, ack 3713, win 501, options [nop,nop,TS val 1501361038 ecr 2205937199], length 256
02:09:37.057752 IP lamp-ubuntu-s-1vcpu-1gb-tor1-01.ssh > 162.243.190.66.33873: Flags [P.], seq 14590448:14590704, ack 3713, win 501, options [nop,nop,TS val 1501361038 ecr 2205937199], length 256
02:09:37.057808 IP lamp-ubuntu-s-1vcpu-1gb-tor1-01.ssh > 162.243.190.66.33873: Flags [P.], seq 14590704:14590960, ack 3713, win 501, options [nop,nop,TS val 1501361038 ecr 2205937199], length 256
02:09:37.057861 IP lamp-ubuntu-s-1vcpu-1gb-tor1-01.ssh > 162.243.190.66.33873: Flags [P.], seq 14590960:14591216, ack 3713, win 501, options [nop,nop,TS val 1501361038 ecr 2205937199], length 256
02:09:37.057910 IP 162.243.190.66.33873 > lamp-ubuntu-s-1vcpu-1gb-tor1-01.ssh: Flags [.], ack 14589680, win 2075, options [nop,nop,TS val 2205937199 ecr 1501361037], length 0
02:09:37.057955 IP lamp-ubuntu-s-1vcpu-1gb-tor1-01.ssh > 162.243.190.66.33873: Flags [P.], seq 14591216:14591648, ack 3713, win 501, options [nop,nop,TS val 1501361038 ecr 2205937199], length 432
02:09:37.058000 IP lamp-ubuntu-s-1vcpu-1gb-tor1-01.ssh > 162.243.190.66.33873: Flags [P.], seq 14591648:14591904, ack 3713, win 501, options [nop,nop,TS val 1501361038 ecr 2205937199], length 256
02:09:37.058040 IP lamp-ubuntu-s-1vcpu-1gb-tor1-01.ssh > 162.243.190.66.33873: Flags [P.], seq 14591904:14592160, ack 3713, win 501, options [nop,nop,TS val 1501361038 ecr 2205937199], length 256
02:09:37.058079 IP lamp-ubuntu-s-1vcpu-1gb-tor1-01.ssh > 162.243.190.66.33873: Flags [P.], seq 14592160:14592416, ack 3713, win 501, options [nop,nop,TS val 1501361038 ecr 2205937199], length 256
02:09:37.058142 IP lamp-ubuntu-s-1vcpu-1gb-tor1-01.ssh > 162.243.190.66.33873: Flags [P.], seq 14592416:14592672, ack 3713, win 501, options [nop,nop,TS val 1501361038 ecr 2205937199], length 256
02:09:37.058192 IP 162.243.190.66.33873 > lamp-ubuntu-s-1vcpu-1gb-tor1-01.ssh: Flags [.], ack 14591216, win 2075, options [nop,nop,TS val 2205937199 ecr 1501361038], length 0
02:09:37.058239 IP lamp-ubuntu-s-1vcpu-1gb-tor1-01.ssh > 162.243.190.66.33873: Flags [P.], seq 14592672:14593104, ack 3713, win 501, options [nop,nop,TS val 1501361038 ecr 2205937199], length 432
02:09:37.058287 IP lamp-ubuntu-s-1vcpu-1gb-tor1-01.ssh > 162.243.190.66.33873: Flags [P.], seq 14593104:14593360, ack 3713, win 501, options [nop,nop,TS val 1501361039 ecr 2205937199], length 256
02:09:37.058335 IP lamp-ubuntu-s-1vcpu-1gb-tor1-01.ssh > 162.243.190.66.33873: Flags [P.], seq 14593360:14593616, ack 3713, win 501, options [nop,nop,TS val 1501361039 ecr 2205937199], length 256
02:09:37.058417 IP lamp-ubuntu-s-1vcpu-1gb-tor1-01.ssh > 162.243.190.66.33873: Flags [P.], seq 14593616:14593872, ack 3713, win 501, options [nop,nop,TS val 1501361039 ecr 2205937199], length 256
02:09:37.058463 IP lamp-ubuntu-s-1vcpu-1gb-tor1-01.ssh > 162.243.190.66.33873: Flags [P.], seq 14593872:14594128, ack 3713, win 501, options [nop,nop,TS val 1501361039 ecr 2205937199], length 256
02:09:37.058510 IP 162.243.190.66.33873 > lamp-ubuntu-s-1vcpu-1gb-tor1-01.ssh: Flags [.], ack 14592672, win 2075, options [nop,nop,TS val 2205937200 ecr 1501361038], length 0
02:09:37.058525 IP lamp-ubuntu-s-1vcpu-1gb-tor1-01.ssh > 162.243.190.66.33873: Flags [P.], seq 14594128:14594384, ack 3713, win 501, options [nop,nop,TS val 1501361039 ecr 2205937199], length 256
02:09:37.058579 IP lamp-ubuntu-s-1vcpu-1gb-tor1-01.ssh > 162.243.190.66.33873: Flags [P.], seq 14594384:14594816, ack 3713, win 501, options [nop,nop,TS val 1501361039 ecr 2205937200], length 432
02:09:37.058626 IP lamp-ubuntu-s-1vcpu-1gb-tor1-01.ssh > 162.243.190.66.33873: Flags [P.], seq 14594816:14595072, ack 3713, win 501, options [nop,nop,TS val 1501361039 ecr 2205937200], length 256
02:09:37.058674 IP lamp-ubuntu-s-1vcpu-1gb-tor1-01.ssh > 162.243.190.66.33873: Flags [P.], seq 14595072:14595328, ack 3713, win 501, options [nop,nop,TS val 1501361039 ecr 2205937200], length 256
02:09:37.058717 IP lamp-ubuntu-s-1vcpu-1gb-tor1-01.ssh > 162.243.190.66.33873: Flags [P.], seq 14595328:14595584, ack 3713, win 501, options [nop,nop,TS val 1501361039 ecr 2205937200], length 256
02:09:37.058755 IP lamp-ubuntu-s-1vcpu-1gb-tor1-01.ssh > 162.243.190.66.33873: Flags [P.], seq 14595584:14595840, ack 3713, win 501, options [nop,nop,TS val 1501361039 ecr 2205937200], length 256
02:09:37.058793 IP lamp-ubuntu-s-1vcpu-1gb-tor1-01.ssh > 162.243.190.66.33873: Flags [P.], seq 14595840:14596096, ack 3713, win 501, options [nop,nop,TS val 1501361039 ecr 2205937200], length 256
02:09:37.058866 IP 162.243.190.66.33873 > lamp-ubuntu-s-1vcpu-1gb-tor1-01.ssh: Flags [.], ack 14594128, win 2075, options [nop,nop,TS val 2205937200 ecr 1501361038], length 0
02:09:37.058876 IP lamp-ubuntu-s-1vcpu-1gb-tor1-01.ssh > 162.243.190.66.33873: Flags [P.], seq 14596096:14596352, ack 3713, win 501, options [nop,nop,TS val 1501361039 ecr 2205937200], length 256
02:09:37.058944 IP lamp-ubuntu-s-1vcpu-1gb-tor1-01.ssh > 162.243.190.66.33873: Flags [P.], seq 14596352:14596784, ack 3713, win 501, options [nop,nop,TS val 1501361039 ecr 2205937200], length 432
02:09:37.058984 IP lamp-ubuntu-s-1vcpu-1gb-tor1-01.ssh > 162.243.190.66.33873: Flags [P.], seq 14596784:14597040, ack 3713, win 501, options [nop,nop,TS val 1501361039 ecr 2205937200], length 256
02:09:37.059022 IP lamp-ubuntu-s-1vcpu-1gb-tor1-01.ssh > 162.243.190.66.33873: Flags [P.], seq 14597040:14597296, ack 3713, win 501, options [nop,nop,TS val 1501361039 ecr 2205937200], length 256
02:09:37.059060 IP lamp-ubuntu-s-1vcpu-1gb-tor1-01.ssh > 162.243.190.66.33873: Flags [P.], seq 14597296:14597552, ack 3713, win 501, options [nop,nop,TS val 1501361039 ecr 2205937200], length 256
02:09:37.059071 IP 162.243.190.66.33873 > lamp-ubuntu-s-1vcpu-1gb-tor1-01.ssh: Flags [.], ack 14595584, win 2075, options [nop,nop,TS val 2205937200 ecr 1501361039], length 0
02:09:37.059120 IP lamp-ubuntu-s-1vcpu-1gb-tor1-01.ssh > 162.243.190.66.33873: Flags [P.], seq 14597552:14597984, ack 3713, win 501, options [nop,nop,TS val 1501361039 ecr 2205937200], length 432
02:09:37.059160 IP lamp-ubuntu-s-1vcpu-1gb-tor1-01.ssh > 162.243.190.66.33873: Flags [P.], seq 14597984:14598240, ack 3713, win 501, options [nop,nop,TS val 1501361039 ecr 2205937200], length 256
02:09:37.059199 IP lamp-ubuntu-s-1vcpu-1gb-tor1-01.ssh > 162.243.190.66.33873: Flags [P.], seq 14598240:14598496, ack 3713, win 501, options [nop,nop,TS val 1501361039 ecr 2205937200], length 256
02:09:37.059244 IP lamp-ubuntu-s-1vcpu-1gb-tor1-01.ssh > 162.243.190.66.33873: Flags [P.], seq 14598496:14598752, ack 3713, win 501, options [nop,nop,TS val 1501361039 ecr 2205937200], length 256
02:09:37.059296 IP lamp-ubuntu-s-1vcpu-1gb-tor1-01.ssh > 162.243.190.66.33873: Flags [P.], seq 14598752:14599008, ack 3713, win 501, options [nop,nop,TS val 1501361040 ecr 2205937200], length 256
02:09:37.059365 IP lamp-ubuntu-s-1vcpu-1gb-tor1-01.ssh > 162.243.190.66.33873: Flags [P.], seq 14599008:14599264, ack 3713, win 501, options [nop,nop,TS val 1501361040 ecr 2205937200], length 256
02:09:37.059385 IP 162.243.190.66.33873 > lamp-ubuntu-s-1vcpu-1gb-tor1-01.ssh: Flags [.], ack 14597040, win 2075, options [nop,nop,TS val 2205937201 ecr 1501361039], length 0
02:09:37.059449 IP lamp-ubuntu-s-1vcpu-1gb-tor1-01.ssh > 162.243.190.66.33873: Flags [P.], seq 14599264:14599696, ack 3713, win 501, options [nop,nop,TS val 1501361040 ecr 2205937201], length 432
02:09:37.059505 IP lamp-ubuntu-s-1vcpu-1gb-tor1-01.ssh > 162.243.190.66.33873: Flags [P.], seq 14599696:14599952, ack 3713, win 501, options [nop,nop,TS val 1501361040 ecr 2205937201], length 256
02:09:37.059787 IP 162.243.190.66.33873 > lamp-ubuntu-s-1vcpu-1gb-tor1-01.ssh: Flags [.], ack 14598496, win 2075, options [nop,nop,TS val 2205937201 ecr 1501361039], length 0
02:09:37.059810 IP lamp-ubuntu-s-1vcpu-1gb-tor1-01.ssh > 162.243.190.66.33873: Flags [P.], seq 14599952:14600208, ack 3713, win 501, options [nop,nop,TS val 1501361040 ecr 2205937201], length 256
02:09:37.059963 IP lamp-ubuntu-s-1vcpu-1gb-tor1-01.ssh > 162.243.190.66.33873: Flags [P.], seq 14600208:14600640, ack 3713, win 501, options [nop,nop,TS val 1501361040 ecr 2205937201], length 432
02:09:37.059984 IP 162.243.190.66.33873 > lamp-ubuntu-s-1vcpu-1gb-tor1-01.ssh: Flags [.], ack 14599952, win 2075, options [nop,nop,TS val 2205937201 ecr 1501361039], length 0
02:09:37.060043 IP lamp-ubuntu-s-1vcpu-1gb-tor1-01.ssh > 162.243.190.66.33873: Flags [P.], seq 14600640:14601072, ack 3713, win 501, options [nop,nop,TS val 1501361040 ecr 2205937201], length 432
02:09:37.060091 IP lamp-ubuntu-s-1vcpu-1gb-tor1-01.ssh > 162.243.190.66.33873: Flags [P.], seq 14601072:14601328, ack 3713, win 501, options [nop,nop,TS val 1501361040 ecr 2205937201], length 256
02:09:37.060141 IP lamp-ubuntu-s-1vcpu-1gb-tor1-01.ssh > 162.243.190.66.33873: Flags [P.], seq 14601328:14601584, ack 3713, win 501, options [nop,nop,TS val 1501361040 ecr 2205937201], length 256
02:09:37.060198 IP lamp-ubuntu-s-1vcpu-1gb-tor1-01.ssh > 162.243.190.66.33873: Flags [P.], seq 14601584:14601840, ack 3713, win 501, options [nop,nop,TS val 1501361040 ecr 2205937201], length 256
02:09:37.060258 IP lamp-ubuntu-s-1vcpu-1gb-tor1-01.ssh > 162.243.190.66.33873: Flags [P.], seq 14601840:14602096, ack 3713, win 501, options [nop,nop,TS val 1501361041 ecr 2205937201], length 256
02:09:37.060387 IP lamp-ubuntu-s-1vcpu-1gb-tor1-01.ssh > 162.243.190.66.33873: Flags [P.], seq 14602096:14602352, ack 3713, win 501, options [nop,nop,TS val 1501361041 ecr 2205937201], length 256
02:09:37.060455 IP lamp-ubuntu-s-1vcpu-1gb-tor1-01.ssh > 162.243.190.66.33873: Flags [P.], seq 14602352:14602608, ack 3713, win 501, options [nop,nop,TS val 1501361041 ecr 2205937201], length 256
02:09:37.060516 IP lamp-ubuntu-s-1vcpu-1gb-tor1-01.ssh > 162.243.190.66.33873: Flags [P.], seq 14602608:14602864, ack 3713, win 501, options [nop,nop,TS val 1501361041 ecr 2205937201], length 256
02:09:37.060530 IP 162.243.190.66.33873 > lamp-ubuntu-s-1vcpu-1gb-tor1-01.ssh: Flags [.], ack 14601584, win 2075, options [nop,nop,TS val 2205937202 ecr 1501361040], length 0
02:09:37.060590 IP lamp-ubuntu-s-1vcpu-1gb-tor1-01.ssh > 162.243.190.66.33873: Flags [P.], seq 14602864:14603296, ack 3713, win 501, options [nop,nop,TS val 1501361041 ecr 2205937202], length 432
02:09:37.060631 IP lamp-ubuntu-s-1vcpu-1gb-tor1-01.ssh > 162.243.190.66.33873: Flags [P.], seq 14603296:14603552, ack 3713, win 501, options [nop,nop,TS val 1501361041 ecr 2205937202], length 256
02:09:37.060674 IP lamp-ubuntu-s-1vcpu-1gb-tor1-01.ssh > 162.243.190.66.33873: Flags [P.], seq 14603552:14603808, ack 3713, win 501, options [nop,nop,TS val 1501361041 ecr 2205937202], length 256
02:09:37.060719 IP lamp-ubuntu-s-1vcpu-1gb-tor1-01.ssh > 162.243.190.66.33873: Flags [P.], seq 14603808:14604064, ack 3713, win 501, options [nop,nop,TS val 1501361041 ecr 2205937202], length 256
02:09:37.060777 IP lamp-ubuntu-s-1vcpu-1gb-tor1-01.ssh > 162.243.190.66.33873: Flags [P.], seq 14604064:14604320, ack 3713, win 501, options [nop,nop,TS val 1501361041 ecr 2205937202], length 256
02:09:37.060831 IP lamp-ubuntu-s-1vcpu-1gb-tor1-01.ssh > 162.243.190.66.33873: Flags [P.], seq 14604320:14604576, ack 3713, win 501, options [nop,nop,TS val 1501361041 ecr 2205937202], length 256
02:09:37.060894 IP lamp-ubuntu-s-1vcpu-1gb-tor1-01.ssh > 162.243.190.66.33873: Flags [P.], seq 14604576:14604832, ack 3713, win 501, options [nop,nop,TS val 1501361041 ecr 2205937202], length 256
02:09:37.060949 IP 162.243.190.66.33873 > lamp-ubuntu-s-1vcpu-1gb-tor1-01.ssh: Flags [.], ack 14603296, win 2075, options [nop,nop,TS val 2205937202 ecr 1501361040], length 0
02:09:37.061001 IP lamp-ubuntu-s-1vcpu-1gb-tor1-01.ssh > 162.243.190.66.33873: Flags [P.], seq 14604832:14605088, ack 3713, win 501, options [nop,nop,TS val 1501361041 ecr 2205937202], length 256
02:09:37.061049 IP lamp-ubuntu-s-1vcpu-1gb-tor1-01.ssh > 162.243.190.66.33873: Flags [P.], seq 14605088:14605584, ack 3713, win 501, options [nop,nop,TS val 1501361041 ecr 2205937202], length 496
02:09:37.061120 IP lamp-ubuntu-s-1vcpu-1gb-tor1-01.ssh > 162.243.190.66.33873: Flags [P.], seq 14605584:14605840, ack 3713, win 501, options [nop,nop,TS val 1501361041 ecr 2205937202], length 256
02:09:37.061245 IP 162.243.190.66.33873 > lamp-ubuntu-s-1vcpu-1gb-tor1-01.ssh: Flags [.], ack 14604832, win 2075, options [nop,nop,TS val 2205937202 ecr 1501361041], length 0
02:09:37.061260 IP lamp-ubuntu-s-1vcpu-1gb-tor1-01.ssh > 162.243.190.66.33873: Flags [P.], seq 14605840:14606096, ack 3713, win 501, options [nop,nop,TS val 1501361042 ecr 2205937202], length 256
02:09:37.061363 IP lamp-ubuntu-s-1vcpu-1gb-tor1-01.ssh > 162.243.190.66.33873: Flags [P.], seq 14606096:14606528, ack 3713, win 501, options [nop,nop,TS val 1501361042 ecr 2205937202], length 432
02:09:37.061421 IP lamp-ubuntu-s-1vcpu-1gb-tor1-01.ssh > 162.243.190.66.33873: Flags [P.], seq 14606528:14606784, ack 3713, win 501, options [nop,nop,TS val 1501361042 ecr 2205937202], length 256
02:09:37.061476 IP lamp-ubuntu-s-1vcpu-1gb-tor1-01.ssh > 162.243.190.66.33873: Flags [P.], seq 14606784:14607040, ack 3713, win 501, options [nop,nop,TS val 1501361042 ecr 2205937202], length 256
02:09:37.061544 IP lamp-ubuntu-s-1vcpu-1gb-tor1-01.ssh > 162.243.190.66.33873: Flags [P.], seq 14607040:14607296, ack 3713, win 501, options [nop,nop,TS val 1501361042 ecr 2205937202], length 256
02:09:37.061641 IP lamp-ubuntu-s-1vcpu-1gb-tor1-01.ssh > 162.243.190.66.33873: Flags [P.], seq 14607296:14607552, ack 3713, win 501, options [nop,nop,TS val 1501361042 ecr 2205937202], length 256
02:09:37.061692 IP 162.243.190.66.33873 > lamp-ubuntu-s-1vcpu-1gb-tor1-01.ssh: Flags [.], ack 14606528, win 2075, options [nop,nop,TS val 2205937203 ecr 1501361041], length 0
02:09:37.061718 IP lamp-ubuntu-s-1vcpu-1gb-tor1-01.ssh > 162.243.190.66.33873: Flags [P.], seq 14607552:14607808, ack 3713, win 501, options [nop,nop,TS val 1501361042 ecr 2205937203], length 256
02:09:37.061776 IP lamp-ubuntu-s-1vcpu-1gb-tor1-01.ssh > 162.243.190.66.33873: Flags [P.], seq 14607808:14608240, ack 3713, win 501, options [nop,nop,TS val 1501361042 ecr 2205937203], length 432
02:09:37.061825 IP lamp-ubuntu-s-1vcpu-1gb-tor1-01.ssh > 162.243.190.66.33873: Flags [P.], seq 14608240:14608496, ack 3713, win 501, options [nop,nop,TS val 1501361042 ecr 2205937203], length 256
02:09:37.061882 IP lamp-ubuntu-s-1vcpu-1gb-tor1-01.ssh > 162.243.190.66.33873: Flags [P.], seq 14608496:14608752, ack 3713, win 501, options [nop,nop,TS val 1501361042 ecr 2205937203], length 256
02:09:37.061945 IP lamp-ubuntu-s-1vcpu-1gb-tor1-01.ssh > 162.243.190.66.33873: Flags [P.], seq 14608752:14609008, ack 3713, win 501, options [nop,nop,TS val 1501361042 ecr 2205937203], length 256
02:09:37.062006 IP lamp-ubuntu-s-1vcpu-1gb-tor1-01.ssh > 162.243.190.66.33873: Flags [P.], seq 14609008:14609264, ack 3713, win 501, options [nop,nop,TS val 1501361042 ecr 2205937203], length 256
02:09:37.062061 IP lamp-ubuntu-s-1vcpu-1gb-tor1-01.ssh > 162.243.190.66.33873: Flags [P.], seq 14609264:14609520, ack 3713, win 501, options [nop,nop,TS val 1501361042 ecr 2205937203], length 256
02:09:37.062118 IP 162.243.190.66.33873 > lamp-ubuntu-s-1vcpu-1gb-tor1-01.ssh: Flags [.], ack 14608240, win 2075, options [nop,nop,TS val 2205937203 ecr 1501361042], length 0
02:09:37.062191 IP lamp-ubuntu-s-1vcpu-1gb-tor1-01.ssh > 162.243.190.66.33873: Flags [P.], seq 14609520:14609952, ack 3713, win 501, options [nop,nop,TS val 1501361042 ecr 2205937203], length 432
02:09:37.062250 IP lamp-ubuntu-s-1vcpu-1gb-tor1-01.ssh > 162.243.190.66.33873: Flags [P.], seq 14609952:14610208, ack 3713, win 501, options [nop,nop,TS val 1501361043 ecr 2205937203], length 256
02:09:37.062320 IP lamp-ubuntu-s-1vcpu-1gb-tor1-01.ssh > 162.243.190.66.33873: Flags [P.], seq 14610208:14610464, ack 3713, win 501, options [nop,nop,TS val 1501361043 ecr 2205937203], length 256
02:09:37.062389 IP lamp-ubuntu-s-1vcpu-1gb-tor1-01.ssh > 162.243.190.66.33873: Flags [P.], seq 14610464:14610720, ack 3713, win 501, options [nop,nop,TS val 1501361043 ecr 2205937203], length 256
02:09:37.062452 IP lamp-ubuntu-s-1vcpu-1gb-tor1-01.ssh > 162.243.190.66.33873: Flags [P.], seq 14610720:14610976, ack 3713, win 501, options [nop,nop,TS val 1501361043 ecr 2205937203], length 256
02:09:37.062517 IP 162.243.190.66.33873 > lamp-ubuntu-s-1vcpu-1gb-tor1-01.ssh: Flags [.], ack 14609952, win 2075, options [nop,nop,TS val 2205937204 ecr 1501361042], length 0
02:09:37.062525 IP lamp-ubuntu-s-1vcpu-1gb-tor1-01.ssh > 162.243.190.66.33873: Flags [P.], seq 14610976:14611232, ack 3713, win 501, options [nop,nop,TS val 1501361043 ecr 2205937203], length 256
02:09:37.062602 IP lamp-ubuntu-s-1vcpu-1gb-tor1-01.ssh > 162.243.190.66.33873: Flags [P.], seq 14611232:14611664, ack 3713, win 501, options [nop,nop,TS val 1501361043 ecr 2205937204], length 432
02:09:37.062658 IP lamp-ubuntu-s-1vcpu-1gb-tor1-01.ssh > 162.243.190.66.33873: Flags [P.], seq 14611664:14611920, ack 3713, win 501, options [nop,nop,TS val 1501361043 ecr 2205937204], length 256
02:09:37.062699 IP lamp-ubuntu-s-1vcpu-1gb-tor1-01.ssh > 162.243.190.66.33873: Flags [P.], seq 14611920:14612176, ack 3713, win 501, options [nop,nop,TS val 1501361043 ecr 2205937204], length 256
02:09:37.062738 IP lamp-ubuntu-s-1vcpu-1gb-tor1-01.ssh > 162.243.190.66.33873: Flags [P.], seq 14612176:14612432, ack 3713, win 501, options [nop,nop,TS val 1501361043 ecr 2205937204], length 256
02:09:37.062776 IP lamp-ubuntu-s-1vcpu-1gb-tor1-01.ssh > 162.243.190.66.33873: Flags [P.], seq 14612432:14612688, ack 3713, win 501, options [nop,nop,TS val 1501361043 ecr 2205937204], length 256
02:09:37.062827 IP lamp-ubuntu-s-1vcpu-1gb-tor1-01.ssh > 162.243.190.66.33873: Flags [P.], seq 14612688:14612944, ack 3713, win 501, options [nop,nop,TS val 1501361043 ecr 2205937204], length 256
02:09:37.062871 IP lamp-ubuntu-s-1vcpu-1gb-tor1-01.ssh > 162.243.190.66.33873: Flags [P.], seq 14612944:14613200, ack 3713, win 501, options [nop,nop,TS val 1501361043 ecr 2205937204], length 256
02:09:37.062909 IP lamp-ubuntu-s-1vcpu-1gb-tor1-01.ssh > 162.243.190.66.33873: Flags [P.], seq 14613200:14613456, ack 3713, win 501, options [nop,nop,TS val 1501361043 ecr 2205937204], length 256
02:09:37.062953 IP 162.243.190.66.33873 > lamp-ubuntu-s-1vcpu-1gb-tor1-01.ssh: Flags [.], ack 14611664, win 2075, options [nop,nop,TS val 2205937204 ecr 1501361043], length 0
02:09:37.063014 IP lamp-ubuntu-s-1vcpu-1gb-tor1-01.ssh > 162.243.190.66.33873: Flags [P.], seq 14613456:14613888, ack 3713, win 501, options [nop,nop,TS val 1501361043 ecr 2205937204], length 432
02:09:37.063061 IP lamp-ubuntu-s-1vcpu-1gb-tor1-01.ssh > 162.243.190.66.33873: Flags [P.], seq 14613888:14614144, ack 3713, win 501, options [nop,nop,TS val 1501361043 ecr 2205937204], length 256
02:09:37.063100 IP lamp-ubuntu-s-1vcpu-1gb-tor1-01.ssh > 162.243.190.66.33873: Flags [P.], seq 14614144:14614400, ack 3713, win 501, options [nop,nop,TS val 1501361043 ecr 2205937204], length 256
02:09:37.063139 IP lamp-ubuntu-s-1vcpu-1gb-tor1-01.ssh > 162.243.190.66.33873: Flags [P.], seq 14614400:14614656, ack 3713, win 501, options [nop,nop,TS val 1501361043 ecr 2205937204], length 256
02:09:37.063179 IP lamp-ubuntu-s-1vcpu-1gb-tor1-01.ssh > 162.243.190.66.33873: Flags [P.], seq 14614656:14614912, ack 3713, win 501, options [nop,nop,TS val 1501361043 ecr 2205937204], length 256
02:09:37.063195 IP 162.243.190.66.33873 > lamp-ubuntu-s-1vcpu-1gb-tor1-01.ssh: Flags [.], ack 14613200, win 2075, options [nop,nop,TS val 2205937204 ecr 1501361043], length 0
02:09:37.063278 IP lamp-ubuntu-s-1vcpu-1gb-tor1-01.ssh > 162.243.190.66.33873: Flags [P.], seq 14614912:14615344, ack 3713, win 501, options [nop,nop,TS val 1501361044 ecr 2205937204], length 432
02:09:37.063352 IP lamp-ubuntu-s-1vcpu-1gb-tor1-01.ssh > 162.243.190.66.33873: Flags [P.], seq 14615344:14615600, ack 3713, win 501, options [nop,nop,TS val 1501361044 ecr 2205937204], length 256
02:09:37.063424 IP lamp-ubuntu-s-1vcpu-1gb-tor1-01.ssh > 162.243.190.66.33873: Flags [P.], seq 14615600:14615856, ack 3713, win 501, options [nop,nop,TS val 1501361044 ecr 2205937204], length 256
02:09:37.063447 IP 162.243.190.66.33873 > lamp-ubuntu-s-1vcpu-1gb-tor1-01.ssh: Flags [.], ack 14614656, win 2075, options [nop,nop,TS val 2205937205 ecr 1501361043], length 0
02:09:37.063516 IP lamp-ubuntu-s-1vcpu-1gb-tor1-01.ssh > 162.243.190.66.33873: Flags [P.], seq 14615856:14616288, ack 3713, win 501, options [nop,nop,TS val 1501361044 ecr 2205937205], length 432
02:09:37.063560 IP lamp-ubuntu-s-1vcpu-1gb-tor1-01.ssh > 162.243.190.66.33873: Flags [P.], seq 14616288:14616544, ack 3713, win 501, options [nop,nop,TS val 1501361044 ecr 2205937205], length 256
02:09:37.063620 IP lamp-ubuntu-s-1vcpu-1gb-tor1-01.ssh > 162.243.190.66.33873: Flags [P.], seq 14616544:14616800, ack 3713, win 501, options [nop,nop,TS val 1501361044 ecr 2205937205], length 256
02:09:37.063681 IP lamp-ubuntu-s-1vcpu-1gb-tor1-01.ssh > 162.243.190.66.33873: Flags [P.], seq 14616800:14617056, ack 3713, win 501, options [nop,nop,TS val 1501361044 ecr 2205937205], length 256
02:09:37.063739 IP lamp-ubuntu-s-1vcpu-1gb-tor1-01.ssh > 162.243.190.66.33873: Flags [P.], seq 14617056:14617312, ack 3713, win 501, options [nop,nop,TS val 1501361044 ecr 2205937205], length 256
02:09:37.063792 IP lamp-ubuntu-s-1vcpu-1gb-tor1-01.ssh > 162.243.190.66.33873: Flags [P.], seq 14617312:14617568, ack 3713, win 501, options [nop,nop,TS val 1501361044 ecr 2205937205], length 256
02:09:37.063844 IP lamp-ubuntu-s-1vcpu-1gb-tor1-01.ssh > 162.243.190.66.33873: Flags [P.], seq 14617568:14617824, ack 3713, win 501, options [nop,nop,TS val 1501361044 ecr 2205937205], length 256
02:09:37.063895 IP lamp-ubuntu-s-1vcpu-1gb-tor1-01.ssh > 162.243.190.66.33873: Flags [P.], seq 14617824:14618080, ack 3713, win 501, options [nop,nop,TS val 1501361044 ecr 2205937205], length 256
02:09:37.063942 IP 162.243.190.66.33873 > lamp-ubuntu-s-1vcpu-1gb-tor1-01.ssh: Flags [.], ack 14616288, win 2075, options [nop,nop,TS val 2205937205 ecr 1501361043], length 0
02:09:37.063986 IP lamp-ubuntu-s-1vcpu-1gb-tor1-01.ssh > 162.243.190.66.33873: Flags [P.], seq 14618080:14618336, ack 3713, win 501, options [nop,nop,TS val 1501361044 ecr 2205937205], length 256
02:09:37.064041 IP lamp-ubuntu-s-1vcpu-1gb-tor1-01.ssh > 162.243.190.66.33873: Flags [P.], seq 14618336:14618576, ack 3713, win 501, options [nop,nop,TS val 1501361044 ecr 2205937205], length 240
02:09:37.064090 IP lamp-ubuntu-s-1vcpu-1gb-tor1-01.ssh > 162.243.190.66.33873: Flags [P.], seq 14618576:14618832, ack 3713, win 501, options [nop,nop,TS val 1501361044 ecr 2205937205], length 256
02:09:37.064138 IP lamp-ubuntu-s-1vcpu-1gb-tor1-01.ssh > 162.243.190.66.33873: Flags [P.], seq 14618832:14619088, ack 3713, win 501, options [nop,nop,TS val 1501361044 ecr 2205937205], length 256
02:09:37.064182 IP 162.243.190.66.33873 > lamp-ubuntu-s-1vcpu-1gb-tor1-01.ssh: Flags [.], ack 14617824, win 2075, options [nop,nop,TS val 2205937205 ecr 1501361044], length 0
02:09:37.064228 IP lamp-ubuntu-s-1vcpu-1gb-tor1-01.ssh > 162.243.190.66.33873: Flags [P.], seq 14619088:14619344, ack 3713, win 501, options [nop,nop,TS val 1501361044 ecr 2205937205], length 256
02:09:37.064283 IP lamp-ubuntu-s-1vcpu-1gb-tor1-01.ssh > 162.243.190.66.33873: Flags [P.], seq 14619344:14619776, ack 3713, win 501, options [nop,nop,TS val 1501361045 ecr 2205937205], length 432
02:09:37.064335 IP lamp-ubuntu-s-1vcpu-1gb-tor1-01.ssh > 162.243.190.66.33873: Flags [P.], seq 14619776:14620288, ack 3713, win 501, options [nop,nop,TS val 1501361045 ecr 2205937205], length 512
02:09:37.064402 IP lamp-ubuntu-s-1vcpu-1gb-tor1-01.ssh > 162.243.190.66.33873: Flags [P.], seq 14620288:14620544, ack 3713, win 501, options [nop,nop,TS val 1501361045 ecr 2205937205], length 256
02:09:37.064463 IP lamp-ubuntu-s-1vcpu-1gb-tor1-01.ssh > 162.243.190.66.33873: Flags [P.], seq 14620544:14620800, ack 3713, win 501, options [nop,nop,TS val 1501361045 ecr 2205937205], length 256
02:09:37.064546 IP lamp-ubuntu-s-1vcpu-1gb-tor1-01.ssh > 162.243.190.66.33873: Flags [P.], seq 14620800:14621056, ack 3713, win 501, options [nop,nop,TS val 1501361045 ecr 2205937205], length 256
02:09:37.064597 IP 162.243.190.66.33873 > lamp-ubuntu-s-1vcpu-1gb-tor1-01.ssh: Flags [.], ack 14619344, win 2075, options [nop,nop,TS val 2205937206 ecr 1501361044], length 0
02:09:37.064640 IP lamp-ubuntu-s-1vcpu-1gb-tor1-01.ssh > 162.243.190.66.33873: Flags [P.], seq 14621056:14621488, ack 3713, win 501, options [nop,nop,TS val 1501361045 ecr 2205937206], length 432
02:09:37.064695 IP lamp-ubuntu-s-1vcpu-1gb-tor1-01.ssh > 162.243.190.66.33873: Flags [P.], seq 14621488:14621744, ack 3713, win 501, options [nop,nop,TS val 1501361045 ecr 2205937206], length 256
02:09:37.064787 IP lamp-ubuntu-s-1vcpu-1gb-tor1-01.ssh > 162.243.190.66.33873: Flags [P.], seq 14621744:14622000, ack 3713, win 501, options [nop,nop,TS val 1501361045 ecr 2205937206], length 256
02:09:37.064833 IP 162.243.190.66.33873 > lamp-ubuntu-s-1vcpu-1gb-tor1-01.ssh: Flags [.], ack 14620800, win 2075, options [nop,nop,TS val 2205937206 ecr 1501361045], length 0
02:09:37.064874 IP lamp-ubuntu-s-1vcpu-1gb-tor1-01.ssh > 162.243.190.66.33873: Flags [P.], seq 14622000:14622432, ack 3713, win 501, options [nop,nop,TS val 1501361045 ecr 2205937206], length 432
02:09:37.064930 IP lamp-ubuntu-s-1vcpu-1gb-tor1-01.ssh > 162.243.190.66.33873: Flags [P.], seq 14622432:14622688, ack 3713, win 501, options [nop,nop,TS val 1501361045 ecr 2205937206], length 256
02:09:37.064982 IP lamp-ubuntu-s-1vcpu-1gb-tor1-01.ssh > 162.243.190.66.33873: Flags [P.], seq 14622688:14622944, ack 3713, win 501, options [nop,nop,TS val 1501361045 ecr 2205937206], length 256
02:09:37.065034 IP lamp-ubuntu-s-1vcpu-1gb-tor1-01.ssh > 162.243.190.66.33873: Flags [P.], seq 14622944:14623200, ack 3713, win 501, options [nop,nop,TS val 1501361045 ecr 2205937206], length 256
02:09:37.065088 IP lamp-ubuntu-s-1vcpu-1gb-tor1-01.ssh > 162.243.190.66.33873: Flags [P.], seq 14623200:14623456, ack 3713, win 501, options [nop,nop,TS val 1501361045 ecr 2205937206], length 256
02:09:37.065169 IP lamp-ubuntu-s-1vcpu-1gb-tor1-01.ssh > 162.243.190.66.33873: Flags [P.], seq 14623456:14623712, ack 3713, win 501, options [nop,nop,TS val 1501361045 ecr 2205937206], length 256
02:09:37.065219 IP 162.243.190.66.33873 > lamp-ubuntu-s-1vcpu-1gb-tor1-01.ssh: Flags [.], ack 14622432, win 2075, options [nop,nop,TS val 2205937206 ecr 1501361045], length 0
02:09:37.065259 IP lamp-ubuntu-s-1vcpu-1gb-tor1-01.ssh > 162.243.190.66.33873: Flags [P.], seq 14623712:14624144, ack 3713, win 501, options [nop,nop,TS val 1501361046 ecr 2205937206], length 432
02:09:37.065312 IP lamp-ubuntu-s-1vcpu-1gb-tor1-01.ssh > 162.243.190.66.33873: Flags [P.], seq 14624144:14624400, ack 3713, win 501, options [nop,nop,TS val 1501361046 ecr 2205937206], length 256
02:09:37.065365 IP lamp-ubuntu-s-1vcpu-1gb-tor1-01.ssh > 162.243.190.66.33873: Flags [P.], seq 14624400:14624656, ack 3713, win 501, options [nop,nop,TS val 1501361046 ecr 2205937206], length 256
02:09:37.065422 IP lamp-ubuntu-s-1vcpu-1gb-tor1-01.ssh > 162.243.190.66.33873: Flags [P.], seq 14624656:14624912, ack 3713, win 501, options [nop,nop,TS val 1501361046 ecr 2205937206], length 256
02:09:37.065474 IP lamp-ubuntu-s-1vcpu-1gb-tor1-01.ssh > 162.243.190.66.33873: Flags [P.], seq 14624912:14625168, ack 3713, win 501, options [nop,nop,TS val 1501361046 ecr 2205937206], length 256
02:09:37.065526 IP lamp-ubuntu-s-1vcpu-1gb-tor1-01.ssh > 162.243.190.66.33873: Flags [P.], seq 14625168:14625424, ack 3713, win 501, options [nop,nop,TS val 1501361046 ecr 2205937206], length 256
02:09:37.065584 IP 162.243.190.66.33873 > lamp-ubuntu-s-1vcpu-1gb-tor1-01.ssh: Flags [.], ack 14624144, win 2075, options [nop,nop,TS val 2205937207 ecr 1501361045], length 0
02:09:37.065612 IP lamp-ubuntu-s-1vcpu-1gb-tor1-01.ssh > 162.243.190.66.33873: Flags [P.], seq 14625424:14625680, ack 3713, win 501, options [nop,nop,TS val 1501361046 ecr 2205937207], length 256
02:09:37.065667 IP lamp-ubuntu-s-1vcpu-1gb-tor1-01.ssh > 162.243.190.66.33873: Flags [P.], seq 14625680:14626112, ack 3713, win 501, options [nop,nop,TS val 1501361046 ecr 2205937207], length 432
02:09:37.065719 IP lamp-ubuntu-s-1vcpu-1gb-tor1-01.ssh > 162.243.190.66.33873: Flags [P.], seq 14626112:14626368, ack 3713, win 501, options [nop,nop,TS val 1501361046 ecr 2205937207], length 256
02:09:37.065771 IP lamp-ubuntu-s-1vcpu-1gb-tor1-01.ssh > 162.243.190.66.33873: Flags [P.], seq 14626368:14626624, ack 3713, win 501, options [nop,nop,TS val 1501361046 ecr 2205937207], length 256
02:09:37.065823 IP lamp-ubuntu-s-1vcpu-1gb-tor1-01.ssh > 162.243.190.66.33873: Flags [P.], seq 14626624:14626880, ack 3713, win 501, options [nop,nop,TS val 1501361046 ecr 2205937207], length 256
02:09:37.065883 IP lamp-ubuntu-s-1vcpu-1gb-tor1-01.ssh > 162.243.190.66.33873: Flags [P.], seq 14626880:14627136, ack 3713, win 501, options [nop,nop,TS val 1501361046 ecr 2205937207], length 256
02:09:37.065936 IP lamp-ubuntu-s-1vcpu-1gb-tor1-01.ssh > 162.243.190.66.33873: Flags [P.], seq 14627136:14627392, ack 3713, win 501, options [nop,nop,TS val 1501361046 ecr 2205937207], length 256
02:09:37.065953 IP 162.243.190.66.33873 > lamp-ubuntu-s-1vcpu-1gb-tor1-01.ssh: Flags [.], ack 14625680, win 2075, options [nop,nop,TS val 2205937207 ecr 1501361046], length 0
02:09:37.066012 IP lamp-ubuntu-s-1vcpu-1gb-tor1-01.ssh > 162.243.190.66.33873: Flags [P.], seq 14627392:14627824, ack 3713, win 501, options [nop,nop,TS val 1501361046 ecr 2205937207], length 432
02:09:37.066066 IP lamp-ubuntu-s-1vcpu-1gb-tor1-01.ssh > 162.243.190.66.33873: Flags [P.], seq 14627824:14628080, ack 3713, win 501, options [nop,nop,TS val 1501361046 ecr 2205937207], length 256
02:09:37.066117 IP lamp-ubuntu-s-1vcpu-1gb-tor1-01.ssh > 162.243.190.66.33873: Flags [P.], seq 14628080:14628336, ack 3713, win 501, options [nop,nop,TS val 1501361046 ecr 2205937207], length 256
02:09:37.066170 IP lamp-ubuntu-s-1vcpu-1gb-tor1-01.ssh > 162.243.190.66.33873: Flags [P.], seq 14628336:14628592, ack 3713, win 501, options [nop,nop,TS val 1501361046 ecr 2205937207], length 256
02:09:37.066216 IP 162.243.190.66.33873 > lamp-ubuntu-s-1vcpu-1gb-tor1-01.ssh: Flags [.], ack 14627136, win 2075, options [nop,nop,TS val 2205937207 ecr 1501361046], length 0
02:09:37.066254 IP lamp-ubuntu-s-1vcpu-1gb-tor1-01.ssh > 162.243.190.66.33873: Flags [P.], seq 14628592:14628848, ack 3713, win 501, options [nop,nop,TS val 1501361047 ecr 2205937207], length 256
02:09:37.066304 IP lamp-ubuntu-s-1vcpu-1gb-tor1-01.ssh > 162.243.190.66.33873: Flags [P.], seq 14628848:14629088, ack 3713, win 501, options [nop,nop,TS val 1501361047 ecr 2205937207], length 240
02:09:37.066353 IP lamp-ubuntu-s-1vcpu-1gb-tor1-01.ssh > 162.243.190.66.33873: Flags [P.], seq 14629088:14629344, ack 3713, win 501, options [nop,nop,TS val 1501361047 ecr 2205937207], length 256
02:09:37.066401 IP lamp-ubuntu-s-1vcpu-1gb-tor1-01.ssh > 162.243.190.66.33873: Flags [P.], seq 14629344:14629600, ack 3713, win 501, options [nop,nop,TS val 1501361047 ecr 2205937207], length 256
02:09:37.066454 IP lamp-ubuntu-s-1vcpu-1gb-tor1-01.ssh > 162.243.190.66.33873: Flags [P.], seq 14629600:14629856, ack 3713, win 501, options [nop,nop,TS val 1501361047 ecr 2205937207], length 256
02:09:37.066521 IP lamp-ubuntu-s-1vcpu-1gb-tor1-01.ssh > 162.243.190.66.33873: Flags [P.], seq 14629856:14630368, ack 3713, win 501, options [nop,nop,TS val 1501361047 ecr 2205937207], length 512
02:09:37.066550 IP 162.243.190.66.33873 > lamp-ubuntu-s-1vcpu-1gb-tor1-01.ssh: Flags [.], ack 14628592, win 2075, options [nop,nop,TS val 2205937208 ecr 1501361046], length 0
02:09:37.066601 IP lamp-ubuntu-s-1vcpu-1gb-tor1-01.ssh > 162.243.190.66.33873: Flags [P.], seq 14630368:14630800, ack 3713, win 501, options [nop,nop,TS val 1501361047 ecr 2205937208], length 432
02:09:37.066667 IP lamp-ubuntu-s-1vcpu-1gb-tor1-01.ssh > 162.243.190.66.33873: Flags [P.], seq 14630800:14631056, ack 3713, win 501, options [nop,nop,TS val 1501361047 ecr 2205937208], length 256
02:09:37.066720 IP lamp-ubuntu-s-1vcpu-1gb-tor1-01.ssh > 162.243.190.66.33873: Flags [P.], seq 14631056:14631312, ack 3713, win 501, options [nop,nop,TS val 1501361047 ecr 2205937208], length 256
02:09:37.066773 IP lamp-ubuntu-s-1vcpu-1gb-tor1-01.ssh > 162.243.190.66.33873: Flags [P.], seq 14631312:14631568, ack 3713, win 501, options [nop,nop,TS val 1501361047 ecr 2205937208], length 256
02:09:37.066844 IP lamp-ubuntu-s-1vcpu-1gb-tor1-01.ssh > 162.243.190.66.33873: Flags [P.], seq 14631568:14631824, ack 3713, win 501, options [nop,nop,TS val 1501361047 ecr 2205937208], length 256
02:09:37.066898 IP lamp-ubuntu-s-1vcpu-1gb-tor1-01.ssh > 162.243.190.66.33873: Flags [P.], seq 14631824:14632080, ack 3713, win 501, options [nop,nop,TS val 1501361047 ecr 2205937208], length 256
02:09:37.066958 IP 162.243.190.66.33873 > lamp-ubuntu-s-1vcpu-1gb-tor1-01.ssh: Flags [.], ack 14630368, win 2075, options [nop,nop,TS val 2205937208 ecr 1501361047], length 0
02:09:37.067010 IP lamp-ubuntu-s-1vcpu-1gb-tor1-01.ssh > 162.243.190.66.33873: Flags [P.], seq 14632080:14632512, ack 3713, win 501, options [nop,nop,TS val 1501361047 ecr 2205937208], length 432
02:09:37.067082 IP lamp-ubuntu-s-1vcpu-1gb-tor1-01.ssh > 162.243.190.66.33873: Flags [P.], seq 14632512:14632768, ack 3713, win 501, options [nop,nop,TS val 1501361047 ecr 2205937208], length 256
02:09:37.067143 IP lamp-ubuntu-s-1vcpu-1gb-tor1-01.ssh > 162.243.190.66.33873: Flags [P.], seq 14632768:14633024, ack 3713, win 501, options [nop,nop,TS val 1501361047 ecr 2205937208], length 256
02:09:37.067184 IP lamp-ubuntu-s-1vcpu-1gb-tor1-01.ssh > 162.243.190.66.33873: Flags [P.], seq 14633024:14633280, ack 3713, win 501, options [nop,nop,TS val 1501361047 ecr 2205937208], length 256
02:09:37.067223 IP lamp-ubuntu-s-1vcpu-1gb-tor1-01.ssh > 162.243.190.66.33873: Flags [P.], seq 14633280:14633536, ack 3713, win 501, options [nop,nop,TS val 1501361047 ecr 2205937208], length 256
02:09:37.067290 IP lamp-ubuntu-s-1vcpu-1gb-tor1-01.ssh > 162.243.190.66.33873: Flags [P.], seq 14633536:14633792, ack 3713, win 501, options [nop,nop,TS val 1501361048 ecr 2205937208], length 256
02:09:37.067355 IP lamp-ubuntu-s-1vcpu-1gb-tor1-01.ssh > 162.243.190.66.33873: Flags [P.], seq 14633792:14634048, ack 3713, win 501, options [nop,nop,TS val 1501361048 ecr 2205937208], length 256
02:09:37.067408 IP lamp-ubuntu-s-1vcpu-1gb-tor1-01.ssh > 162.243.190.66.33873: Flags [P.], seq 14634048:14634304, ack 3713, win 501, options [nop,nop,TS val 1501361048 ecr 2205937208], length 256
02:09:37.067448 IP lamp-ubuntu-s-1vcpu-1gb-tor1-01.ssh > 162.243.190.66.33873: Flags [P.], seq 14634304:14634560, ack 3713, win 501, options [nop,nop,TS val 1501361048 ecr 2205937208], length 256
02:09:37.067487 IP 162.243.190.66.33873 > lamp-ubuntu-s-1vcpu-1gb-tor1-01.ssh: Flags [.], ack 14631824, win 2075, options [nop,nop,TS val 2205937209 ecr 1501361047], length 0
02:09:37.067518 IP lamp-ubuntu-s-1vcpu-1gb-tor1-01.ssh > 162.243.190.66.33873: Flags [P.], seq 14634560:14634816, ack 3713, win 501, options [nop,nop,TS val 1501361048 ecr 2205937209], length 256
02:09:37.067559 IP lamp-ubuntu-s-1vcpu-1gb-tor1-01.ssh > 162.243.190.66.33873: Flags [P.], seq 14634816:14635312, ack 3713, win 501, options [nop,nop,TS val 1501361048 ecr 2205937209], length 496
02:09:37.067600 IP lamp-ubuntu-s-1vcpu-1gb-tor1-01.ssh > 162.243.190.66.33873: Flags [P.], seq 14635312:14635568, ack 3713, win 501, options [nop,nop,TS val 1501361048 ecr 2205937209], length 256
02:09:37.067639 IP lamp-ubuntu-s-1vcpu-1gb-tor1-01.ssh > 162.243.190.66.33873: Flags [P.], seq 14635568:14635824, ack 3713, win 501, options [nop,nop,TS val 1501361048 ecr 2205937209], length 256
02:09:37.067677 IP lamp-ubuntu-s-1vcpu-1gb-tor1-01.ssh > 162.243.190.66.33873: Flags [P.], seq 14635824:14636080, ack 3713, win 501, options [nop,nop,TS val 1501361048 ecr 2205937209], length 256
02:09:37.067715 IP lamp-ubuntu-s-1vcpu-1gb-tor1-01.ssh > 162.243.190.66.33873: Flags [P.], seq 14636080:14636336, ack 3713, win 501, options [nop,nop,TS val 1501361048 ecr 2205937209], length 256
02:09:37.067767 IP lamp-ubuntu-s-1vcpu-1gb-tor1-01.ssh > 162.243.190.66.33873: Flags [P.], seq 14636336:14636592, ack 3713, win 501, options [nop,nop,TS val 1501361048 ecr 2205937209], length 256
02:09:37.067811 IP lamp-ubuntu-s-1vcpu-1gb-tor1-01.ssh > 162.243.190.66.33873: Flags [P.], seq 14636592:14636848, ack 3713, win 501, options [nop,nop,TS val 1501361048 ecr 2205937209], length 256
02:09:37.067878 IP lamp-ubuntu-s-1vcpu-1gb-tor1-01.ssh > 162.243.190.66.33873: Flags [P.], seq 14636848:14637104, ack 3713, win 501, options [nop,nop,TS val 1501361048 ecr 2205937209], length 256
02:09:37.067922 IP lamp-ubuntu-s-1vcpu-1gb-tor1-01.ssh > 162.243.190.66.33873: Flags [P.], seq 14637104:14637360, ack 3713, win 501, options [nop,nop,TS val 1501361048 ecr 2205937209], length 256
02:09:37.067981 IP lamp-ubuntu-s-1vcpu-1gb-tor1-01.ssh > 162.243.190.66.33873: Flags [P.], seq 14637360:14637616, ack 3713, win 501, options [nop,nop,TS val 1501361048 ecr 2205937209], length 256
02:09:37.068081 IP lamp-ubuntu-s-1vcpu-1gb-tor1-01.ssh > 162.243.190.66.33873: Flags [P.], seq 14637616:14637872, ack 3713, win 501, options [nop,nop,TS val 1501361048 ecr 2205937209], length 256
02:09:37.068102 IP 162.243.190.66.33873 > lamp-ubuntu-s-1vcpu-1gb-tor1-01.ssh: Flags [.], ack 14633280, win 2075, options [nop,nop,TS val 2205937209 ecr 1501361047], length 0
02:09:37.068159 IP lamp-ubuntu-s-1vcpu-1gb-tor1-01.ssh > 162.243.190.66.33873: Flags [P.], seq 14637872:14638304, ack 3713, win 501, options [nop,nop,TS val 1501361048 ecr 2205937209], length 432
02:09:37.068259 IP lamp-ubuntu-s-1vcpu-1gb-tor1-01.ssh > 162.243.190.66.33873: Flags [P.], seq 14638304:14638560, ack 3713, win 501, options [nop,nop,TS val 1501361049 ecr 2205937209], length 256
02:09:37.068583 IP 162.243.190.66.33873 > lamp-ubuntu-s-1vcpu-1gb-tor1-01.ssh: Flags [.], ack 14634816, win 2075, options [nop,nop,TS val 2205937209 ecr 1501361047], length 0
02:09:37.068583 IP 162.243.190.66.33873 > lamp-ubuntu-s-1vcpu-1gb-tor1-01.ssh: Flags [.], ack 14636336, win 2075, options [nop,nop,TS val 2205937210 ecr 1501361048], length 0
02:09:37.068583 IP 162.243.190.66.33873 > lamp-ubuntu-s-1vcpu-1gb-tor1-01.ssh: Flags [.], ack 14637872, win 2075, options [nop,nop,TS val 2205937210 ecr 1501361048], length 0
02:09:37.068598 IP lamp-ubuntu-s-1vcpu-1gb-tor1-01.ssh > 162.243.190.66.33873: Flags [P.], seq 14638560:14638816, ack 3713, win 501, options [nop,nop,TS val 1501361049 ecr 2205937209], length 256
02:09:37.068716 IP lamp-ubuntu-s-1vcpu-1gb-tor1-01.ssh > 162.243.190.66.33873: Flags [P.], seq 14638816:14639600, ack 3713, win 501, options [nop,nop,TS val 1501361049 ecr 2205937210], length 784
02:09:37.068768 IP lamp-ubuntu-s-1vcpu-1gb-tor1-01.ssh > 162.243.190.66.33873: Flags [P.], seq 14639600:14639856, ack 3713, win 501, options [nop,nop,TS val 1501361049 ecr 2205937210], length 256
02:09:37.068809 IP lamp-ubuntu-s-1vcpu-1gb-tor1-01.ssh > 162.243.190.66.33873: Flags [P.], seq 14639856:14640112, ack 3713, win 501, options [nop,nop,TS val 1501361049 ecr 2205937210], length 256
02:09:37.068880 IP lamp-ubuntu-s-1vcpu-1gb-tor1-01.ssh > 162.243.190.66.33873: Flags [P.], seq 14640112:14640368, ack 3713, win 501, options [nop,nop,TS val 1501361049 ecr 2205937210], length 256
02:09:37.068941 IP lamp-ubuntu-s-1vcpu-1gb-tor1-01.ssh > 162.243.190.66.33873: Flags [P.], seq 14640368:14640624, ack 3713, win 501, options [nop,nop,TS val 1501361049 ecr 2205937210], length 256
02:09:37.069089 IP 162.243.190.66.33873 > lamp-ubuntu-s-1vcpu-1gb-tor1-01.ssh: Flags [.], ack 14639600, win 2075, options [nop,nop,TS val 2205937210 ecr 1501361048], length 0
02:09:37.069102 IP lamp-ubuntu-s-1vcpu-1gb-tor1-01.ssh > 162.243.190.66.33873: Flags [P.], seq 14640624:14640880, ack 3713, win 501, options [nop,nop,TS val 1501361049 ecr 2205937210], length 256
02:09:37.069197 IP lamp-ubuntu-s-1vcpu-1gb-tor1-01.ssh > 162.243.190.66.33873: Flags [P.], seq 14640880:14641312, ack 3713, win 501, options [nop,nop,TS val 1501361049 ecr 2205937210], length 432
02:09:37.069243 IP lamp-ubuntu-s-1vcpu-1gb-tor1-01.ssh > 162.243.190.66.33873: Flags [P.], seq 14641312:14641568, ack 3713, win 501, options [nop,nop,TS val 1501361049 ecr 2205937210], length 256
02:09:37.069306 IP lamp-ubuntu-s-1vcpu-1gb-tor1-01.ssh > 162.243.190.66.33873: Flags [P.], seq 14641568:14641824, ack 3713, win 501, options [nop,nop,TS val 1501361050 ecr 2205937210], length 256
02:09:37.069357 IP lamp-ubuntu-s-1vcpu-1gb-tor1-01.ssh > 162.243.190.66.33873: Flags [P.], seq 14641824:14642080, ack 3713, win 501, options [nop,nop,TS val 1501361050 ecr 2205937210], length 256
02:09:37.069396 IP lamp-ubuntu-s-1vcpu-1gb-tor1-01.ssh > 162.243.190.66.33873: Flags [P.], seq 14642080:14642336, ack 3713, win 501, options [nop,nop,TS val 1501361050 ecr 2205937210], length 256
02:09:37.069571 IP 162.243.190.66.33873 > lamp-ubuntu-s-1vcpu-1gb-tor1-01.ssh: Flags [.], ack 14641312, win 2075, options [nop,nop,TS val 2205937211 ecr 1501361049], length 0
02:09:37.069589 IP lamp-ubuntu-s-1vcpu-1gb-tor1-01.ssh > 162.243.190.66.33873: Flags [P.], seq 14642336:14642592, ack 3713, win 501, options [nop,nop,TS val 1501361050 ecr 2205937211], length 256
02:09:37.069670 IP lamp-ubuntu-s-1vcpu-1gb-tor1-01.ssh > 162.243.190.66.33873: Flags [P.], seq 14642592:14643024, ack 3713, win 501, options [nop,nop,TS val 1501361050 ecr 2205937211], length 432
02:09:37.069711 IP lamp-ubuntu-s-1vcpu-1gb-tor1-01.ssh > 162.243.190.66.33873: Flags [P.], seq 14643024:14643280, ack 3713, win 501, options [nop,nop,TS val 1501361050 ecr 2205937211], length 256
02:09:37.069752 IP lamp-ubuntu-s-1vcpu-1gb-tor1-01.ssh > 162.243.190.66.33873: Flags [P.], seq 14643280:14643536, ack 3713, win 501, options [nop,nop,TS val 1501361050 ecr 2205937211], length 256
02:09:37.069814 IP lamp-ubuntu-s-1vcpu-1gb-tor1-01.ssh > 162.243.190.66.33873: Flags [P.], seq 14643536:14643792, ack 3713, win 501, options [nop,nop,TS val 1501361050 ecr 2205937211], length 256
02:09:37.069876 IP lamp-ubuntu-s-1vcpu-1gb-tor1-01.ssh > 162.243.190.66.33873: Flags [P.], seq 14643792:14644048, ack 3713, win 501, options [nop,nop,TS val 1501361050 ecr 2205937211], length 256
02:09:37.070033 IP 162.243.190.66.33873 > lamp-ubuntu-s-1vcpu-1gb-tor1-01.ssh: Flags [.], ack 14643024, win 2075, options [nop,nop,TS val 2205937211 ecr 1501361049], length 0
02:09:37.070047 IP lamp-ubuntu-s-1vcpu-1gb-tor1-01.ssh > 162.243.190.66.33873: Flags [P.], seq 14644048:14644304, ack 3713, win 501, options [nop,nop,TS val 1501361050 ecr 2205937211], length 256
02:09:37.070136 IP lamp-ubuntu-s-1vcpu-1gb-tor1-01.ssh > 162.243.190.66.33873: Flags [P.], seq 14644304:14644736, ack 3713, win 501, options [nop,nop,TS val 1501361050 ecr 2205937211], length 432
02:09:37.070202 IP lamp-ubuntu-s-1vcpu-1gb-tor1-01.ssh > 162.243.190.66.33873: Flags [P.], seq 14644736:14644992, ack 3713, win 501, options [nop,nop,TS val 1501361050 ecr 2205937211], length 256
02:09:37.070264 IP lamp-ubuntu-s-1vcpu-1gb-tor1-01.ssh > 162.243.190.66.33873: Flags [P.], seq 14644992:14645248, ack 3713, win 501, options [nop,nop,TS val 1501361051 ecr 2205937211], length 256
02:09:37.070325 IP lamp-ubuntu-s-1vcpu-1gb-tor1-01.ssh > 162.243.190.66.33873: Flags [P.], seq 14645248:14645504, ack 3713, win 501, options [nop,nop,TS val 1501361051 ecr 2205937211], length 256
02:09:37.070464 IP 162.243.190.66.33873 > lamp-ubuntu-s-1vcpu-1gb-tor1-01.ssh: Flags [.], ack 14644736, win 2075, options [nop,nop,TS val 2205937212 ecr 1501361050], length 0
02:09:37.070480 IP lamp-ubuntu-s-1vcpu-1gb-tor1-01.ssh > 162.243.190.66.33873: Flags [P.], seq 14645504:14645760, ack 3713, win 501, options [nop,nop,TS val 1501361051 ecr 2205937212], length 256
02:09:37.070574 IP lamp-ubuntu-s-1vcpu-1gb-tor1-01.ssh > 162.243.190.66.33873: Flags [P.], seq 14645760:14646192, ack 3713, win 501, options [nop,nop,TS val 1501361051 ecr 2205937212], length 432
02:09:37.070619 IP lamp-ubuntu-s-1vcpu-1gb-tor1-01.ssh > 162.243.190.66.33873: Flags [P.], seq 14646192:14646448, ack 3713, win 501, options [nop,nop,TS val 1501361051 ecr 2205937212], length 256
02:09:37.070657 IP lamp-ubuntu-s-1vcpu-1gb-tor1-01.ssh > 162.243.190.66.33873: Flags [P.], seq 14646448:14646704, ack 3713, win 501, options [nop,nop,TS val 1501361051 ecr 2205937212], length 256
02:09:37.070723 IP lamp-ubuntu-s-1vcpu-1gb-tor1-01.ssh > 162.243.190.66.33873: Flags [P.], seq 14646704:14646960, ack 3713, win 501, options [nop,nop,TS val 1501361051 ecr 2205937212], length 256
02:09:37.070769 IP lamp-ubuntu-s-1vcpu-1gb-tor1-01.ssh > 162.243.190.66.33873: Flags [P.], seq 14646960:14647216, ack 3713, win 501, options [nop,nop,TS val 1501361051 ecr 2205937212], length 256
02:09:37.070901 IP lamp-ubuntu-s-1vcpu-1gb-tor1-01.ssh > 162.243.190.66.33873: Flags [P.], seq 14647216:14647472, ack 3713, win 501, options [nop,nop,TS val 1501361051 ecr 2205937212], length 256
02:09:37.070932 IP 162.243.190.66.33873 > lamp-ubuntu-s-1vcpu-1gb-tor1-01.ssh: Flags [.], ack 14646192, win 2075, options [nop,nop,TS val 2205937212 ecr 1501361050], length 0
02:09:37.070994 IP lamp-ubuntu-s-1vcpu-1gb-tor1-01.ssh > 162.243.190.66.33873: Flags [P.], seq 14647472:14647648, ack 3713, win 501, options [nop,nop,TS val 1501361051 ecr 2205937212], length 176
02:09:37.071354 IP 162.243.190.66.33873 > lamp-ubuntu-s-1vcpu-1gb-tor1-01.ssh: Flags [.], ack 14647648, win 2075, options [nop,nop,TS val 2205937213 ecr 1501361051], length 0
02:09:40.171692 IP 162.243.190.66.33873 > lamp-ubuntu-s-1vcpu-1gb-tor1-01.ssh: Flags [P.], seq 3713:3745, ack 14647648, win 2075, options [nop,nop,TS val 2205940313 ecr 1501361051], length 32
02:09:40.171898 IP 162.243.190.66.33873 > lamp-ubuntu-s-1vcpu-1gb-tor1-01.ssh: Flags [P.], seq 3745:3777, ack 14647648, win 2075, options [nop,nop,TS val 2205940313 ecr 1501361051], length 32
02:09:40.171965 IP lamp-ubuntu-s-1vcpu-1gb-tor1-01.ssh > 162.243.190.66.33873: Flags [.], ack 3777, win 501, options [nop,nop,TS val 1501364152 ecr 2205940313], length 0

02:09:40.786018 IP 162.243.190.66.33873 > lamp-ubuntu-s-1vcpu-1gb-tor1-01.ssh: Flags [P.], seq 3777:3809, ack 14647648, win 2075, options [nop,nop,TS val 2205940927 ecr 1501364152], length 32
02:09:40.794631 IP 162.243.190.66.33873 > lamp-ubuntu-s-1vcpu-1gb-tor1-01.ssh: Flags [P.], seq 3809:3841, ack 14647648, win 2075, options [nop,nop,TS val 2205940936 ecr 1501364152], length 32
02:09:40.794834 IP lamp-ubuntu-s-1vcpu-1gb-tor1-01.ssh > 162.243.190.66.33873: Flags [.], ack 3841, win 501, options [nop,nop,TS val 1501364775 ecr 2205940927], length 0

02:09:41.810976 IP 162.243.190.66.33873 > lamp-ubuntu-s-1vcpu-1gb-tor1-01.ssh: Flags [P.], seq 3841:3873, ack 14647648, win 2075, options [nop,nop,TS val 2205941952 ecr 1501364775], length 32
02:09:41.812037 IP 162.243.190.66.33873 > lamp-ubuntu-s-1vcpu-1gb-tor1-01.ssh: Flags [P.], seq 3873:3905, ack 14647648, win 2075, options [nop,nop,TS val 2205941953 ecr 1501364775], length 32
02:09:41.812185 IP lamp-ubuntu-s-1vcpu-1gb-tor1-01.ssh > 162.243.190.66.33873: Flags [.], ack 3905, win 501, options [nop,nop,TS val 1501365792 ecr 2205941952], length 0
C02:09:42.996936 IP 162.243.190.66.33873 > lamp-ubuntu-s-1vcpu-1gb-tor1-01.ssh: Flags [P.], seq 3905:3937, ack 14647648, win 2075, options [nop,nop,TS val 2205943138 ecr 1501365792], length 32
02:09:42.996936 IP 162.243.190.66.33873 > lamp-ubuntu-s-1vcpu-1gb-tor1-01.ssh: Flags [P.], seq 3937:3969, ack 14647648, win 2075, options [nop,nop,TS val 2205943138 ecr 1501365792], length 32
02:09:42.997250 IP lamp-ubuntu-s-1vcpu-1gb-tor1-01.ssh > 162.243.190.66.33873: Flags [.], ack 3969, win 501, options [nop,nop,TS val 1501366977 ecr 2205943138], length 0
^C
60288 packets captured
60353 packets received by filter
65 packets dropped by kernel