, options [nop,nop,TS val 1501228981 ecr 2205805142], length 240
02:07:25.001166 IP 143.110.223.143.22 > 162.243.190.66.33873: Flags [P.], seq 23062768:23063008, ack 961, win 502, options [nop,nop,TS val 1501228981 ecr 2205805142], length 240
02:07:25.001221 IP 143.110.223.143.22 > 162.243.190.66.33873: Flags [P.], seq 23063008:23063248, ack 961, win 502, options [nop,nop,TS val 1501228981 ecr 2205805142], length 240
02:07:25.001276 IP 143.110.223.143.22 > 162.243.190.66.33873: Flags [P.], seq 23063248:23063488, ack 961, win 502, options [nop,nop,TS val 1501228982 ecr 2205805142], length 240
02:07:25.001336 IP 143.110.223.143.22 > 162.243.190.66.33873: Flags [P.], seq 23063488:23063728, ack 961, win 502, options [nop,nop,TS val 1501228982 ecr 2205805142], length 240
02:07:25.001390 IP 143.110.223.143.22 > 162.243.190.66.33873: Flags [P.], seq 23063728:23063968, ack 961, win 502, options [nop,nop,TS val 1501228982 ecr 2205805142], length 240
02:07:25.001446 IP 143.110.223.143.22 > 162.243.190.66.33873: Flags [P.], seq 23063968:23064208, ack 961, win 502, options [nop,nop,TS val 1501228982 ecr 2205805142], length 240
02:07:25.001496 IP 162.243.190.66.33873 > 143.110.223.143.22: Flags [.], ack 23062528, win 1625, options [nop,nop,TS val 2205805143 ecr 1501228981], length 0
02:07:25.001565 IP 143.110.223.143.22 > 162.243.190.66.33873: Flags [P.], seq 23064208:23064608, ack 961, win 502, options [nop,nop,TS val 1501228982 ecr 2205805143], length 400
02:07:25.001626 IP 143.110.223.143.22 > 162.243.190.66.33873: Flags [P.], seq 23064608:23064848, ack 961, win 502, options [nop,nop,TS val 1501228982 ecr 2205805143], length 240
02:07:25.001681 IP 143.110.223.143.22 > 162.243.190.66.33873: Flags [P.], seq 23064848:23065088, ack 961, win 502, options [nop,nop,TS val 1501228982 ecr 2205805143], length 240
02:07:25.001725 IP 162.243.190.66.33873 > 143.110.223.143.22: Flags [.], ack 23063728, win 1616, options [nop,nop,TS val 2205805143 ecr 1501228981], length 0
02:07:25.001777 IP 143.110.223.143.22 > 162.243.190.66.33873: Flags [P.], seq 23065088:23065488, ack 961, win 502, options [nop,nop,TS val 1501228982 ecr 2205805143], length 400
02:07:25.001836 IP 143.110.223.143.22 > 162.243.190.66.33873: Flags [P.], seq 23065488:23065728, ack 961, win 502, options [nop,nop,TS val 1501228982 ecr 2205805143], length 240
02:07:25.001891 IP 143.110.223.143.22 > 162.243.190.66.33873: Flags [P.], seq 23065728:23065968, ack 961, win 502, options [nop,nop,TS val 1501228982 ecr 2205805143], length 240
02:07:25.001966 IP 143.110.223.143.22 > 162.243.190.66.33873: Flags [P.], seq 23065968:23066208, ack 961, win 502, options [nop,nop,TS val 1501228982 ecr 2205805143], length 240
02:07:25.002015 IP 162.243.190.66.33873 > 143.110.223.143.22: Flags [.], ack 23065088, win 1606, options [nop,nop,TS val 2205805143 ecr 1501228982], length 0
02:07:25.002068 IP 143.110.223.143.22 > 162.243.190.66.33873: Flags [P.], seq 23066208:23066608, ack 961, win 502, options [nop,nop,TS val 1501228982 ecr 2205805143], length 400
02:07:25.002131 IP 143.110.223.143.22 > 162.243.190.66.33873: Flags [P.], seq 23066608:23066848, ack 961, win 502, options [nop,nop,TS val 1501228982 ecr 2205805143], length 240
02:07:25.002187 IP 143.110.223.143.22 > 162.243.190.66.33873: Flags [P.], seq 23066848:23067088, ack 961, win 502, options [nop,nop,TS val 1501228982 ecr 2205805143], length 240
02:07:25.002242 IP 143.110.223.143.22 > 162.243.190.66.33873: Flags [P.], seq 23067088:23067328, ack 961, win 502, options [nop,nop,TS val 1501228982 ecr 2205805143], length 240
02:07:25.002311 IP 143.110.223.143.22 > 162.243.190.66.33873: Flags [P.], seq 23067328:23067568, ack 961, win 502, options [nop,nop,TS val 1501228983 ecr 2205805143], length 240
02:07:25.002375 IP 143.110.223.143.22 > 162.243.190.66.33873: Flags [P.], seq 23067568:23067808, ack 961, win 502, options [nop,nop,TS val 1501228983 ecr 2205805143], length 240
02:07:25.002430 IP 143.110.223.143.22 > 162.243.190.66.33873: Flags [P.], seq 23067808:23068048, ack 961, win 502, options [nop,nop,TS val 1501228983 ecr 2205805143], length 240
02:07:25.002487 IP 143.110.223.143.22 > 162.243.190.66.33873: Flags [P.], seq 23068048:23068288, ack 961, win 502, options [nop,nop,TS val 1501228983 ecr 2205805143], length 240
02:07:25.002541 IP 143.110.223.143.22 > 162.243.190.66.33873: Flags [P.], seq 23068288:23068528, ack 961, win 502, options [nop,nop,TS val 1501228983 ecr 2205805143], length 240
02:07:25.002593 IP 162.243.190.66.33873 > 143.110.223.143.22: Flags [.], ack 23066608, win 1595, options [nop,nop,TS val 2205805144 ecr 1501228982], length 0
02:07:25.002640 IP 143.110.223.143.22 > 162.243.190.66.33873: Flags [P.], seq 23068528:23068768, ack 961, win 502, options [nop,nop,TS val 1501228983 ecr 2205805144], length 240
02:07:25.002692 IP 143.110.223.143.22 > 162.243.190.66.33873: Flags [P.], seq 23068768:23068992, ack 961, win 502, options [nop,nop,TS val 1501228983 ecr 2205805144], length 224
02:07:25.002742 IP 143.110.223.143.22 > 162.243.190.66.33873: Flags [P.], seq 23068992:23069232, ack 961, win 502, options [nop,nop,TS val 1501228983 ecr 2205805144], length 240
02:07:25.002810 IP 162.243.190.66.33873 > 143.110.223.143.22: Flags [.], ack 23068048, win 1584, options [nop,nop,TS val 2205805144 ecr 1501228982], length 0
02:07:25.002863 IP 143.110.223.143.22 > 162.243.190.66.33873: Flags [P.], seq 23069232:23069472, ack 961, win 502, options [nop,nop,TS val 1501228983 ecr 2205805144], length 240
02:07:25.002934 IP 143.110.223.143.22 > 162.243.190.66.33873: Flags [P.], seq 23069472:23069872, ack 961, win 502, options [nop,nop,TS val 1501228983 ecr 2205805144], length 400
02:07:25.002986 IP 143.110.223.143.22 > 162.243.190.66.33873: Flags [P.], seq 23069872:23070112, ack 961, win 502, options [nop,nop,TS val 1501228983 ecr 2205805144], length 240
02:07:25.003037 IP 143.110.223.143.22 > 162.243.190.66.33873: Flags [P.], seq 23070112:23070352, ack 961, win 502, options [nop,nop,TS val 1501228983 ecr 2205805144], length 240
02:07:25.003090 IP 143.110.223.143.22 > 162.243.190.66.33873: Flags [P.], seq 23070352:23070592, ack 961, win 502, options [nop,nop,TS val 1501228983 ecr 2205805144], length 240
02:07:25.003140 IP 143.110.223.143.22 > 162.243.190.66.33873: Flags [P.], seq 23070592:23070832, ack 961, win 502, options [nop,nop,TS val 1501228983 ecr 2205805144], length 240
02:07:25.003184 IP 162.243.190.66.33873 > 143.110.223.143.22: Flags [.], ack 23069472, win 1573, options [nop,nop,TS val 2205805144 ecr 1501228983], length 0
02:07:25.003228 IP 143.110.223.143.22 > 162.243.190.66.33873: Flags [P.], seq 23070832:23071072, ack 961, win 502, options [nop,nop,TS val 1501228983 ecr 2205805144], length 240
02:07:25.003413 IP 143.110.223.143.22 > 162.243.190.66.33873: Flags [P.], seq 23071072:23071472, ack 961, win 502, options [nop,nop,TS val 1501228984 ecr 2205805144], length 400
02:07:25.003467 IP 162.243.190.66.33873 > 143.110.223.143.22: Flags [.], ack 23070832, win 1563, options [nop,nop,TS val 2205805145 ecr 1501228983], length 0
02:07:25.003519 IP 143.110.223.143.22 > 162.243.190.66.33873: Flags [P.], seq 23071472:23071712, ack 961, win 502, options [nop,nop,TS val 1501228984 ecr 2205805145], length 240
02:07:25.003577 IP 143.110.223.143.22 > 162.243.190.66.33873: Flags [P.], seq 23071712:23072112, ack 961, win 502, options [nop,nop,TS val 1501228984 ecr 2205805145], length 400
02:07:25.003628 IP 143.110.223.143.22 > 162.243.190.66.33873: Flags [P.], seq 23072112:23072352, ack 961, win 502, options [nop,nop,TS val 1501228984 ecr 2205805145], length 240
02:07:25.003680 IP 143.110.223.143.22 > 162.243.190.66.33873: Flags [P.], seq 23072352:23072592, ack 961, win 502, options [nop,nop,TS val 1501228984 ecr 2205805145], length 240
02:07:25.003730 IP 143.110.223.143.22 > 162.243.190.66.33873: Flags [P.], seq 23072592:23072832, ack 961, win 502, options [nop,nop,TS val 1501228984 ecr 2205805145], length 240
02:07:25.003782 IP 143.110.223.143.22 > 162.243.190.66.33873: Flags [P.], seq 23072832:23073072, ack 961, win 502, options [nop,nop,TS val 1501228984 ecr 2205805145], length 240
02:07:25.003946 IP 162.243.190.66.33873 > 143.110.223.143.22: Flags [.], ack 23072112, win 1553, options [nop,nop,TS val 2205805145 ecr 1501228983], length 0
02:07:25.004011 IP 143.110.223.143.22 > 162.243.190.66.33873: Flags [P.], seq 23073072:23073312, ack 961, win 502, options [nop,nop,TS val 1501228984 ecr 2205805145], length 240
02:07:25.004070 IP 143.110.223.143.22 > 162.243.190.66.33873: Flags [P.], seq 23073312:23073712, ack 961, win 502, options [nop,nop,TS val 1501228984 ecr 2205805145], length 400
02:07:25.004126 IP 143.110.223.143.22 > 162.243.190.66.33873: Flags [P.], seq 23073712:23074192, ack 961, win 502, options [nop,nop,TS val 1501228984 ecr 2205805145], length 480
02:07:25.004188 IP 143.110.223.143.22 > 162.243.190.66.33873: Flags [P.], seq 23074192:23074432, ack 961, win 502, options [nop,nop,TS val 1501228984 ecr 2205805145], length 240
02:07:25.004243 IP 143.110.223.143.22 > 162.243.190.66.33873: Flags [P.], seq 23074432:23074672, ack 961, win 502, options [nop,nop,TS val 1501228984 ecr 2205805145], length 240
02:07:25.004299 IP 143.110.223.143.22 > 162.243.190.66.33873: Flags [P.], seq 23074672:23074912, ack 961, win 502, options [nop,nop,TS val 1501228985 ecr 2205805145], length 240
02:07:25.004352 IP 143.110.223.143.22 > 162.243.190.66.33873: Flags [P.], seq 23074912:23075152, ack 961, win 502, options [nop,nop,TS val 1501228985 ecr 2205805145], length 240
02:07:25.004379 IP 162.243.190.66.33873 > 143.110.223.143.22: Flags [.], ack 23073312, win 1544, options [nop,nop,TS val 2205805146 ecr 1501228984], length 0
02:07:25.004460 IP 143.110.223.143.22 > 162.243.190.66.33873: Flags [P.], seq 23075152:23075552, ack 961, win 502, options [nop,nop,TS val 1501228985 ecr 2205805146], length 400
02:07:25.004538 IP 143.110.223.143.22 > 162.243.190.66.33873: Flags [P.], seq 23075552:23075792, ack 961, win 502, options [nop,nop,TS val 1501228985 ecr 2205805146], length 240
02:07:25.004588 IP 162.243.190.66.33873 > 143.110.223.143.22: Flags [.], ack 23074672, win 1534, options [nop,nop,TS val 2205805146 ecr 1501228984], length 0
02:07:25.004643 IP 143.110.223.143.22 > 162.243.190.66.33873: Flags [P.], seq 23075792:23076192, ack 961, win 502, options [nop,nop,TS val 1501228985 ecr 2205805146], length 400
02:07:25.004707 IP 143.110.223.143.22 > 162.243.190.66.33873: Flags [P.], seq 23076192:23076432, ack 961, win 502, options [nop,nop,TS val 1501228985 ecr 2205805146], length 240
02:07:25.004777 IP 143.110.223.143.22 > 162.243.190.66.33873: Flags [P.], seq 23076432:23076672, ack 961, win 502, options [nop,nop,TS val 1501228985 ecr 2205805146], length 240
02:07:25.004843 IP 143.110.223.143.22 > 162.243.190.66.33873: Flags [P.], seq 23076672:23076912, ack 961, win 502, options [nop,nop,TS val 1501228985 ecr 2205805146], length 240
02:07:25.004904 IP 143.110.223.143.22 > 162.243.190.66.33873: Flags [P.], seq 23076912:23077152, ack 961, win 502, options [nop,nop,TS val 1501228985 ecr 2205805146], length 240
02:07:25.004969 IP 143.110.223.143.22 > 162.243.190.66.33873: Flags [P.], seq 23077152:23077392, ack 961, win 502, options [nop,nop,TS val 1501228985 ecr 2205805146], length 240
02:07:25.004984 IP 162.243.190.66.33873 > 143.110.223.143.22: Flags [.], ack 23076192, win 1523, options [nop,nop,TS val 2205805146 ecr 1501228985], length 0
02:07:25.005077 IP 143.110.223.143.22 > 162.243.190.66.33873: Flags [P.], seq 23077392:23077792, ack 961, win 502, options [nop,nop,TS val 1501228985 ecr 2205805146], length 400
02:07:25.005130 IP 143.110.223.143.22 > 162.243.190.66.33873: Flags [P.], seq 23077792:23078032, ack 961, win 502, options [nop,nop,TS val 1501228985 ecr 2205805146], length 240
02:07:25.005186 IP 143.110.223.143.22 > 162.243.190.66.33873: Flags [P.], seq 23078032:23078272, ack 961, win 502, options [nop,nop,TS val 1501228985 ecr 2205805146], length 240
02:07:25.005241 IP 143.110.223.143.22 > 162.243.190.66.33873: Flags [P.], seq 23078272:23078512, ack 961, win 502, options [nop,nop,TS val 1501228985 ecr 2205805146], length 240
02:07:25.005291 IP 162.243.190.66.33873 > 143.110.223.143.22: Flags [.], ack 23077392, win 1514, options [nop,nop,TS val 2205805147 ecr 1501228985], length 0
02:07:25.005334 IP 143.110.223.143.22 > 162.243.190.66.33873: Flags [P.], seq 23078512:23078752, ack 961, win 502, options [nop,nop,TS val 1501228986 ecr 2205805147], length 240
02:07:25.005388 IP 143.110.223.143.22 > 162.243.190.66.33873: Flags [P.], seq 23078752:23078976, ack 961, win 502, options [nop,nop,TS val 1501228986 ecr 2205805147], length 224
02:07:25.005439 IP 143.110.223.143.22 > 162.243.190.66.33873: Flags [P.], seq 23078976:23079216, ack 961, win 502, options [nop,nop,TS val 1501228986 ecr 2205805147], length 240
02:07:25.005492 IP 143.110.223.143.22 > 162.243.190.66.33873: Flags [P.], seq 23079216:23079456, ack 961, win 502, options [nop,nop,TS val 1501228986 ecr 2205805147], length 240
02:07:25.005547 IP 143.110.223.143.22 > 162.243.190.66.33873: Flags [P.], seq 23079456:23079936, ack 961, win 502, options [nop,nop,TS val 1501228986 ecr 2205805147], length 480
02:07:25.005610 IP 143.110.223.143.22 > 162.243.190.66.33873: Flags [P.], seq 23079936:23080176, ack 961, win 502, options [nop,nop,TS val 1501228986 ecr 2205805147], length 240
02:07:25.005672 IP 143.110.223.143.22 > 162.243.190.66.33873: Flags [P.], seq 23080176:23080416, ack 961, win 502, options [nop,nop,TS val 1501228986 ecr 2205805147], length 240
02:07:25.005730 IP 143.110.223.143.22 > 162.243.190.66.33873: Flags [P.], seq 23080416:23080656, ack 961, win 502, options [nop,nop,TS val 1501228986 ecr 2205805147], length 240
02:07:25.005813 IP 162.243.190.66.33873 > 143.110.223.143.22: Flags [.], ack 23078752, win 1504, options [nop,nop,TS val 2205805147 ecr 1501228985], length 0
02:07:25.005825 IP 143.110.223.143.22 > 162.243.190.66.33873: Flags [P.], seq 23080656:23080896, ack 961, win 502, options [nop,nop,TS val 1501228986 ecr 2205805147], length 240
02:07:25.005911 IP 143.110.223.143.22 > 162.243.190.66.33873: Flags [P.], seq 23080896:23081296, ack 961, win 502, options [nop,nop,TS val 1501228986 ecr 2205805147], length 400
02:07:25.005970 IP 143.110.223.143.22 > 162.243.190.66.33873: Flags [P.], seq 23081296:23081536, ack 961, win 502, options [nop,nop,TS val 1501228986 ecr 2205805147], length 240
02:07:25.006009 IP 162.243.190.66.33873 > 143.110.223.143.22: Flags [.], ack 23080416, win 1491, options [nop,nop,TS val 2205805147 ecr 1501228986], length 0
02:07:25.006060 IP 143.110.223.143.22 > 162.243.190.66.33873: Flags [P.], seq 23081536:23081936, ack 961, win 502, options [nop,nop,TS val 1501228986 ecr 2205805147], length 400
02:07:25.006120 IP 143.110.223.143.22 > 162.243.190.66.33873: Flags [P.], seq 23081936:23082176, ack 961, win 502, options [nop,nop,TS val 1501228986 ecr 2205805147], length 240
02:07:25.006176 IP 143.110.223.143.22 > 162.243.190.66.33873: Flags [P.], seq 23082176:23082416, ack 961, win 502, options [nop,nop,TS val 1501228986 ecr 2205805147], length 240
02:07:25.006240 IP 143.110.223.143.22 > 162.243.190.66.33873: Flags [P.], seq 23082416:23082656, ack 961, win 502, options [nop,nop,TS val 1501228986 ecr 2205805147], length 240
02:07:25.006427 IP 162.243.190.66.33873 > 143.110.223.143.22: Flags [.], ack 23081936, win 1480, options [nop,nop,TS val 2205805148 ecr 1501228986], length 0
02:07:25.006479 IP 143.110.223.143.22 > 162.243.190.66.33873: Flags [P.], seq 23082656:23082896, ack 961, win 502, options [nop,nop,TS val 1501228987 ecr 2205805148], length 240
02:07:25.006534 IP 143.110.223.143.22 > 162.243.190.66.33873: Flags [P.], seq 23082896:23083120, ack 961, win 502, options [nop,nop,TS val 1501228987 ecr 2205805148], length 224
02:07:25.006583 IP 143.110.223.143.22 > 162.243.190.66.33873: Flags [P.], seq 23083120:23083360, ack 961, win 502, options [nop,nop,TS val 1501228987 ecr 2205805148], length 240
02:07:25.006634 IP 143.110.223.143.22 > 162.243.190.66.33873: Flags [P.], seq 23083360:23083600, ack 961, win 502, options [nop,nop,TS val 1501228987 ecr 2205805148], length 240
02:07:25.006688 IP 143.110.223.143.22 > 162.243.190.66.33873: Flags [P.], seq 23083600:23083840, ack 961, win 502, options [nop,nop,TS val 1501228987 ecr 2205805148], length 240
02:07:25.006736 IP 143.110.223.143.22 > 162.243.190.66.33873: Flags [P.], seq 23083840:23084080, ack 961, win 502, options [nop,nop,TS val 1501228987 ecr 2205805148], length 240
02:07:25.006811 IP 143.110.223.143.22 > 162.243.190.66.33873: Flags [P.], seq 23084080:23084320, ack 961, win 502, options [nop,nop,TS val 1501228987 ecr 2205805148], length 240
02:07:25.006869 IP 143.110.223.143.22 > 162.243.190.66.33873: Flags [P.], seq 23084320:23084800, ack 961, win 502, options [nop,nop,TS val 1501228987 ecr 2205805148], length 480
02:07:25.006949 IP 143.110.223.143.22 > 162.243.190.66.33873: Flags [P.], seq 23084800:23085040, ack 961, win 502, options [nop,nop,TS val 1501228987 ecr 2205805148], length 240
02:07:25.007006 IP 143.110.223.143.22 > 162.243.190.66.33873: Flags [P.], seq 23085040:23085280, ack 961, win 502, options [nop,nop,TS val 1501228987 ecr 2205805148], length 240
02:07:25.007059 IP 162.243.190.66.33873 > 143.110.223.143.22: Flags [.], ack 23083360, win 1469, options [nop,nop,TS val 2205805148 ecr 1501228986], length 0
02:07:25.007113 IP 143.110.223.143.22 > 162.243.190.66.33873: Flags [P.], seq 23085280:23085680, ack 961, win 502, options [nop,nop,TS val 1501228987 ecr 2205805148], length 400
02:07:25.007173 IP 143.110.223.143.22 > 162.243.190.66.33873: Flags [P.], seq 23085680:23085920, ack 961, win 502, options [nop,nop,TS val 1501228987 ecr 2205805148], length 240
02:07:25.007197 IP 162.243.190.66.33873 > 143.110.223.143.22: Flags [.], ack 23084800, win 1458, options [nop,nop,TS val 2205805148 ecr 1501228987], length 0
02:07:25.007263 IP 143.110.223.143.22 > 162.243.190.66.33873: Flags [P.], seq 23085920:23086320, ack 961, win 502, options [nop,nop,TS val 1501228988 ecr 2205805148], length 400
02:07:25.007321 IP 143.110.223.143.22 > 162.243.190.66.33873: Flags [P.], seq 23086320:23086560, ack 961, win 502, options [nop,nop,TS val 1501228988 ecr 2205805148], length 240
02:07:25.007376 IP 143.110.223.143.22 > 162.243.190.66.33873: Flags [P.], seq 23086560:23086800, ack 961, win 502, options [nop,nop,TS val 1501228988 ecr 2205805148], length 240
02:07:25.007432 IP 143.110.223.143.22 > 162.243.190.66.33873: Flags [P.], seq 23086800:23087040, ack 961, win 502, options [nop,nop,TS val 1501228988 ecr 2205805148], length 240
02:07:25.007490 IP 143.110.223.143.22 > 162.243.190.66.33873: Flags [P.], seq 23087040:23087280, ack 961, win 502, options [nop,nop,TS val 1501228988 ecr 2205805148], length 240
02:07:25.007547 IP 143.110.223.143.22 > 162.243.190.66.33873: Flags [P.], seq 23087280:23087520, ack 961, win 502, options [nop,nop,TS val 1501228988 ecr 2205805148], length 240
02:07:25.007606 IP 143.110.223.143.22 > 162.243.190.66.33873: Flags [P.], seq 23087520:23087760, ack 961, win 502, options [nop,nop,TS val 1501228988 ecr 2205805148], length 240
02:07:25.007654 IP 162.243.190.66.33873 > 143.110.223.143.22: Flags [.], ack 23086320, win 1447, options [nop,nop,TS val 2205805149 ecr 1501228987], length 0
02:07:25.007705 IP 143.110.223.143.22 > 162.243.190.66.33873: Flags [P.], seq 23087760:23088160, ack 961, win 502, options [nop,nop,TS val 1501228988 ecr 2205805149], length 400
02:07:25.007763 IP 143.110.223.143.22 > 162.243.190.66.33873: Flags [P.], seq 23088160:23088400, ack 961, win 502, options [nop,nop,TS val 1501228988 ecr 2205805149], length 240
02:07:25.007824 IP 143.110.223.143.22 > 162.243.190.66.33873: Flags [P.], seq 23088400:23088640, ack 961, win 502, options [nop,nop,TS val 1501228988 ecr 2205805149], length 240
02:07:25.007873 IP 162.243.190.66.33873 > 143.110.223.143.22: Flags [.], ack 23087520, win 1438, options [nop,nop,TS val 2205805149 ecr 1501228988], length 0
02:07:25.007925 IP 143.110.223.143.22 > 162.243.190.66.33873: Flags [P.], seq 23088640:23089040, ack 961, win 502, options [nop,nop,TS val 1501228988 ecr 2205805149], length 400
02:07:25.007982 IP 143.110.223.143.22 > 162.243.190.66.33873: Flags [P.], seq 23089040:23089280, ack 961, win 502, options [nop,nop,TS val 1501228988 ecr 2205805149], length 240
02:07:25.008036 IP 143.110.223.143.22 > 162.243.190.66.33873: Flags [P.], seq 23089280:23089520, ack 961, win 502, options [nop,nop,TS val 1501228988 ecr 2205805149], length 240
02:07:25.008090 IP 143.110.223.143.22 > 162.243.190.66.33873: Flags [P.], seq 23089520:23089760, ack 961, win 502, options [nop,nop,TS val 1501228988 ecr 2205805149], length 240
02:07:25.008143 IP 143.110.223.143.22 > 162.243.190.66.33873: Flags [P.], seq 23089760:23090000, ack 961, win 502, options [nop,nop,TS val 1501228988 ecr 2205805149], length 240
02:07:25.008198 IP 143.110.223.143.22 > 162.243.190.66.33873: Flags [P.], seq 23090000:23090240, ack 961, win 502, options [nop,nop,TS val 1501228988 ecr 2205805149], length 240
02:07:25.008252 IP 143.110.223.143.22 > 162.243.190.66.33873: Flags [P.], seq 23090240:23090480, ack 961, win 502, options [nop,nop,TS val 1501228989 ecr 2205805149], length 240
02:07:25.008305 IP 162.243.190.66.33873 > 143.110.223.143.22: Flags [.], ack 23089040, win 1427, options [nop,nop,TS val 2205805150 ecr 1501228988], length 0
02:07:25.008346 IP 143.110.223.143.22 > 162.243.190.66.33873: Flags [P.], seq 23090480:23090720, ack 961, win 502, options [nop,nop,TS val 1501228989 ecr 2205805150], length 240
02:07:25.008402 IP 143.110.223.143.22 > 162.243.190.66.33873: Flags [P.], seq 23090720:23091184, ack 961, win 502, options [nop,nop,TS val 1501228989 ecr 2205805150], length 464
02:07:25.008467 IP 143.110.223.143.22 > 162.243.190.66.33873: Flags [P.], seq 23091184:23091424, ack 961, win 502, options [nop,nop,TS val 1501228989 ecr 2205805150], length 240
02:07:25.008538 IP 162.243.190.66.33873 > 143.110.223.143.22: Flags [.], ack 23090240, win 1418, options [nop,nop,TS val 2205805150 ecr 1501228988], length 0
02:07:25.008591 IP 143.110.223.143.22 > 162.243.190.66.33873: Flags [P.], seq 23091424:23091824, ack 961, win 502, options [nop,nop,TS val 1501228989 ecr 2205805150], length 400
02:07:25.008651 IP 143.110.223.143.22 > 162.243.190.66.33873: Flags [P.], seq 23091824:23092064, ack 961, win 502, options [nop,nop,TS val 1501228989 ecr 2205805150], length 240
02:07:25.008705 IP 143.110.223.143.22 > 162.243.190.66.33873: Flags [P.], seq 23092064:23092304, ack 961, win 502, options [nop,nop,TS val 1501228989 ecr 2205805150], length 240
02:07:25.008760 IP 143.110.223.143.22 > 162.243.190.66.33873: Flags [P.], seq 23092304:23092544, ack 961, win 502, options [nop,nop,TS val 1501228989 ecr 2205805150], length 240
02:07:25.008815 IP 143.110.223.143.22 > 162.243.190.66.33873: Flags [P.], seq 23092544:23092784, ack 961, win 502, options [nop,nop,TS val 1501228989 ecr 2205805150], length 240
02:07:25.008871 IP 143.110.223.143.22 > 162.243.190.66.33873: Flags [P.], seq 23092784:23093024, ack 961, win 502, options [nop,nop,TS val 1501228989 ecr 2205805150], length 240
02:07:25.008927 IP 143.110.223.143.22 > 162.243.190.66.33873: Flags [P.], seq 23093024:23093264, ack 961, win 502, options [nop,nop,TS val 1501228989 ecr 2205805150], length 240
02:07:25.008939 IP 162.243.190.66.33873 > 143.110.223.143.22: Flags [.], ack 23091824, win 1406, options [nop,nop,TS val 2205805150 ecr 1501228989], length 0
02:07:25.009010 IP 143.110.223.143.22 > 162.243.190.66.33873: Flags [P.], seq 23093264:23093664, ack 961, win 502, options [nop,nop,TS val 1501228989 ecr 2205805150], length 400
02:07:25.009066 IP 143.110.223.143.22 > 162.243.190.66.33873: Flags [P.], seq 23093664:23093904, ack 961, win 502, options [nop,nop,TS val 1501228989 ecr 2205805150], length 240
02:07:25.009125 IP 143.110.223.143.22 > 162.243.190.66.33873: Flags [P.], seq 23093904:23094144, ack 961, win 502, options [nop,nop,TS val 1501228989 ecr 2205805150], length 240
02:07:25.009176 IP 162.243.190.66.33873 > 143.110.223.143.22: Flags [.], ack 23093024, win 1397, options [nop,nop,TS val 2205805150 ecr 1501228989], length 0
02:07:25.009227 IP 143.110.223.143.22 > 162.243.190.66.33873: Flags [P.], seq 23094144:23094544, ack 961, win 502, options [nop,nop,TS val 1501228989 ecr 2205805150], length 400
02:07:25.009283 IP 143.110.223.143.22 > 162.243.190.66.33873: Flags [P.], seq 23094544:23094784, ack 961, win 502, options [nop,nop,TS val 1501228990 ecr 2205805150], length 240
02:07:25.009337 IP 143.110.223.143.22 > 162.243.190.66.33873: Flags [P.], seq 23094784:23095024, ack 961, win 502, options [nop,nop,TS val 1501228990 ecr 2205805150], length 240
02:07:25.009393 IP 143.110.223.143.22 > 162.243.190.66.33873: Flags [P.], seq 23095024:23095264, ack 961, win 502, options [nop,nop,TS val 1501228990 ecr 2205805150], length 240
02:07:25.009449 IP 143.110.223.143.22 > 162.243.190.66.33873: Flags [P.], seq 23095264:23095504, ack 961, win 502, options [nop,nop,TS val 1501228990 ecr 2205805150], length 240
02:07:25.009505 IP 143.110.223.143.22 > 162.243.190.66.33873: Flags [P.], seq 23095504:23095744, ack 961, win 502, options [nop,nop,TS val 1501228990 ecr 2205805150], length 240
02:07:25.009562 IP 162.243.190.66.33873 > 143.110.223.143.22: Flags [.], ack 23094544, win 1386, options [nop,nop,TS val 2205805151 ecr 1501228989], length 0
02:07:25.009593 IP 143.110.223.143.22 > 162.243.190.66.33873: Flags [P.], seq 23095744:23095984, ack 961, win 502, options [nop,nop,TS val 1501228990 ecr 2205805150], length 240
02:07:25.009655 IP 143.110.223.143.22 > 162.243.190.66.33873: Flags [P.], seq 23095984:23096384, ack 961, win 502, options [nop,nop,TS val 1501228990 ecr 2205805151], length 400
02:07:25.009712 IP 143.110.223.143.22 > 162.243.190.66.33873: Flags [P.], seq 23096384:23096624, ack 961, win 502, options [nop,nop,TS val 1501228990 ecr 2205805151], length 240
02:07:25.009767 IP 143.110.223.143.22 > 162.243.190.66.33873: Flags [P.], seq 23096624:23096864, ack 961, win 502, options [nop,nop,TS val 1501228990 ecr 2205805151], length 240
02:07:25.009827 IP 162.243.190.66.33873 > 143.110.223.143.22: Flags [.], ack 23095744, win 1377, options [nop,nop,TS val 2205805151 ecr 1501228990], length 0
02:07:25.009835 IP 143.110.223.143.22 > 162.243.190.66.33873: Flags [P.], seq 23096864:23097104, ack 961, win 502, options [nop,nop,TS val 1501228990 ecr 2205805151], length 240
02:07:25.009918 IP 143.110.223.143.22 > 162.243.190.66.33873: Flags [P.], seq 23097104:23097504, ack 961, win 502, options [nop,nop,TS val 1501228990 ecr 2205805151], length 400
02:07:25.009976 IP 143.110.223.143.22 > 162.243.190.66.33873: Flags [P.], seq 23097504:23097744, ack 961, win 502, options [nop,nop,TS val 1501228990 ecr 2205805151], length 240
02:07:25.010033 IP 143.110.223.143.22 > 162.243.190.66.33873: Flags [P.], seq 23097744:23097984, ack 961, win 502, options [nop,nop,TS val 1501228990 ecr 2205805151], length 240
02:07:25.010088 IP 143.110.223.143.22 > 162.243.190.66.33873: Flags [P.], seq 23097984:23098224, ack 961, win 502, options [nop,nop,TS val 1501228990 ecr 2205805151], length 240
02:07:25.010144 IP 143.110.223.143.22 > 162.243.190.66.33873: Flags [P.], seq 23098224:23098464, ack 961, win 502, options [nop,nop,TS val 1501228990 ecr 2205805151], length 240
02:07:25.010188 IP 162.243.190.66.33873 > 143.110.223.143.22: Flags [.], ack 23097104, win 1367, options [nop,nop,TS val 2205805151 ecr 1501228990], length 0
02:07:25.010238 IP 143.110.223.143.22 > 162.243.190.66.33873: Flags [P.], seq 23098464:23098864, ack 961, win 502, options [nop,nop,TS val 1501228990 ecr 2205805151], length 400
02:07:25.010295 IP 143.110.223.143.22 > 162.243.190.66.33873: Flags [P.], seq 23098864:23099104, ack 961, win 502, options [nop,nop,TS val 1501228991 ecr 2205805151], length 240
02:07:25.010348 IP 143.110.223.143.22 > 162.243.190.66.33873: Flags [P.], seq 23099104:23099344, ack 961, win 502, options [nop,nop,TS val 1501228991 ecr 2205805151], length 240
02:07:25.010409 IP 143.110.223.143.22 > 162.243.190.66.33873: Flags [P.], seq 23099344:23099584, ack 961, win 502, options [nop,nop,TS val 1501228991 ecr 2205805151], length 240
02:07:25.010470 IP 162.243.190.66.33873 > 143.110.223.143.22: Flags [.], ack 23098464, win 1357, options [nop,nop,TS val 2205805152 ecr 1501228990], length 0
02:07:25.010479 IP 143.110.223.143.22 > 162.243.190.66.33873: Flags [P.], seq 23099584:23099824, ack 961, win 502, options [nop,nop,TS val 1501228991 ecr 2205805151], length 240
02:07:25.010634 IP 143.110.223.143.22 > 162.243.190.66.33873: Flags [P.], seq 23099824:23100224, ack 961, win 502, options [nop,nop,TS val 1501228991 ecr 2205805152], length 400
02:07:25.010697 IP 143.110.223.143.22 > 162.243.190.66.33873: Flags [P.], seq 23100224:23100464, ack 961, win 502, options [nop,nop,TS val 1501228991 ecr 2205805152], length 240
02:07:25.010754 IP 143.110.223.143.22 > 162.243.190.66.33873: Flags [P.], seq 23100464:23100704, ack 961, win 502, options [nop,nop,TS val 1501228991 ecr 2205805152], length 240
02:07:25.010823 IP 162.243.190.66.33873 > 143.110.223.143.22: Flags [.], ack 23099824, win 1347, options [nop,nop,TS val 2205805152 ecr 1501228990], length 0
02:07:25.010874 IP 143.110.223.143.22 > 162.243.190.66.33873: Flags [P.], seq 23100704:23100944, ack 961, win 502, options [nop,nop,TS val 1501228991 ecr 2205805152], length 240
02:07:25.010953 IP 143.110.223.143.22 > 162.243.190.66.33873: Flags [P.], seq 23100944:23101168, ack 961, win 502, options [nop,nop,TS val 1501228991 ecr 2205805152], length 224
02:07:25.011005 IP 143.110.223.143.22 > 162.243.190.66.33873: Flags [P.], seq 23101168:23101408, ack 961, win 502, options [nop,nop,TS val 1501228991 ecr 2205805152], length 240
02:07:25.011056 IP 143.110.223.143.22 > 162.243.190.66.33873: Flags [P.], seq 23101408:23101648, ack 961, win 502, options [nop,nop,TS val 1501228991 ecr 2205805152], length 240
02:07:25.011108 IP 143.110.223.143.22 > 162.243.190.66.33873: Flags [P.], seq 23101648:23101888, ack 961, win 502, options [nop,nop,TS val 1501228991 ecr 2205805152], length 240
02:07:25.011166 IP 143.110.223.143.22 > 162.243.190.66.33873: Flags [P.], seq 23101888:23102368, ack 961, win 502, options [nop,nop,TS val 1501228991 ecr 2205805152], length 480
02:07:25.011224 IP 143.110.223.143.22 > 162.243.190.66.33873: Flags [P.], seq 23102368:23102608, ack 961, win 502, options [nop,nop,TS val 1501228991 ecr 2205805152], length 240
02:07:25.011280 IP 143.110.223.143.22 > 162.243.190.66.33873: Flags [P.], seq 23102608:23102848, ack 961, win 502, options [nop,nop,TS val 1501228992 ecr 2205805152], length 240
02:07:25.011291 IP 162.243.190.66.33873 > 143.110.223.143.22: Flags [.], ack 23101168, win 1337, options [nop,nop,TS val 2205805153 ecr 1501228991], length 0
02:07:25.011364 IP 143.110.223.143.22 > 162.243.190.66.33873: Flags [P.], seq 23102848:23103248, ack 961, win 502, options [nop,nop,TS val 1501228992 ecr 2205805153], length 400
02:07:25.011421 IP 143.110.223.143.22 > 162.243.190.66.33873: Flags [P.], seq 23103248:23103488, ack 961, win 502, options [nop,nop,TS val 1501228992 ecr 2205805153], length 240
02:07:25.011478 IP 143.110.223.143.22 > 162.243.190.66.33873: Flags [P.], seq 23103488:23103728, ack 961, win 502, options [nop,nop,TS val 1501228992 ecr 2205805153], length 240
02:07:25.011533 IP 143.110.223.143.22 > 162.243.190.66.33873: Flags [P.], seq 23103728:23103968, ack 961, win 502, options [nop,nop,TS val 1501228992 ecr 2205805153], length 240
02:07:25.011587 IP 143.110.223.143.22 > 162.243.190.66.33873: Flags [P.], seq 23103968:23104208, ack 961, win 502, options [nop,nop,TS val 1501228992 ecr 2205805153], length 240
02:07:25.011641 IP 143.110.223.143.22 > 162.243.190.66.33873: Flags [P.], seq 23104208:23104448, ack 961, win 502, options [nop,nop,TS val 1501228992 ecr 2205805153], length 240
02:07:25.011696 IP 143.110.223.143.22 > 162.243.190.66.33873: Flags [P.], seq 23104448:23104688, ack 961, win 502, options [nop,nop,TS val 1501228992 ecr 2205805153], length 240
02:07:25.011752 IP 143.110.223.143.22 > 162.243.190.66.33873: Flags [P.], seq 23104688:23104928, ack 961, win 502, options [nop,nop,TS val 1501228992 ecr 2205805153], length 240
02:07:25.011807 IP 143.110.223.143.22 > 162.243.190.66.33873: Flags [P.], seq 23104928:23105168, ack 961, win 502, options [nop,nop,TS val 1501228992 ecr 2205805153], length 240
02:07:25.011864 IP 143.110.223.143.22 > 162.243.190.66.33873: Flags [P.], seq 23105168:23105408, ack 961, win 502, options [nop,nop,TS val 1501228992 ecr 2205805153], length 240
02:07:25.011920 IP 143.110.223.143.22 > 162.243.190.66.33873: Flags [P.], seq 23105408:23105648, ack 961, win 502, options [nop,nop,TS val 1501228992 ecr 2205805153], length 240
02:07:25.011975 IP 143.110.223.143.22 > 162.243.190.66.33873: Flags [P.], seq 23105648:23105888, ack 961, win 502, options [nop,nop,TS val 1501228992 ecr 2205805153], length 240
02:07:25.012029 IP 143.110.223.143.22 > 162.243.190.66.33873: Flags [P.], seq 23105888:23106128, ack 961, win 502, options [nop,nop,TS val 1501228992 ecr 2205805153], length 240
02:07:25.012087 IP 143.110.223.143.22 > 162.243.190.66.33873: Flags [P.], seq 23106128:23106368, ack 961, win 502, options [nop,nop,TS val 1501228992 ecr 2205805153], length 240
02:07:25.012142 IP 143.110.223.143.22 > 162.243.190.66.33873: Flags [P.], seq 23106368:23106608, ack 961, win 502, options [nop,nop,TS val 1501228992 ecr 2205805153], length 240
02:07:25.012198 IP 143.110.223.143.22 > 162.243.190.66.33873: Flags [P.], seq 23106608:23106848, ack 961, win 502, options [nop,nop,TS val 1501228992 ecr 2205805153], length 240
02:07:25.012251 IP 143.110.223.143.22 > 162.243.190.66.33873: Flags [P.], seq 23106848:23107088, ack 961, win 502, options [nop,nop,TS val 1501228993 ecr 2205805153], length 240
02:07:25.012308 IP 143.110.223.143.22 > 162.243.190.66.33873: Flags [P.], seq 23107088:23107328, ack 961, win 502, options [nop,nop,TS val 1501228993 ecr 2205805153], length 240
02:07:25.012363 IP 143.110.223.143.22 > 162.243.190.66.33873: Flags [P.], seq 23107328:23107568, ack 961, win 502, options [nop,nop,TS val 1501228993 ecr 2205805153], length 240
02:07:25.012419 IP 143.110.223.143.22 > 162.243.190.66.33873: Flags [P.], seq 23107568:23107808, ack 961, win 502, options [nop,nop,TS val 1501228993 ecr 2205805153], length 240
02:07:25.012475 IP 143.110.223.143.22 > 162.243.190.66.33873: Flags [P.], seq 23107808:23108048, ack 961, win 502, options [nop,nop,TS val 1501228993 ecr 2205805153], length 240
02:07:25.012530 IP 143.110.223.143.22 > 162.243.190.66.33873: Flags [P.], seq 23108048:23108288, ack 961, win 502, options [nop,nop,TS val 1501228993 ecr 2205805153], length 240
02:07:25.012585 IP 143.110.223.143.22 > 162.243.190.66.33873: Flags [P.], seq 23108288:23108528, ack 961, win 502, options [nop,nop,TS val 1501228993 ecr 2205805153], length 240
02:07:25.012640 IP 143.110.223.143.22 > 162.243.190.66.33873: Flags [P.], seq 23108528:23108768, ack 961, win 502, options [nop,nop,TS val 1501228993 ecr 2205805153], length 240
02:07:25.012696 IP 143.110.223.143.22 > 162.243.190.66.33873: Flags [P.], seq 23108768:23109008, ack 961, win 502, options [nop,nop,TS val 1501228993 ecr 2205805153], length 240
02:07:25.012763 IP 143.110.223.143.22 > 162.243.190.66.33873: Flags [P.], seq 23109008:23109248, ack 961, win 502, options [nop,nop,TS val 1501228993 ecr 2205805153], length 240
02:07:25.012829 IP 143.110.223.143.22 > 162.243.190.66.33873: Flags [P.], seq 23109248:23109488, ack 961, win 502, options [nop,nop,TS val 1501228993 ecr 2205805153], length 240
02:07:25.012895 IP 143.110.223.143.22 > 162.243.190.66.33873: Flags [P.], seq 23109488:23109728, ack 961, win 502, options [nop,nop,TS val 1501228993 ecr 2205805153], length 240
02:07:25.012961 IP 143.110.223.143.22 > 162.243.190.66.33873: Flags [P.], seq 23109728:23109968, ack 961, win 502, options [nop,nop,TS val 1501228993 ecr 2205805153], length 240
02:07:25.013027 IP 143.110.223.143.22 > 162.243.190.66.33873: Flags [P.], seq 23109968:23110208, ack 961, win 502, options [nop,nop,TS val 1501228993 ecr 2205805153], length 240
02:07:25.013090 IP 143.110.223.143.22 > 162.243.190.66.33873: Flags [P.], seq 23110208:23110448, ack 961, win 502, options [nop,nop,TS val 1501228993 ecr 2205805153], length 240
02:07:25.013157 IP 143.110.223.143.22 > 162.243.190.66.33873: Flags [P.], seq 23110448:23110688, ack 961, win 502, options [nop,nop,TS val 1501228993 ecr 2205805153], length 240
02:07:25.013222 IP 143.110.223.143.22 > 162.243.190.66.33873: Flags [P.], seq 23110688:23110928, ack 961, win 502, options [nop,nop,TS val 1501228993 ecr 2205805153], length 240
02:07:25.013286 IP 143.110.223.143.22 > 162.243.190.66.33873: Flags [P.], seq 23110928:23111168, ack 961, win 502, options [nop,nop,TS val 1501228994 ecr 2205805153], length 240
02:07:25.013350 IP 143.110.223.143.22 > 162.243.190.66.33873: Flags [P.], seq 23111168:23111408, ack 961, win 502, options [nop,nop,TS val 1501228994 ecr 2205805153], length 240
02:07:25.013569 IP 143.110.223.143.22 > 162.243.190.66.33873: Flags [P.], seq 23111408:23111648, ack 961, win 502, options [nop,nop,TS val 1501228994 ecr 2205805153], length 240
02:07:25.013660 IP 143.110.223.143.22 > 162.243.190.66.33873: Flags [P.], seq 23111648:23111888, ack 961, win 502, options [nop,nop,TS val 1501228994 ecr 2205805153], length 240
02:07:25.013725 IP 143.110.223.143.22 > 162.243.190.66.33873: Flags [P.], seq 23111888:23112128, ack 961, win 502, options [nop,nop,TS val 1501228994 ecr 2205805153], length 240
02:07:25.013791 IP 143.110.223.143.22 > 162.243.190.66.33873: Flags [P.], seq 23112128:23112368, ack 961, win 502, options [nop,nop,TS val 1501228994 ecr 2205805153], length 240
02:07:25.013858 IP 143.110.223.143.22 > 162.243.190.66.33873: Flags [P.], seq 23112368:23112608, ack 961, win 502, options [nop,nop,TS val 1501228994 ecr 2205805153], length 240
02:07:25.013920 IP 143.110.223.143.22 > 162.243.190.66.33873: Flags [P.], seq 23112608:23112848, ack 961, win 502, options [nop,nop,TS val 1501228994 ecr 2205805153], length 240
02:07:25.013984 IP 143.110.223.143.22 > 162.243.190.66.33873: Flags [P.], seq 23112848:23113088, ack 961, win 502, options [nop,nop,TS val 1501228994 ecr 2205805153], length 240
02:07:25.014048 IP 143.110.223.143.22 > 162.243.190.66.33873: Flags [P.], seq 23113088:23113328, ack 961, win 502, options [nop,nop,TS val 1501228994 ecr 2205805153], length 240
02:07:25.014113 IP 143.110.223.143.22 > 162.243.190.66.33873: Flags [P.], seq 23113328:23113568, ack 961, win 502, options [nop,nop,TS val 1501228994 ecr 2205805153], length 240
02:07:25.014201 IP 143.110.223.143.22 > 162.243.190.66.33873: Flags [P.], seq 23113568:23113808, ack 961, win 502, options [nop,nop,TS val 1501228994 ecr 2205805153], length 240
02:07:25.014284 IP 143.110.223.143.22 > 162.243.190.66.33873: Flags [P.], seq 23113808:23114048, ack 961, win 502, options [nop,nop,TS val 1501228995 ecr 2205805153], length 240
02:07:25.014339 IP 143.110.223.143.22 > 162.243.190.66.33873: Flags [P.], seq 23114048:23114288, ack 961, win 502, options [nop,nop,TS val 1501228995 ecr 2205805153], length 240
02:07:25.014536 IP 143.110.223.143.22 > 162.243.190.66.33873: Flags [P.], seq 23114288:23114528, ack 961, win 502, options [nop,nop,TS val 1501228995 ecr 2205805153], length 240
02:07:25.014607 IP 143.110.223.143.22 > 162.243.190.66.33873: Flags [P.], seq 23114528:23114768, ack 961, win 502, options [nop,nop,TS val 1501228995 ecr 2205805153], length 240
02:07:25.014807 IP 143.110.223.143.22 > 162.243.190.66.33873: Flags [P.], seq 23114768:23115008, ack 961, win 502, options [nop,nop,TS val 1501228995 ecr 2205805153], length 240
02:07:25.014879 IP 143.110.223.143.22 > 162.243.190.66.33873: Flags [P.], seq 23115008:23115248, ack 961, win 502, options [nop,nop,TS val 1501228995 ecr 2205805153], length 240
02:07:25.015035 IP 143.110.223.143.22 > 162.243.190.66.33873: Flags [P.], seq 23115248:23115488, ack 961, win 502, options [nop,nop,TS val 1501228995 ecr 2205805153], length 240
02:07:25.015108 IP 143.110.223.143.22 > 162.243.190.66.33873: Flags [P.], seq 23115488:23115728, ack 961, win 502, options [nop,nop,TS val 1501228995 ecr 2205805153], length 240
02:07:25.015170 IP 143.110.223.143.22 > 162.243.190.66.33873: Flags [P.], seq 23115728:23115968, ack 961, win 502, options [nop,nop,TS val 1501228995 ecr 2205805153], length 240
02:07:25.015225 IP 143.110.223.143.22 > 162.243.190.66.33873: Flags [P.], seq 23115968:23116208, ack 961, win 502, options [nop,nop,TS val 1501228995 ecr 2205805153], length 240
02:07:25.015396 IP 162.243.190.66.33873 > 143.110.223.143.22: Flags [.], ack 23115008, win 1229, options [nop,nop,TS val 2205805157 ecr 1501228991], length 0
02:07:25.015501 IP 143.110.223.143.22 > 162.243.190.66.33873: Flags [P.], seq 23116208:23116448, ack 961, win 502, options [nop,nop,TS val 1501228996 ecr 2205805157], length 240
02:07:25.015552 IP 162.243.190.66.33873 > 143.110.223.143.22: Flags [.], ack 23116208, win 1220, options [nop,nop,TS val 2205805157 ecr 1501228995], length 0
02:07:25.015712 IP 143.110.223.143.22 > 162.243.190.66.33873: Flags [P.], seq 23116448:23116672, ack 961, win 502, options [nop,nop,TS val 1501228996 ecr 2205805157], length 224
02:07:25.015771 IP 143.110.223.143.22 > 162.243.190.66.33873: Flags [P.], seq 23116672:23117072, ack 961, win 502, options [nop,nop,TS val 1501228996 ecr 2205805157], length 400
02:07:25.015824 IP 143.110.223.143.22 > 162.243.190.66.33873: Flags [P.], seq 23117072:23117312, ack 961, win 502, options [nop,nop,TS val 1501228996 ecr 2205805157], length 240
02:07:25.015876 IP 143.110.223.143.22 > 162.243.190.66.33873: Flags [P.], seq 23117312:23117552, ack 961, win 502, options [nop,nop,TS val 1501228996 ecr 2205805157], length 240
02:07:25.015927 IP 143.110.223.143.22 > 162.243.190.66.33873: Flags [P.], seq 23117552:23117792, ack 961, win 502, options [nop,nop,TS val 1501228996 ecr 2205805157], length 240
02:07:25.015980 IP 143.110.223.143.22 > 162.243.190.66.33873: Flags [P.], seq 23117792:23118032, ack 961, win 502, options [nop,nop,TS val 1501228996 ecr 2205805157], length 240
02:07:25.016031 IP 143.110.223.143.22 > 162.243.190.66.33873: Flags [P.], seq 23118032:23118272, ack 961, win 502, options [nop,nop,TS val 1501228996 ecr 2205805157], length 240
02:07:25.016082 IP 143.110.223.143.22 > 162.243.190.66.33873: Flags [P.], seq 23118272:23118512, ack 961, win 502, options [nop,nop,TS val 1501228996 ecr 2205805157], length 240
02:07:25.016133 IP 143.110.223.143.22 > 162.243.190.66.33873: Flags [P.], seq 23118512:23118752, ack 961, win 502, options [nop,nop,TS val 1501228996 ecr 2205805157], length 240
02:07:25.016186 IP 143.110.223.143.22 > 162.243.190.66.33873: Flags [P.], seq 23118752:23118992, ack 961, win 502, options [nop,nop,TS val 1501228996 ecr 2205805157], length 240
02:07:25.016244 IP 143.110.223.143.22 > 162.243.190.66.33873: Flags [P.], seq 23118992:23119472, ack 961, win 502, options [nop,nop,TS val 1501228996 ecr 2205805157], length 480
02:07:25.016280 IP 162.243.190.66.33873 > 143.110.223.143.22: Flags [.], ack 23117552, win 1210, options [nop,nop,TS val 2205805157 ecr 1501228996], length 0
02:07:25.016353 IP 143.110.223.143.22 > 162.243.190.66.33873: Flags [P.], seq 23119472:23119872, ack 961, win 502, options [nop,nop,TS val 1501228997 ecr 2205805157], length 400
02:07:25.016412 IP 143.110.223.143.22 > 162.243.190.66.33873: Flags [P.], seq 23119872:23120112, ack 961, win 502, options [nop,nop,TS val 1501228997 ecr 2205805157], length 240
02:07:25.016466 IP 162.243.190.66.33873 > 143.110.223.143.22: Flags [.], ack 23118752, win 1201, options [nop,nop,TS val 2205805158 ecr 1501228996], length 0
02:07:25.016508 IP 143.110.223.143.22 > 162.243.190.66.33873: Flags [P.], seq 23120112:23120352, ack 961, win 502, options [nop,nop,TS val 1501228997 ecr 2205805158], length 240
02:07:25.016568 IP 143.110.223.143.22 > 162.243.190.66.33873: Flags [P.], seq 23120352:23120752, ack 961, win 502, options [nop,nop,TS val 1501228997 ecr 2205805158], length 400
02:07:25.016625 IP 143.110.223.143.22 > 162.243.190.66.33873: Flags [P.], seq 23120752:23120992, ack 961, win 502, options [nop,nop,TS val 1501228997 ecr 2205805158], length 240
02:07:25.016679 IP 143.110.223.143.22 > 162.243.190.66.33873: Flags [P.], seq 23120992:23121232, ack 961, win 502, options [nop,nop,TS val 1501228997 ecr 2205805158], length 240
02:07:25.016737 IP 143.110.223.143.22 > 162.243.190.66.33873: Flags [P.], seq 23121232:23121472, ack 961, win 502, options [nop,nop,TS val 1501228997 ecr 2205805158], length 240
02:07:25.016751 IP 162.243.190.66.33873 > 143.110.223.143.22: Flags [.], ack 23120112, win 1191, options [nop,nop,TS val 2205805158 ecr 1501228996], length 0
02:07:25.016824 IP 143.110.223.143.22 > 162.243.190.66.33873: Flags [P.], seq 23121472:23121872, ack 961, win 502, options [nop,nop,TS val 1501228997 ecr 2205805158], length 400
02:07:25.016880 IP 143.110.223.143.22 > 162.243.190.66.33873: Flags [P.], seq 23121872:23122112, ack 961, win 502, options [nop,nop,TS val 1501228997 ecr 2205805158], length 240
02:07:25.016933 IP 143.110.223.143.22 > 162.243.190.66.33873: Flags [P.], seq 23122112:23122352, ack 961, win 502, options [nop,nop,TS val 1501228997 ecr 2205805158], length 240
02:07:25.016989 IP 143.110.223.143.22 > 162.243.190.66.33873: Flags [P.], seq 23122352:23122592, ack 961, win 502, options [nop,nop,TS val 1501228997 ecr 2205805158], length 240
02:07:25.017044 IP 143.110.223.143.22 > 162.243.190.66.33873: Flags [P.], seq 23122592:23122832, ack 961, win 502, options [nop,nop,TS val 1501228997 ecr 2205805158], length 240
02:07:25.017092 IP 162.243.190.66.33873 > 143.110.223.143.22: Flags [.], ack 23121472, win 1181, options [nop,nop,TS val 2205805158 ecr 1501228997], length 0
02:07:25.017145 IP 143.110.223.143.22 > 162.243.190.66.33873: Flags [P.], seq 23122832:23123232, ack 961, win 502, options [nop,nop,TS val 1501228997 ecr 2205805158], length 400
02:07:25.017200 IP 143.110.223.143.22 > 162.243.190.66.33873: Flags [P.], seq 23123232:23123472, ack 961, win 502, options [nop,nop,TS val 1501228997 ecr 2205805158], length 240
02:07:25.017257 IP 143.110.223.143.22 > 162.243.190.66.33873: Flags [P.], seq 23123472:23123712, ack 961, win 502, options [nop,nop,TS val 1501228998 ecr 2205805158], length 240
02:07:25.017310 IP 143.110.223.143.22 > 162.243.190.66.33873: Flags [P.], seq 23123712:23123952, ack 961, win 502, options [nop,nop,TS val 1501228998 ecr 2205805158], length 240
02:07:25.017365 IP 143.110.223.143.22 > 162.243.190.66.33873: Flags [P.], seq 23123952:23124192, ack 961, win 502, options [nop,nop,TS val 1501228998 ecr 2205805158], length 240
02:07:25.017378 IP 162.243.190.66.33873 > 143.110.223.143.22: Flags [.], ack 23122832, win 1171, options [nop,nop,TS val 2205805159 ecr 1501228997], length 0
02:07:25.017449 IP 143.110.223.143.22 > 162.243.190.66.33873: Flags [P.], seq 23124192:23124592, ack 961, win 502, options [nop,nop,TS val 1501228998 ecr 2205805159], length 400
02:07:25.017505 IP 143.110.223.143.22 > 162.243.190.66.33873: Flags [P.], seq 23124592:23124832, ack 961, win 502, options [nop,nop,TS val 1501228998 ecr 2205805159], length 240
02:07:25.017559 IP 143.110.223.143.22 > 162.243.190.66.33873: Flags [P.], seq 23124832:23125072, ack 961, win 502, options [nop,nop,TS val 1501228998 ecr 2205805159], length 240
02:07:25.017613 IP 143.110.223.143.22 > 162.243.190.66.33873: Flags [P.], seq 23125072:23125312, ack 961, win 502, options [nop,nop,TS val 1501228998 ecr 2205805159], length 240
02:07:25.017668 IP 143.110.223.143.22 > 162.243.190.66.33873: Flags [P.], seq 23125312:23125552, ack 961, win 502, options [nop,nop,TS val 1501228998 ecr 2205805159], length 240
02:07:25.017716 IP 162.243.190.66.33873 > 143.110.223.143.22: Flags [.], ack 23124192, win 1161, options [nop,nop,TS val 2205805159 ecr 1501228997], length 0
02:07:25.017770 IP 143.110.223.143.22 > 162.243.190.66.33873: Flags [P.], seq 23125552:23125952, ack 961, win 502, options [nop,nop,TS val 1501228998 ecr 2205805159], length 400
02:07:25.017826 IP 143.110.223.143.22 > 162.243.190.66.33873: Flags [P.], seq 23125952:23126192, ack 961, win 502, options [nop,nop,TS val 1501228998 ecr 2205805159], length 240
02:07:25.017881 IP 143.110.223.143.22 > 162.243.190.66.33873: Flags [P.], seq 23126192:23126432, ack 961, win 502, options [nop,nop,TS val 1501228998 ecr 2205805159], length 240
02:07:25.017936 IP 143.110.223.143.22 > 162.243.190.66.33873: Flags [P.], seq 23126432:23126672, ack 961, win 502, options [nop,nop,TS val 1501228998 ecr 2205805159], length 240
02:07:25.017990 IP 143.110.223.143.22 > 162.243.190.66.33873: Flags [P.], seq 23126672:23126912, ack 961, win 502, options [nop,nop,TS val 1501228998 ecr 2205805159], length 240
02:07:25.018007 IP 162.243.190.66.33873 > 143.110.223.143.22: Flags [.], ack 23125552, win 1151, options [nop,nop,TS val 2205805159 ecr 1501228998], length 0
02:07:25.018078 IP 143.110.223.143.22 > 162.243.190.66.33873: Flags [P.], seq 23126912:23127312, ack 961, win 502, options [nop,nop,TS val 1501228998 ecr 2205805159], length 400
02:07:25.018142 IP 143.110.223.143.22 > 162.243.190.66.33873: Flags [P.], seq 23127312:23127552, ack 961, win 502, options [nop,nop,TS val 1501228998 ecr 2205805159], length 240
02:07:25.018198 IP 143.110.223.143.22 > 162.243.190.66.33873: Flags [P.], seq 23127552:23127792, ack 961, win 502, options [nop,nop,TS val 1501228998 ecr 2205805159], length 240
02:07:25.018255 IP 143.110.223.143.22 > 162.243.190.66.33873: Flags [P.], seq 23127792:23128032, ack 961, win 502, options [nop,nop,TS val 1501228999 ecr 2205805159], length 240
02:07:25.018311 IP 143.110.223.143.22 > 162.243.190.66.33873: Flags [P.], seq 23128032:23128272, ack 961, win 502, options [nop,nop,TS val 1501228999 ecr 2205805159], length 240
02:07:25.018364 IP 162.243.190.66.33873 > 143.110.223.143.22: Flags [.], ack 23126912, win 1141, options [nop,nop,TS val 2205805160 ecr 1501228998], length 0
02:07:25.018416 IP 143.110.223.143.22 > 162.243.190.66.33873: Flags [P.], seq 23128272:23128672, ack 961, win 502, options [nop,nop,TS val 1501228999 ecr 2205805160], length 400
02:07:25.018472 IP 143.110.223.143.22 > 162.243.190.66.33873: Flags [P.], seq 23128672:23128912, ack 961, win 502, options [nop,nop,TS val 1501228999 ecr 2205805160], length 240
02:07:25.018527 IP 143.110.223.143.22 > 162.243.190.66.33873: Flags [P.], seq 23128912:23129152, ack 961, win 502, options [nop,nop,TS val 1501228999 ecr 2205805160], length 240
02:07:25.018582 IP 143.110.223.143.22 > 162.243.190.66.33873: Flags [P.], seq 23129152:23129392, ack 961, win 502, options [nop,nop,TS val 1501228999 ecr 2205805160], length 240
02:07:25.018629 IP 162.243.190.66.33873 > 143.110.223.143.22: Flags [.], ack 23128272, win 1131, options [nop,nop,TS val 2205805160 ecr 1501228998], length 0
02:07:25.018677 IP 143.110.223.143.22 > 162.243.190.66.33873: Flags [P.], seq 23129392:23129792, ack 961, win 502, options [nop,nop,TS val 1501228999 ecr 2205805160], length 400
02:07:25.018743 IP 143.110.223.143.22 > 162.243.190.66.33873: Flags [P.], seq 23129792:23130032, ack 961, win 502, options [nop,nop,TS val 1501228999 ecr 2205805160], length 240
02:07:25.018979 IP 143.110.223.143.22 > 162.243.190.66.33873: Flags [P.], seq 23130032:23130272, ack 961, win 502, options [nop,nop,TS val 1501228999 ecr 2205805160], length 240
02:07:25.019033 IP 162.243.190.66.33873 > 143.110.223.143.22: Flags [.], ack 23129792, win 1120, options [nop,nop,TS val 2205805160 ecr 1501228999], length 0
02:07:25.019215 IP 143.110.223.143.22 > 162.243.190.66.33873: Flags [P.], seq 23130272:23130672, ack 961, win 502, options [nop,nop,TS val 1501228999 ecr 2205805160], length 400
02:07:25.019304 IP 143.110.223.143.22 > 162.243.190.66.33873: Flags [P.], seq 23130672:23130912, ack 961, win 502, options [nop,nop,TS val 1501229000 ecr 2205805160], length 240
02:07:25.019442 IP 143.110.223.143.22 > 162.243.190.66.33873: Flags [P.], seq 23130912:23131152, ack 961, win 502, options [nop,nop,TS val 1501229000 ecr 2205805160], length 240
02:07:25.019504 IP 143.110.223.143.22 > 162.243.190.66.33873: Flags [P.], seq 23131152:23131392, ack 961, win 502, options [nop,nop,TS val 1501229000 ecr 2205805160], length 240
02:07:25.019602 IP 143.110.223.143.22 > 162.243.190.66.33873: Flags [P.], seq 23131392:23131632, ack 961, win 502, options [nop,nop,TS val 1501229000 ecr 2205805160], length 240
02:07:25.019660 IP 143.110.223.143.22 > 162.243.190.66.33873: Flags [P.], seq 23131632:23131872, ack 961, win 502, options [nop,nop,TS val 1501229000 ecr 2205805160], length 240
02:07:25.019716 IP 143.110.223.143.22 > 162.243.190.66.33873: Flags [P.], seq 23131872:23132112, ack 961, win 502, options [nop,nop,TS val 1501229000 ecr 2205805160], length 240
02:07:25.019772 IP 162.243.190.66.33873 > 143.110.223.143.22: Flags [.], ack 23131152, win 1110, options [nop,nop,TS val 2205805161 ecr 1501228999], length 0
02:07:25.019816 IP 143.110.223.143.22 > 162.243.190.66.33873: Flags [P.], seq 23132112:23132352, ack 961, win 502, options [nop,nop,TS val 1501229000 ecr 2205805161], length 240
02:07:25.019868 IP 143.110.223.143.22 > 162.243.190.66.33873: Flags [P.], seq 23132352:23132576, ack 961, win 502, options [nop,nop,TS val 1501229000 ecr 2205805161], length 224
02:07:25.019919 IP 143.110.223.143.22 > 162.243.190.66.33873: Flags [P.], seq 23132576:23132816, ack 961, win 502, options [nop,nop,TS val 1501229000 ecr 2205805161], length 240
02:07:25.019970 IP 143.110.223.143.22 > 162.243.190.66.33873: Flags [P.], seq 23132816:23133056, ack 961, win 502, options [nop,nop,TS val 1501229000 ecr 2205805161], length 240
02:07:25.020020 IP 143.110.223.143.22 > 162.243.190.66.33873: Flags [P.], seq 23133056:23133296, ack 961, win 502, options [nop,nop,TS val 1501229000 ecr 2205805161], length 240
02:07:25.020070 IP 143.110.223.143.22 > 162.243.190.66.33873: Flags [P.], seq 23133296:23133536, ack 961, win 502, options [nop,nop,TS val 1501229000 ecr 2205805161], length 240
02:07:25.020122 IP 143.110.223.143.22 > 162.243.190.66.33873: Flags [P.], seq 23133536:23133776, ack 961, win 502, options [nop,nop,TS val 1501229000 ecr 2205805161], length 240
02:07:25.020176 IP 143.110.223.143.22 > 162.243.190.66.33873: Flags [P.], seq 23133776:23134016, ack 961, win 502, options [nop,nop,TS val 1501229000 ecr 2205805161], length 240
02:07:25.020228 IP 162.243.190.66.33873 > 143.110.223.143.22: Flags [.], ack 23132576, win 1099, options [nop,nop,TS val 2205805161 ecr 1501229000], length 0
02:07:25.020267 IP 143.110.223.143.22 > 162.243.190.66.33873: Flags [P.], seq 23134016:23134256, ack 961, win 502, options [nop,nop,TS val 1501229001 ecr 2205805161], length 240
02:07:25.020317 IP 143.110.223.143.22 > 162.243.190.66.33873: Flags [P.], seq 23134256:23134656, ack 961, win 502, options [nop,nop,TS val 1501229001 ecr 2205805161], length 400
02:07:25.020373 IP 143.110.223.143.22 > 162.243.190.66.33873: Flags [P.], seq 23134656:23134896, ack 961, win 502, options [nop,nop,TS val 1501229001 ecr 2205805161], length 240
02:07:25.020424 IP 143.110.223.143.22 > 162.243.190.66.33873: Flags [P.], seq 23134896:23135136, ack 961, win 502, options [nop,nop,TS val 1501229001 ecr 2205805161], length 240
02:07:25.020436 IP 162.243.190.66.33873 > 143.110.223.143.22: Flags [.], ack 23133776, win 1090, options [nop,nop,TS val 2205805162 ecr 1501229000], length 0
02:07:25.020503 IP 143.110.223.143.22 > 162.243.190.66.33873: Flags [P.], seq 23135136:23135376, ack 961, win 502, options [nop,nop,TS val 1501229001 ecr 2205805162], length 240
02:07:25.020560 IP 143.110.223.143.22 > 162.243.190.66.33873: Flags [P.], seq 23135376:23135776, ack 961, win 502, options [nop,nop,TS val 1501229001 ecr 2205805162], length 400
02:07:25.020612 IP 143.110.223.143.22 > 162.243.190.66.33873: Flags [P.], seq 23135776:23136016, ack 961, win 502, options [nop,nop,TS val 1501229001 ecr 2205805162], length 240
02:07:25.020666 IP 143.110.223.143.22 > 162.243.190.66.33873: Flags [P.], seq 23136016:23136256, ack 961, win 502, options [nop,nop,TS val 1501229001 ecr 2205805162], length 240
02:07:25.020712 IP 143.110.223.143.22 > 162.243.190.66.33873: Flags [P.], seq 23136256:23136496, ack 961, win 502, options [nop,nop,TS val 1501229001 ecr 2205805162], length 240
02:07:25.020765 IP 143.110.223.143.22 > 162.243.190.66.33873: Flags [P.], seq 23136496:23136976, ack 961, win 502, options [nop,nop,TS val 1501229001 ecr 2205805162], length 480
02:07:25.020972 IP 162.243.190.66.33873 > 143.110.223.143.22: Flags [.], ack 23135136, win 1080, options [nop,nop,TS val 2205805162 ecr 1501229000], length 0
02:07:25.020986 IP 143.110.223.143.22 > 162.243.190.66.33873: Flags [P.], seq 23136976:23137216, ack 961, win 502, options [nop,nop,TS val 1501229001 ecr 2205805162], length 240
02:07:25.021072 IP 143.110.223.143.22 > 162.243.190.66.33873: Flags [P.], seq 23137216:23137616, ack 961, win 502, options [nop,nop,TS val 1501229001 ecr 2205805162], length 400
02:07:25.021119 IP 162.243.190.66.33873 > 143.110.223.143.22: Flags [.], ack 23136496, win 1070, options [nop,nop,TS val 2205805162 ecr 1501229001], length 0
02:07:25.021168 IP 143.110.223.143.22 > 162.243.190.66.33873: Flags [P.], seq 23137616:23138016, ack 961, win 502, options [nop,nop,TS val 1501229001 ecr 2205805162], length 400
02:07:25.021227 IP 143.110.223.143.22 > 162.243.190.66.33873: Flags [P.], seq 23138016:23138256, ack 961, win 502, options [nop,nop,TS val 1501229001 ecr 2205805162], length 240
02:07:25.021283 IP 143.110.223.143.22 > 162.243.190.66.33873: Flags [P.], seq 23138256:23138496, ack 961, win 502, options [nop,nop,TS val 1501229002 ecr 2205805162], length 240
02:07:25.021339 IP 143.110.223.143.22 > 162.243.190.66.33873: Flags [P.], seq 23138496:23138736, ack 961, win 502, options [nop,nop,TS val 1501229002 ecr 2205805162], length 240
02:07:25.021394 IP 143.110.223.143.22 > 162.243.190.66.33873: Flags [P.], seq 23138736:23138976, ack 961, win 502, options [nop,nop,TS val 1501229002 ecr 2205805162], length 240
02:07:25.021448 IP 143.110.223.143.22 > 162.243.190.66.33873: Flags [P.], seq 23138976:23139216, ack 961, win 502, options [nop,nop,TS val 1501229002 ecr 2205805162], length 240
02:07:25.021505 IP 143.110.223.143.22 > 162.243.190.66.33873: Flags [P.], seq 23139216:23139456, ack 961, win 502, options [nop,nop,TS val 1501229002 ecr 2205805162], length 240
02:07:25.021561 IP 143.110.223.143.22 > 162.243.190.66.33873: Flags [P.], seq 23139456:23139696, ack 961, win 502, options [nop,nop,TS val 1501229002 ecr 2205805162], length 240
02:07:25.021616 IP 143.110.223.143.22 > 162.243.190.66.33873: Flags [P.], seq 23139696:23139936, ack 961, win 502, options [nop,nop,TS val 1501229002 ecr 2205805162], length 240
02:07:25.021633 IP 162.243.190.66.33873 > 143.110.223.143.22: Flags [.], ack 23138016, win 1059, options [nop,nop,TS val 2205805163 ecr 1501229001], length 0
02:07:25.021705 IP 143.110.223.143.22 > 162.243.190.66.33873: Flags [P.], seq 23139936:23140336, ack 961, win 502, options [nop,nop,TS val 1501229002 ecr 2205805163], length 400
02:07:25.021762 IP 143.110.223.143.22 > 162.243.190.66.33873: Flags [P.], seq 23140336:23140576, ack 961, win 502, options [nop,nop,TS val 1501229002 ecr 2205805163], length 240
02:07:25.021806 IP 162.243.190.66.33873 > 143.110.223.143.22: Flags [.], ack 23139216, win 1050, options [nop,nop,TS val 2205805163 ecr 1501229001], length 0
02:07:25.021855 IP 143.110.223.143.22 > 162.243.190.66.33873: Flags [P.], seq 23140576:23140976, ack 961, win 502, options [nop,nop,TS val 1501229002 ecr 2205805163], length 400
02:07:25.021912 IP 143.110.223.143.22 > 162.243.190.66.33873: Flags [P.], seq 23140976:23141216, ack 961, win 502, options [nop,nop,TS val 1501229002 ecr 2205805163], length 240
02:07:25.021966 IP 143.110.223.143.22 > 162.243.190.66.33873: Flags [P.], seq 23141216:23141456, ack 961, win 502, options [nop,nop,TS val 1501229002 ecr 2205805163], length 240
02:07:25.022019 IP 143.110.223.143.22 > 162.243.190.66.33873: Flags [P.], seq 23141456:23141696, ack 961, win 502, options [nop,nop,TS val 1501229002 ecr 2205805163], length 240
02:07:25.022070 IP 162.243.190.66.33873 > 143.110.223.143.22: Flags [.], ack 23140576, win 1040, options [nop,nop,TS val 2205805163 ecr 1501229002], length 0
02:07:25.022123 IP 143.110.223.143.22 > 162.243.190.66.33873: Flags [P.], seq 23141696:23142096, ack 961, win 502, options [nop,nop,TS val 1501229002 ecr 2205805163], length 400
02:07:25.022182 IP 143.110.223.143.22 > 162.243.190.66.33873: Flags [P.], seq 23142096:23142336, ack 961, win 502, options [nop,nop,TS val 1501229002 ecr 2205805163], length 240
02:07:25.022239 IP 143.110.223.143.22 > 162.243.190.66.33873: Flags [P.], seq 23142336:23142576, ack 961, win 502, options [nop,nop,TS val 1501229002 ecr 2205805163], length 240
02:07:25.022293 IP 143.110.223.143.22 > 162.243.190.66.33873: Flags [P.], seq 23142576:23142816, ack 961, win 502, options [nop,nop,TS val 1501229003 ecr 2205805163], length 240
02:07:25.022348 IP 143.110.223.143.22 > 162.243.190.66.33873: Flags [P.], seq 23142816:23143056, ack 961, win 502, options [nop,nop,TS val 1501229003 ecr 2205805163], length 240
02:07:25.022403 IP 143.110.223.143.22 > 162.243.190.66.33873: Flags [P.], seq 23143056:23143296, ack 961, win 502, options [nop,nop,TS val 1501229003 ecr 2205805163], length 240
02:07:25.022453 IP 162.243.190.66.33873 > 143.110.223.143.22: Flags [.], ack 23142096, win 1029, options [nop,nop,TS val 2205805164 ecr 1501229002], length 0
02:07:25.022508 IP 143.110.223.143.22 > 162.243.190.66.33873: Flags [P.], seq 23143296:23143696, ack 961, win 502, options [nop,nop,TS val 1501229003 ecr 2205805164], length 400
02:07:25.022565 IP 143.110.223.143.22 > 162.243.190.66.33873: Flags [P.], seq 23143696:23143936, ack 961, win 502, options [nop,nop,TS val 1501229003 ecr 2205805164], length 240
02:07:25.022618 IP 143.110.223.143.22 > 162.243.190.66.33873: Flags [P.], seq 23143936:23144176, ack 961, win 502, options [nop,nop,TS val 1501229003 ecr 2205805164], length 240
02:07:25.022672 IP 143.110.223.143.22 > 162.243.190.66.33873: Flags [P.], seq 23144176:23144416, ack 961, win 502, options [nop,nop,TS val 1501229003 ecr 2205805164], length 240
02:07:25.022714 IP 162.243.190.66.33873 > 143.110.223.143.22: Flags [.], ack 23143296, win 1020, options [nop,nop,TS val 2205805164 ecr 1501229002], length 0
02:07:25.022769 IP 143.110.223.143.22 > 162.243.190.66.33873: Flags [P.], seq 23144416:23144816, ack 961, win 502, options [nop,nop,TS val 1501229003 ecr 2205805164], length 400
02:07:25.022844 IP 143.110.223.143.22 > 162.243.190.66.33873: Flags [P.], seq 23144816:23145056, ack 961, win 502, options [nop,nop,TS val 1501229003 ecr 2205805164], length 240
02:07:25.022902 IP 143.110.223.143.22 > 162.243.190.66.33873: Flags [P.], seq 23145056:23145296, ack 961, win 502, options [nop,nop,TS val 1501229003 ecr 2205805164], length 240
02:07:25.023124 IP 143.110.223.143.22 > 162.243.190.66.33873: Flags [P.], seq 23145296:23145536, ack 961, win 502, options [nop,nop,TS val 1501229003 ecr 2205805164], length 240
02:07:25.023143 IP 162.243.190.66.33873 > 143.110.223.143.22: Flags [.], ack 23144816, win 1009, options [nop,nop,TS val 2205805164 ecr 1501229003], length 0
02:07:25.023224 IP 143.110.223.143.22 > 162.243.190.66.33873: Flags [P.], seq 23145536:23145936, ack 961, win 502, options [nop,nop,TS val 1501229003 ecr 2205805164], length 400
02:07:25.023283 IP 143.110.223.143.22 > 162.243.190.66.33873: Flags [P.], seq 23145936:23146176, ack 961, win 502, options [nop,nop,TS val 1501229004 ecr 2205805164], length 240
02:07:25.023361 IP 143.110.223.143.22 > 162.243.190.66.33873: Flags [P.], seq 23146176:23146416, ack 961, win 502, options [nop,nop,TS val 1501229004 ecr 2205805164], length 240
02:07:25.023427 IP 143.110.223.143.22 > 162.243.190.66.33873: Flags [P.], seq 23146416:23146656, ack 961, win 502, options [nop,nop,TS val 1501229004 ecr 2205805164], length 240
02:07:25.023485 IP 143.110.223.143.22 > 162.243.190.66.33873: Flags [P.], seq 23146656:23146896, ack 961, win 502, options [nop,nop,TS val 1501229004 ecr 2205805164], length 240
02:07:25.023540 IP 143.110.223.143.22 > 162.243.190.66.33873: Flags [P.], seq 23146896:23147136, ack 961, win 502, options [nop,nop,TS val 1501229004 ecr 2205805164], length 240
02:07:25.023594 IP 143.110.223.143.22 > 162.243.190.66.33873: Flags [P.], seq 23147136:23147376, ack 961, win 502, options [nop,nop,TS val 1501229004 ecr 2205805164], length 240
02:07:25.023647 IP 143.110.223.143.22 > 162.243.190.66.33873: Flags [P.], seq 23147376:23147616, ack 961, win 502, options [nop,nop,TS val 1501229004 ecr 2205805164], length 240
02:07:25.023664 IP 162.243.190.66.33873 > 143.110.223.143.22: Flags [.], ack 23146176, win 999, options [nop,nop,TS val 2205805165 ecr 1501229003], length 0
02:07:25.023737 IP 143.110.223.143.22 > 162.243.190.66.33873: Flags [P.], seq 23147616:23148016, ack 961, win 502, options [nop,nop,TS val 1501229004 ecr 2205805165], length 400
02:07:25.023793 IP 143.110.223.143.22 > 162.243.190.66.33873: Flags [P.], seq 23148016:23148256, ack 961, win 502, options [nop,nop,TS val 1501229004 ecr 2205805165], length 240
02:07:25.023848 IP 143.110.223.143.22 > 162.243.190.66.33873: Flags [P.], seq 23148256:23148496, ack 961, win 502, options [nop,nop,TS val 1501229004 ecr 2205805165], length 240
02:07:25.023902 IP 143.110.223.143.22 > 162.243.190.66.33873: Flags [P.], seq 23148496:23148736, ack 961, win 502, options [nop,nop,TS val 1501229004 ecr 2205805165], length 240
02:07:25.023971 IP 162.243.190.66.33873 > 143.110.223.143.22: Flags [.], ack 23147376, win 990, options [nop,nop,TS val 2205805165 ecr 1501229004], length 0
02:07:25.024029 IP 143.110.223.143.22 > 162.243.190.66.33873: Flags [P.], seq 23148736:23148976, ack 961, win 502, options [nop,nop,TS val 1501229004 ecr 2205805165], length 240
02:07:25.024092 IP 143.110.223.143.22 > 162.243.190.66.33873: Flags [P.], seq 23148976:23149184, ack 961, win 502, options [nop,nop,TS val 1501229004 ecr 2205805165], length 208
02:07:25.024151 IP 143.110.223.143.22 > 162.243.190.66.33873: Flags [P.], seq 23149184:23149424, ack 961, win 502, options [nop,nop,TS val 1501229004 ecr 2205805165], length 240
02:07:25.024210 IP 143.110.223.143.22 > 162.243.190.66.33873: Flags [P.], seq 23149424:23149664, ack 961, win 502, options [nop,nop,TS val 1501229004 ecr 2205805165], length 240
02:07:25.024395 IP 162.243.190.66.33873 > 143.110.223.143.22: Flags [.], ack 23148736, win 980, options [nop,nop,TS val 2205805166 ecr 1501229004], length 0
02:07:25.024463 IP 143.110.223.143.22 > 162.243.190.66.33873: Flags [P.], seq 23149664:23149904, ack 961, win 502, options [nop,nop,TS val 1501229005 ecr 2205805166], length 240
02:07:25.024528 IP 143.110.223.143.22 > 162.243.190.66.33873: Flags [P.], seq 23149904:23150304, ack 961, win 502, options [nop,nop,TS val 1501229005 ecr 2205805166], length 400
02:07:25.024590 IP 143.110.223.143.22 > 162.243.190.66.33873: Flags [P.], seq 23150304:23150544, ack 961, win 502, options [nop,nop,TS val 1501229005 ecr 2205805166], length 240
02:07:25.024661 IP 143.110.223.143.22 > 162.243.190.66.33873: Flags [P.], seq 23150544:23150784, ack 961, win 502, options [nop,nop,TS val 1501229005 ecr 2205805166], length 240
02:07:25.024713 IP 143.110.223.143.22 > 162.243.190.66.33873: Flags [P.], seq 23150784:23151024, ack 961, win 502, options [nop,nop,TS val 1501229005 ecr 2205805166], length 240
02:07:25.024764 IP 143.110.223.143.22 > 162.243.190.66.33873: Flags [P.], seq 23151024:23151264, ack 961, win 502, options [nop,nop,TS val 1501229005 ecr 2205805166], length 240
02:07:25.024813 IP 143.110.223.143.22 > 162.243.190.66.33873: Flags [P.], seq 23151264:23151504, ack 961, win 502, options [nop,nop,TS val 1501229005 ecr 2205805166], length 240
02:07:25.024851 IP 162.243.190.66.33873 > 143.110.223.143.22: Flags [.], ack 23150304, win 968, options [nop,nop,TS val 2205805166 ecr 1501229004], length 0
02:07:25.024895 IP 143.110.223.143.22 > 162.243.190.66.33873: Flags [P.], seq 23151504:23151744, ack 961, win 502, options [nop,nop,TS val 1501229005 ecr 2205805166], length 240
02:07:25.024951 IP 143.110.223.143.22 > 162.243.190.66.33873: Flags [P.], seq 23151744:23152144, ack 961, win 502, options [nop,nop,TS val 1501229005 ecr 2205805166], length 400
02:07:25.025001 IP 143.110.223.143.22 > 162.243.190.66.33873: Flags [P.], seq 23152144:23152384, ack 961, win 502, options [nop,nop,TS val 1501229005 ecr 2205805166], length 240
02:07:25.025052 IP 143.110.223.143.22 > 162.243.190.66.33873: Flags [P.], seq 23152384:23152624, ack 961, win 502, options [nop,nop,TS val 1501229005 ecr 2205805166], length 240
02:07:25.025107 IP 162.243.190.66.33873 > 143.110.223.143.22: Flags [.], ack 23151504, win 959, options [nop,nop,TS val 2205805166 ecr 1501229005], length 0
02:07:25.025116 IP 143.110.223.143.22 > 162.243.190.66.33873: Flags [P.], seq 23152624:23152864, ack 961, win 502, options [nop,nop,TS val 1501229005 ecr 2205805166], length 240
02:07:25.025182 IP 143.110.223.143.22 > 162.243.190.66.33873: Flags [P.], seq 23152864:23153104, ack 961, win 502, options [nop,nop,TS val 1501229005 ecr 2205805166], length 240
02:07:25.025237 IP 143.110.223.143.22 > 162.243.190.66.33873: Flags [P.], seq 23153104:23153504, ack 961, win 502, options [nop,nop,TS val 1501229005 ecr 2205805166], length 400
02:07:25.025288 IP 143.110.223.143.22 > 162.243.190.66.33873: Flags [P.], seq 23153504:23153744, ack 961, win 502, options [nop,nop,TS val 1501229006 ecr 2205805166], length 240
02:07:25.025339 IP 143.110.223.143.22 > 162.243.190.66.33873: Flags [P.], seq 23153744:23153984, ack 961, win 502, options [nop,nop,TS val 1501229006 ecr 2205805166], length 240
02:07:25.025394 IP 143.110.223.143.22 > 162.243.190.66.33873: Flags [P.], seq 23153984:23154464, ack 961, win 502, options [nop,nop,TS val 1501229006 ecr 2205805166], length 480
02:07:25.025447 IP 162.243.190.66.33873 > 143.110.223.143.22: Flags [.], ack 23152864, win 949, options [nop,nop,TS val 2205805167 ecr 1501229005], length 0
02:07:25.025498 IP 143.110.223.143.22 > 162.243.190.66.33873: Flags [P.], seq 23154464:23154864, ack 961, win 502, options [nop,nop,TS val 1501229006 ecr 2205805167], length 400
02:07:25.025554 IP 143.110.223.143.22 > 162.243.190.66.33873: Flags [P.], seq 23154864:23155104, ack 961, win 502, options [nop,nop,TS val 1501229006 ecr 2205805167], length 240
02:07:25.025609 IP 143.110.223.143.22 > 162.243.190.66.33873: Flags [P.], seq 23155104:23155344, ack 961, win 502, options [nop,nop,TS val 1501229006 ecr 2205805167], length 240
02:07:25.025664 IP 143.110.223.143.22 > 162.243.190.66.33873: Flags [P.], seq 23155344:23155584, ack 961, win 502, options [nop,nop,TS val 1501229006 ecr 2205805167], length 240
02:07:25.025718 IP 143.110.223.143.22 > 162.243.190.66.33873: Flags [P.], seq 23155584:23155824, ack 961, win 502, options [nop,nop,TS val 1501229006 ecr 2205805167], length 240
02:07:25.025762 IP 162.243.190.66.33873 > 143.110.223.143.22: Flags [.], ack 23154464, win 937, options [nop,nop,TS val 2205805167 ecr 1501229005], length 0
02:07:25.025815 IP 143.110.223.143.22 > 162.243.190.66.33873: Flags [P.], seq 23155824:23156224, ack 961, win 502, options [nop,nop,TS val 1501229006 ecr 2205805167], length 400
02:07:25.025874 IP 143.110.223.143.22 > 162.243.190.66.33873: Flags [P.], seq 23156224:23156464, ack 961, win 502, options [nop,nop,TS val 1501229006 ecr 2205805167], length 240
02:07:25.025929 IP 143.110.223.143.22 > 162.243.190.66.33873: Flags [P.], seq 23156464:23156704, ack 961, win 502, options [nop,nop,TS val 1501229006 ecr 2205805167], length 240
02:07:25.025993 IP 143.110.223.143.22 > 162.243.190.66.33873: Flags [P.], seq 23156704:23156944, ack 961, win 502, options [nop,nop,TS val 1501229006 ecr 2205805167], length 240
02:07:25.026050 IP 143.110.223.143.22 > 162.243.190.66.33873: Flags [P.], seq 23156944:23157184, ack 961, win 502, options [nop,nop,TS val 1501229006 ecr 2205805167], length 240
02:07:25.026107 IP 143.110.223.143.22 > 162.243.190.66.33873: Flags [P.], seq 23157184:23157424, ack 961, win 502, options [nop,nop,TS val 1501229006 ecr 2205805167], length 240
02:07:25.026164 IP 143.110.223.143.22 > 162.243.190.66.33873: Flags [P.], seq 23157424:23157664, ack 961, win 502, options [nop,nop,TS val 1501229006 ecr 2205805167], length 240
02:07:25.026218 IP 143.110.223.143.22 > 162.243.190.66.33873: Flags [P.], seq 23157664:23157904, ack 961, win 502, options [nop,nop,TS val 1501229006 ecr 2205805167], length 240
02:07:25.026274 IP 143.110.223.143.22 > 162.243.190.66.33873: Flags [P.], seq 23157904:23158144, ack 961, win 502, options [nop,nop,TS val 1501229007 ecr 2205805167], length 240
02:07:25.026330 IP 143.110.223.143.22 > 162.243.190.66.33873: Flags [P.], seq 23158144:23158384, ack 961, win 502, options [nop,nop,TS val 1501229007 ecr 2205805167], length 240
02:07:25.026387 IP 143.110.223.143.22 > 162.243.190.66.33873: Flags [P.], seq 23158384:23158624, ack 961, win 502, options [nop,nop,TS val 1501229007 ecr 2205805167], length 240
02:07:25.026445 IP 143.110.223.143.22 > 162.243.190.66.33873: Flags [P.], seq 23158624:23158864, ack 961, win 502, options [nop,nop,TS val 1501229007 ecr 2205805167], length 240
02:07:25.026501 IP 143.110.223.143.22 > 162.243.190.66.33873: Flags [P.], seq 23158864:23159104, ack 961, win 502, options [nop,nop,TS val 1501229007 ecr 2205805167], length 240
02:07:25.026555 IP 143.110.223.143.22 > 162.243.190.66.33873: Flags [P.], seq 23159104:23159344, ack 961, win 502, options [nop,nop,TS val 1501229007 ecr 2205805167], length 240
02:07:25.026611 IP 143.110.223.143.22 > 162.243.190.66.33873: Flags [P.], seq 23159344:23159584, ack 961, win 502, options [nop,nop,TS val 1501229007 ecr 2205805167], length 240
02:07:25.026668 IP 143.110.223.143.22 > 162.243.190.66.33873: Flags [P.], seq 23159584:23159824, ack 961, win 502, options [nop,nop,TS val 1501229007 ecr 2205805167], length 240
02:07:25.026724 IP 143.110.223.143.22 > 162.243.190.66.33873: Flags [P.], seq 23159824:23160064, ack 961, win 502, options [nop,nop,TS val 1501229007 ecr 2205805167], length 240
02:07:25.026778 IP 143.110.223.143.22 > 162.243.190.66.33873: Flags [P.], seq 23160064:23160304, ack 961, win 502, options [nop,nop,TS val 1501229007 ecr 2205805167], length 240
02:07:25.026846 IP 143.110.223.143.22 > 162.243.190.66.33873: Flags [P.], seq 23160304:23160544, ack 961, win 502, options [nop,nop,TS val 1501229007 ecr 2205805167], length 240
02:07:25.026902 IP 143.110.223.143.22 > 162.243.190.66.33873: Flags [P.], seq 23160544:23160784, ack 961, win 502, options [nop,nop,TS val 1501229007 ecr 2205805167], length 240
02:07:25.026978 IP 143.110.223.143.22 > 162.243.190.66.33873: Flags [P.], seq 23160784:23161024, ack 961, win 502, options [nop,nop,TS val 1501229007 ecr 2205805167], length 240
02:07:25.027033 IP 143.110.223.143.22 > 162.243.190.66.33873: Flags [P.], seq 23161024:23161264, ack 961, win 502, options [nop,nop,TS val 1501229007 ecr 2205805167], length 240
02:07:25.027090 IP 143.110.223.143.22 > 162.243.190.66.33873: Flags [P.], seq 23161264:23161504, ack 961, win 502, options [nop,nop,TS val 1501229007 ecr 2205805167], length 240
02:07:25.027147 IP 143.110.223.143.22 > 162.243.190.66.33873: Flags [P.], seq 23161504:23161744, ack 961, win 502, options [nop,nop,TS val 1501229007 ecr 2205805167], length 240
02:07:25.027201 IP 143.110.223.143.22 > 162.243.190.66.33873: Flags [P.], seq 23161744:23161984, ack 961, win 502, options [nop,nop,TS val 1501229007 ecr 2205805167], length 240
02:07:25.027256 IP 143.110.223.143.22 > 162.243.190.66.33873: Flags [P.], seq 23161984:23162224, ack 961, win 502, options [nop,nop,TS val 1501229008 ecr 2205805167], length 240
02:07:25.027312 IP 143.110.223.143.22 > 162.243.190.66.33873: Flags [P.], seq 23162224:23162464, ack 961, win 502, options [nop,nop,TS val 1501229008 ecr 2205805167], length 240
02:07:25.027368 IP 143.110.223.143.22 > 162.243.190.66.33873: Flags [P.], seq 23162464:23162704, ack 961, win 502, options [nop,nop,TS val 1501229008 ecr 2205805167], length 240
02:07:25.027433 IP 143.110.223.143.22 > 162.243.190.66.33873: Flags [P.], seq 23162704:23162944, ack 961, win 502, options [nop,nop,TS val 1501229008 ecr 2205805167], length 240
02:07:25.027491 IP 143.110.223.143.22 > 162.243.190.66.33873: Flags [P.], seq 23162944:23163184, ack 961, win 502, options [nop,nop,TS val 1501229008 ecr 2205805167], length 240
02:07:25.027546 IP 143.110.223.143.22 > 162.243.190.66.33873: Flags [P.], seq 23163184:23163424, ack 961, win 502, options [nop,nop,TS val 1501229008 ecr 2205805167], length 240
02:07:25.027602 IP 143.110.223.143.22 > 162.243.190.66.33873: Flags [P.], seq 23163424:23163664, ack 961, win 502, options [nop,nop,TS val 1501229008 ecr 2205805167], length 240
02:07:25.027657 IP 143.110.223.143.22 > 162.243.190.66.33873: Flags [P.], seq 23163664:23163904, ack 961, win 502, options [nop,nop,TS val 1501229008 ecr 2205805167], length 240
02:07:25.027712 IP 143.110.223.143.22 > 162.243.190.66.33873: Flags [P.], seq 23163904:23164144, ack 961, win 502, options [nop,nop,TS val 1501229008 ecr 2205805167], length 240
02:07:25.027768 IP 143.110.223.143.22 > 162.243.190.66.33873: Flags [P.], seq 23164144:23164384, ack 961, win 502, options [nop,nop,TS val 1501229008 ecr 2205805167], length 240
02:07:25.027822 IP 143.110.223.143.22 > 162.243.190.66.33873: Flags [P.], seq 23164384:23164624, ack 961, win 502, options [nop,nop,TS val 1501229008 ecr 2205805167], length 240
02:07:25.027885 IP 143.110.223.143.22 > 162.243.190.66.33873: Flags [P.], seq 23164624:23164864, ack 961, win 502, options [nop,nop,TS val 1501229008 ecr 2205805167], length 240
02:07:25.027942 IP 143.110.223.143.22 > 162.243.190.66.33873: Flags [P.], seq 23164864:23165104, ack 961, win 502, options [nop,nop,TS val 1501229008 ecr 2205805167], length 240
02:07:25.027998 IP 143.110.223.143.22 > 162.243.190.66.33873: Flags [P.], seq 23165104:23165344, ack 961, win 502, options [nop,nop,TS val 1501229008 ecr 2205805167], length 240
02:07:25.028054 IP 143.110.223.143.22 > 162.243.190.66.33873: Flags [P.], seq 23165344:23165584, ack 961, win 502, options [nop,nop,TS val 1501229008 ecr 2205805167], length 240
02:07:25.028109 IP 143.110.223.143.22 > 162.243.190.66.33873: Flags [P.], seq 23165584:23165824, ack 961, win 502, options [nop,nop,TS val 1501229008 ecr 2205805167], length 240
02:07:25.028165 IP 143.110.223.143.22 > 162.243.190.66.33873: Flags [P.], seq 23165824:23166064, ack 961, win 502, options [nop,nop,TS val 1501229008 ecr 2205805167], length 240
02:07:25.028220 IP 143.110.223.143.22 > 162.243.190.66.33873: Flags [P.], seq 23166064:23166304, ack 961, win 502, options [nop,nop,TS val 1501229008 ecr 2205805167], length 240
02:07:25.028276 IP 143.110.223.143.22 > 162.243.190.66.33873: Flags [P.], seq 23166304:23166544, ack 961, win 502, options [nop,nop,TS val 1501229009 ecr 2205805167], length 240
02:07:25.028354 IP 143.110.223.143.22 > 162.243.190.66.33873: Flags [P.], seq 23166544:23166784, ack 961, win 502, options [nop,nop,TS val 1501229009 ecr 2205805167], length 240
02:07:25.028435 IP 143.110.223.143.22 > 162.243.190.66.33873: Flags [P.], seq 23166784:23167024, ack 961, win 502, options [nop,nop,TS val 1501229009 ecr 2205805167], length 240
02:07:25.028553 IP 143.110.223.143.22 > 162.243.190.66.33873: Flags [P.], seq 23167024:23167264, ack 961, win 502, options [nop,nop,TS val 1501229009 ecr 2205805167], length 240
02:07:25.028775 IP 143.110.223.143.22 > 162.243.190.66.33873: Flags [P.], seq 23167264:23167504, ack 961, win 502, options [nop,nop,TS val 1501229009 ecr 2205805167], length 240
02:07:25.028846 IP 143.110.223.143.22 > 162.243.190.66.33873: Flags [P.], seq 23167504:23167744, ack 961, win 502, options [nop,nop,TS val 1501229009 ecr 2205805167], length 240
02:07:25.028907 IP 143.110.223.143.22 > 162.243.190.66.33873: Flags [P.], seq 23167744:23167984, ack 961, win 502, options [nop,nop,TS val 1501229009 ecr 2205805167], length 240
02:07:25.028964 IP 143.110.223.143.22 > 162.243.190.66.33873: Flags [P.], seq 23167984:23168224, ack 961, win 502, options [nop,nop,TS val 1501229009 ecr 2205805167], length 240
02:07:25.029020 IP 143.110.223.143.22 > 162.243.190.66.33873: Flags [P.], seq 23168224:23168464, ack 961, win 502, options [nop,nop,TS val 1501229009 ecr 2205805167], length 240
02:07:25.029073 IP 143.110.223.143.22 > 162.243.190.66.33873: Flags [P.], seq 23168464:23168704, ack 961, win 502, options [nop,nop,TS val 1501229009 ecr 2205805167], length 240
02:07:25.029326 IP 143.110.223.143.22 > 162.243.190.66.33873: Flags [P.], seq 23168704:23168944, ack 961, win 502, options [nop,nop,TS val 1501229010 ecr 2205805167], length 240
02:07:25.029397 IP 143.110.223.143.22 > 162.243.190.66.33873: Flags [P.], seq 23168944:23169184, ack 961, win 502, options [nop,nop,TS val 1501229010 ecr 2205805167], length 240
02:07:25.029454 IP 143.110.223.143.22 > 162.243.190.66.33873: Flags [P.], seq 23169184:23169424, ack 961, win 502, options [nop,nop,TS val 1501229010 ecr 2205805167], length 240
02:07:25.029510 IP 143.110.223.143.22 > 162.243.190.66.33873: Flags [P.], seq 23169424:23169664, ack 961, win 502, options [nop,nop,TS val 1501229010 ecr 2205805167], length 240
02:07:25.029565 IP 143.110.223.143.22 > 162.243.190.66.33873: Flags [P.], seq 23169664:23169904, ack 961, win 502, options [nop,nop,TS val 1501229010 ecr 2205805167], length 240
02:07:25.029623 IP 143.110.223.143.22 > 162.243.190.66.33873: Flags [P.], seq 23169904:23170144, ack 961, win 502, options [nop,nop,TS val 1501229010 ecr 2205805167], length 240
02:07:25.029678 IP 143.110.223.143.22 > 162.243.190.66.33873: Flags [P.], seq 23170144:23170384, ack 961, win 502, options [nop,nop,TS val 1501229010 ecr 2205805167], length 240
02:07:25.029733 IP 143.110.223.143.22 > 162.243.190.66.33873: Flags [P.], seq 23170384:23170624, ack 961, win 502, options [nop,nop,TS val 1501229010 ecr 2205805167], length 240
02:07:25.029792 IP 143.110.223.143.22 > 162.243.190.66.33873: Flags [P.], seq 23170624:23170864, ack 961, win 502, options [nop,nop,TS val 1501229010 ecr 2205805167], length 240
02:07:25.029847 IP 143.110.223.143.22 > 162.243.190.66.33873: Flags [P.], seq 23170864:23171104, ack 961, win 502, options [nop,nop,TS val 1501229010 ecr 2205805167], length 240
02:07:25.029903 IP 143.110.223.143.22 > 162.243.190.66.33873: Flags [P.], seq 23171104:23171344, ack 961, win 502, options [nop,nop,TS val 1501229010 ecr 2205805167], length 240
02:07:25.029959 IP 143.110.223.143.22 > 162.243.190.66.33873: Flags [P.], seq 23171344:23171584, ack 961, win 502, options [nop,nop,TS val 1501229010 ecr 2205805167], length 240
02:07:25.030014 IP 143.110.223.143.22 > 162.243.190.66.33873: Flags [P.], seq 23171584:23171824, ack 961, win 502, options [nop,nop,TS val 1501229010 ecr 2205805167], length 240
02:07:25.030069 IP 143.110.223.143.22 > 162.243.190.66.33873: Flags [P.], seq 23171824:23172064, ack 961, win 502, options [nop,nop,TS val 1501229010 ecr 2205805167], length 240
02:07:25.030125 IP 143.110.223.143.22 > 162.243.190.66.33873: Flags [P.], seq 23172064:23172304, ack 961, win 502, options [nop,nop,TS val 1501229010 ecr 2205805167], length 240
02:07:25.030181 IP 143.110.223.143.22 > 162.243.190.66.33873: Flags [P.], seq 23172304:23172544, ack 961, win 502, options [nop,nop,TS val 1501229010 ecr 2205805167], length 240
02:07:25.030304 IP 162.243.190.66.33873 > 143.110.223.143.22: Flags [.], ack 23169184, win 822, options [nop,nop,TS val 2205805171 ecr 1501229006], length 0
02:07:25.030408 IP 143.110.223.143.22 > 162.243.190.66.33873: Flags [P.], seq 23172544:23172784, ack 961, win 502, options [nop,nop,TS val 1501229011 ecr 2205805171], length 240
02:07:25.030471 IP 143.110.223.143.22 > 162.243.190.66.33873: Flags [P.], seq 23172784:23173184, ack 961, win 502, options [nop,nop,TS val 1501229011 ecr 2205805171], length 400
02:07:25.030680 IP 143.110.223.143.22 > 162.243.190.66.33873: Flags [P.], seq 23173184:23173424, ack 961, win 502, options [nop,nop,TS val 1501229011 ecr 2205805171], length 240
02:07:25.030729 IP 162.243.190.66.33873 > 143.110.223.143.22: Flags [.], ack 23172544, win 796, options [nop,nop,TS val 2205805172 ecr 1501229010], length 0
02:07:25.030817 IP 143.110.223.143.22 > 162.243.190.66.33873: Flags [P.], seq 23173424:23173824, ack 961, win 502, options [nop,nop,TS val 1501229011 ecr 2205805172], length 400
02:07:25.030880 IP 143.110.223.143.22 > 162.243.190.66.33873: Flags [P.], seq 23173824:23174064, ack 961, win 502, options [nop,nop,TS val 1501229011 ecr 2205805172], length 240
02:07:25.030955 IP 143.110.223.143.22 > 162.243.190.66.33873: Flags [P.], seq 23174064:23174304, ack 961, win 502, options [nop,nop,TS val 1501229011 ecr 2205805172], length 240
02:07:25.031012 IP 143.110.223.143.22 > 162.243.190.66.33873: Flags [P.], seq 23174304:23174544, ack 961, win 502, options [nop,nop,TS val 1501229011 ecr 2205805172], length 240
02:07:25.031066 IP 143.110.223.143.22 > 162.243.190.66.33873: Flags [P.], seq 23174544:23174784, ack 961, win 502, options [nop,nop,TS val 1501229011 ecr 2205805172], length 240
02:07:25.031123 IP 143.110.223.143.22 > 162.243.190.66.33873: Flags [P.], seq 23174784:23175024, ack 961, win 502, options [nop,nop,TS val 1501229011 ecr 2205805172], length 240
02:07:25.031175 IP 162.243.190.66.33873 > 143.110.223.143.22: Flags [.], ack 23173824, win 786, options [nop,nop,TS val 2205805172 ecr 1501229011], length 0
02:07:25.031227 IP 143.110.223.143.22 > 162.243.190.66.33873: Flags [P.], seq 23175024:23175264, ack 961, win 502, options [nop,nop,TS val 1501229011 ecr 2205805172], length 240
02:07:25.031280 IP 143.110.223.143.22 > 162.243.190.66.33873: Flags [P.], seq 23175264:23175472, ack 961, win 502, options [nop,nop,TS val 1501229012 ecr 2205805172], length 208
02:07:25.031331 IP 143.110.223.143.22 > 162.243.190.66.33873: Flags [P.], seq 23175472:23175712, ack 961, win 502, options [nop,nop,TS val 1501229012 ecr 2205805172], length 240
02:07:25.031382 IP 143.110.223.143.22 > 162.243.190.66.33873: Flags [P.], seq 23175712:23175952, ack 961, win 502, options [nop,nop,TS val 1501229012 ecr 2205805172], length 240
02:07:25.031432 IP 143.110.223.143.22 > 162.243.190.66.33873: Flags [P.], seq 23175952:23176192, ack 961, win 502, options [nop,nop,TS val 1501229012 ecr 2205805172], length 240
02:07:25.031482 IP 143.110.223.143.22 > 162.243.190.66.33873: Flags [P.], seq 23176192:23176432, ack 961, win 502, options [nop,nop,TS val 1501229012 ecr 2205805172], length 240
02:07:25.031533 IP 143.110.223.143.22 > 162.243.190.66.33873: Flags [P.], seq 23176432:23176672, ack 961, win 502, options [nop,nop,TS val 1501229012 ecr 2205805172], length 240
02:07:25.031577 IP 162.243.190.66.33873 > 143.110.223.143.22: Flags [.], ack 23175024, win 777, options [nop,nop,TS val 2205805173 ecr 1501229011], length 0
02:07:25.031627 IP 143.110.223.143.22 > 162.243.190.66.33873: Flags [P.], seq 23176672:23176912, ack 961, win 502, options [nop,nop,TS val 1501229012 ecr 2205805173], length 240
02:07:25.031684 IP 143.110.223.143.22 > 162.243.190.66.33873: Flags [P.], seq 23176912:23177312, ack 961, win 502, options [nop,nop,TS val 1501229012 ecr 2205805173], length 400
02:07:25.031736 IP 143.110.223.143.22 > 162.243.190.66.33873: Flags [P.], seq 23177312:23177552, ack 961, win 502, options [nop,nop,TS val 1501229012 ecr 2205805173], length 240
02:07:25.031868 IP 143.110.223.143.22 > 162.243.190.66.33873: Flags [P.], seq 23177552:23177792, ack 961, win 502, options [nop,nop,TS val 1501229012 ecr 2205805173], length 240
02:07:25.031930 IP 143.110.223.143.22 > 162.243.190.66.33873: Flags [P.], seq 23177792:23178032, ack 961, win 502, options [nop,nop,TS val 1501229012 ecr 2205805173], length 240
02:07:25.031980 IP 143.110.223.143.22 > 162.243.190.66.33873: Flags [P.], seq 23178032:23178272, ack 961, win 502, options [nop,nop,TS val 1501229012 ecr 2205805173], length 240
02:07:25.032000 IP 162.243.190.66.33873 > 143.110.223.143.22: Flags [.], ack 23176912, win 763, options [nop,nop,TS val 2205805173 ecr 1501229011], length 0
02:07:25.032067 IP 143.110.223.143.22 > 162.243.190.66.33873: Flags [P.], seq 23178272:23178512, ack 961, win 502, options [nop,nop,TS val 1501229012 ecr 2205805173], length 240
02:07:25.032124 IP 143.110.223.143.22 > 162.243.190.66.33873: Flags [P.], seq 23178512:23178912, ack 961, win 502, options [nop,nop,TS val 1501229012 ecr 2205805173], length 400
02:07:25.032192 IP 143.110.223.143.22 > 162.243.190.66.33873: Flags [P.], seq 23178912:23179152, ack 961, win 502, options [nop,nop,TS val 1501229012 ecr 2205805173], length 240
02:07:25.032250 IP 143.110.223.143.22 > 162.243.190.66.33873: Flags [P.], seq 23179152:23179392, ack 961, win 502, options [nop,nop,TS val 1501229013 ecr 2205805173], length 240
02:07:25.032308 IP 143.110.223.143.22 > 162.243.190.66.33873: Flags [P.], seq 23179392:23179632, ack 961, win 502, options [nop,nop,TS val 1501229013 ecr 2205805173], length 240
02:07:25.032368 IP 162.243.190.66.33873 > 143.110.223.143.22: Flags [.], ack 23178272, win 753, options [nop,nop,TS val 2205805174 ecr 1501229012], length 0
02:07:25.032417 IP 143.110.223.143.22 > 162.243.190.66.33873: Flags [P.], seq 23179632:23179872, ack 961, win 502, options [nop,nop,TS val 1501229013 ecr 2205805174], length 240
02:07:25.032477 IP 143.110.223.143.22 > 162.243.190.66.33873: Flags [P.], seq 23179872:23180272, ack 961, win 502, options [nop,nop,TS val 1501229013 ecr 2205805174], length 400
02:07:25.032534 IP 143.110.223.143.22 > 162.243.190.66.33873: Flags [P.], seq 23180272:23180352, ack 961, win 502, options [nop,nop,TS val 1501229013 ecr 2205805174], length 80
02:07:25.032641 IP 162.243.190.66.33873 > 143.110.223.143.22: Flags [.], ack 23179632, win 743, options [nop,nop,TS val 2205805174 ecr 1501229012], length 0
02:07:25.046984 IP 143.110.223.143.22 > 162.243.190.66.33873: Flags [P.], seq 23180272:23180352, ack 961, win 502, options [nop,nop,TS val 1501229027 ecr 2205805174], length 80
02:07:25.047416 IP 162.243.190.66.33873 > 143.110.223.143.22: Flags [.], ack 23180352, win 738, options [nop,nop,TS val 2205805189 ecr 1501229013,nop,nop,sack 1 {23180272:23180352}], length 0
02:07:25.503633 IP 162.243.190.66.33873 > 143.110.223.143.22: Flags [P.], seq 961:993, ack 23180352, win 1384, options [nop,nop,TS val 2205805645 ecr 1501229013], length 32
02:07:25.503634 IP 162.243.190.66.33873 > 143.110.223.143.22: Flags [P.], seq 993:1025, ack 23180352, win 1384, options [nop,nop,TS val 2205805645 ecr 1501229013], length 32
02:07:25.503834 IP 143.110.223.143.22 > 162.243.190.66.33873: Flags [.], ack 1025, win 502, options [nop,nop,TS val 1501229484 ecr 2205805645], length 0
^C
101998 packets captured
102151 packets received by filter
152 packets dropped by kernel